[
  {
    "question": "אם הטלנו על מפר עיצום כספי, והוא חזר על אותה הפרה שוב, איזה סכום עיצום אני מוסמך להטיל עליו?",
    "reference_answer": "עיצום כפול",
    "rag_answer": "התשובה לשאלה זו אינה זמינה במקורות שסופקו. אנא ספק מקורות נוספים או פרטים נוספים כדי שאוכל לסייע לך בצורה מדויקת יותר.",
    "contexts": [
      "13. לאחר כחודש מהמועד הנ״ל שנקבע לעותרת, התקשר לעותרת נציג שירותי הביטחון ושוחח איתה בטלפון בעניין המניעה, ושאל אותה שאלות שונות וכלליות, והתמקד בנושא משיכת כספים באמצעות כרטיס האשראי מכספומט בהזדמנויות שונות. העותרת השיבה לנציג כי אכן משכה כספים באמצעות כרטיס האשראי מחשבונה המתנהל בבנק אלערבי שבירדן, אולם מדובר במשיכות בסכומים קטנים ששימשו אותה כדמי כיס, כמתנות לחתונות בני משפחח, לרכישת מכונת כביסה, לרכישת ארון ולתיקון צבע בבית שלה בקראות בני חסן- שבנפת סלפית ובסך הכל משכה כ- 2000 דינאר ירדני סכום השווה ל- 10,000 שקלים.\n14. הנציג סיים את השיחה והודיע לעותרת כי יחזור אליה בתשובה אולם עד היום לא חזר אליה.\n15. ביום 14.10.21, פנה כ״כ המבקשת דאז למשיב לברר מה עלה בגורלה של בקשת המבקשת, וקיבל באותו יום תשובה כי \" המל הועלה לאבחון חו\"ל\". רצ״ב תשובת המשיב מיום 14.10.21 ומסומנת כנספח \"ב\".",
      "1. העותר יטען לשם הבהרת התמונה המעוות והלא שלמה שהוגשה לכב׳ ביהמ״ש ע״מ להשחיר את פניו של העותר כמפר חוק ואינו ועתירתו אינה ראויה להתייחסות!\n2. העותר יטען כי כאשר הגיש את עתירתו לא צורפה לה את החשבונית בתום לב מייד לאחר הערת ב״כ המשיבים העותר המציא באמצעות דואר אלקטרוני את העתק מהחשבונית ע״ס 11,000 ₪.\n● רצ״ב העתק חשבונית מסומנת באות א׳ ומהווה חלק בלתי נפרד מכתב העתירה.\n3. העותר יטען כי בכתב התשובה של המשיבים צויין כי העותר נכנס בשעות הבוקר המוקדמות לכן עלה חשד כי בעצם הינו פועל ואינו סוחר!\n4. העותר יטען כי במעבר אף אחד לא העיר לו כי אסור לו לכנס בשעות אלו לא רק זאת כל הסוחרים נכנסים גם הם באותה שעה באין מפרע ואף אחד לא מונע מהם .!!\n5. העותר יטען כי כאשר הח״מ הסבירה לו כי הוא חשוד בשימוש בלתי חוקי הוא נדהם לגלות שהכוונה בעצם לשימוש לא חוקי הינו כניסת בשעות מוקדמות ..",
      "בקשה להיתר חדש, אשר סורבה כאמור עקב הטלת המניעה הביטחונית. 7. למען השלמה התמונה, יצוין כי העותר פנה מיוזמתו למת״ק וביקש לשוחח עם גורמי הביטחון על מצבו כדי להבין מדוע הוטלה המניעה הביטחונית. במסגרת שיחה קצרה מאוד, הוא טען שאינו מבין מדוע הוטלה המניעה הביטחונית ונאמר לו שקיים מידע שלילי נגדו שמקורו \"בהלשנה\".",
      "9. העותר יטען ובצדק החשבונית שיש בידיו ושצורפה לתגובה זו הינה ע״ס 11,000 ₪ מחודש יוני2020.\n10. העותר יטען כי התבקש לצרף לפחות שתי חשבוניות ע״ס 10,000 לכל אחת מהן בחודשים 4/2020 5/20201 !!\n11. העותר מצהיר כי בחודשים 04/2020 ו 05/2020 לא נכנס בכלל לישראל ולא קנה סחורה בישראל לכן אין בראשותו חשבוניות בחודשים אלו !!!!\n12. העותר יטען כי הוא נכנס בחודשים 01/2020, 02/2020 ועד 05.032020 זה היום האחרון בו נכנס לישראל.\n13. העותר יטען כי את החשבונית לחודשים 01/2020 ו 02/2020 הוא הפקיד אצל רשות המס ברשות והוא נסע אליהם במיוחד וביקש מהם לשחזר את החשבונית שהוא הפקיד אצלהם.\n14. העותר יטען כי עד היום לא קיבל תשובה מרשות המס ברשות הפלסטינאית סניף טול כרם והם הבטיחו לו לעשות מאמצים למצוא.\n15. העותר יטען כי כל החשבוניות חייבות לעבור דרך הרשות לחתימה ולאישור ולאחר שמשלמים את המס.",
      "עת״מ 45133-08-20\nהעותר\nבבית משפט המחוזי בירושלים בשבתו כבית משפט לעניינים מנהליים בעניין שבין:\nמחמוד אחמד מחמוד מראעבה ת.ז 850472929.\nטול כרם ע״י ב״כ עוה״ד סוהיר נסאר מ.ר 54447 רח׳ ראשי טורעאן 16950, ת.ד 475 טל: 046/518228 פקס: 046/412056 פלאפון: 052/2571165 נ.ג.ד\nמדינת ישראל באמצעות :- 1. מתאם פעולות הממשלה בשטחים. 2. מפקד כוחות צה״ל באזור יהודה ושומרון. 3. מנהלת תיאום וקישור טולכרם. כולם ע״י פרקליטות המדינה מחוז ירושלים רח׳ מח״ל 7 מעלות דפנה, ת.ד 49333ירושלים 191493\nהמשיבים\nתגובת העותר על התגובה המקדמית\nהעותר מתכבד בזאת להגיש את תגובתו על התגובה המקדמית שהוגשה מטעם המשיבים ע״י בא כוחה כדלקמן:\n1. העותר יטען לשם הבהרת התמונה המעוות והלא שלמה שהוגשה לכב׳ ביהמ״ש ע״מ להשחיר את פניו של העותר כמפר חוק ואינו ועתירתו אינה ראויה להתייחסות!",
      "לא נפגש עם האנשים שצוינו בשיחה, חוץ משלום וזהו.\n24 העותר ביקש ממני לבקש לתקן לו הפרפרזה. הוא עומד להתפוצץ - מה אני חזית עממית, אני לא. הוא 25 עמד לקבל דום לב. אינו רוצה שייכתב שהוא מזוהה עם החזית העממית. הוא אינו מזוהה. זה הכל.\n26 בן אדם שהייתה לו מתפרה, ואני מפנה להנחיות שחזרו, וכעת אין לו כסף לעשות עוד כסף ואין לו 27 כסף לקיים פרויקט קטן ממנו יוכל לחיות. הוא עובד בשיפוצים ורוצה לפרנס בכבוד. המתפרה\n28 העסיקה 23 עובדות.\n1\nישראל\nבית המשפט המחוזי בירושלים בשבתו כבית-משפט לעניינים מנהליים בפני כב׳ הנשיא משה סובל\n08 פברואר 2023\nעת״מ 64852-12-22 אבו חאטר נ׳ מדינת ישראל\n1 לשאלת בית המשפט, אני משיבה כי היה לו היתר. תקופה הוא עבד עם כל מיני חברות ישראליות 2 שעוסקות בייצור בגדים. הוא ביקש ממני לבדוק האפשרות אם יש איזשהו הליך שבו הוא רוצה לדחות 3\nאת האמור בפרפרזה.\n4\n5\nב״כ העותר יוצאת מאולם בית המשפט.",
      "שם: אחמד חריזאת סכום לתשלום: 2,117.00 ש״ח מועד אחרון לתשלום: 12 מרץ 2023\nלידיעתכם, עליכם לעשות שימוש בשובר תוך 14 יום. אם ייעשה שימוש בשובר, לאחר 14 יום יוחזרו הכספים ששולמו על-פיו ללא תוספת הפרשי הצמדה וריבית.\nככל ששובר זה שולם ולא נעשה בו שימוש, באפשרותך להשתמש בקבלה לצורך הגשח חדשה בגובה הסכום ששולם בלבד. ככל שהנך מעוניין כי כספי האגרה / בקשה יוחזרו לך, אנא פנה באמצעות כתובת דואר אלקטרוני. שלהלן: hehzer@court.gov.il בפנייתך יש לצרף קבלה ולציין את שמו המלא של המוטב, מספר ת״ז וכתובת מלאה ועדכנית למשלוח ההמחאה. סכום האגרה/ בקשה יוחזר לך באמצעות המחאה \"למוטב בלבד\" אשר תשלח לך בדואר.\nאמצעי התשלום",
      "5. העותר יטען כי כאשר הח״מ הסבירה לו כי הוא חשוד בשימוש בלתי חוקי הוא נדהם לגלות שהכוונה בעצם לשימוש לא חוקי הינו כניסת בשעות מוקדמות ..\n6. העותר יטען כי לאחר שהוא ידע כי אסור לו לכנס בשעות הבוקר המקדמות וכי הינו חייב לכנס בשעות שרשומים ומודפסים על גבי ההיתר הוא מתחייב בפני כב׳ ביהמ״ש לא לכנס בשעות מוקדמות יותר.\n7. העותר יטען כי בעתירתו הסביר מדוע היה מעדיף לכנס בשעות מוקדמות כי בשעות אלו כל הסחורות הינן מסוג \"א\" ונחשבות הטובות ביותר ומי שמקדים בהגעה זוכה לסחורה מצויינת.\n8. העותר יטען כי בכתב התגובה העותר מסיק כי הסיבה לסירוב הינה אי עמידה בקריטריונים שכן חייב להציג שלוש חשבוניות שכל אחת מהן כ 10,000 ₪ לשלושה חודשים אחרונים!\n9. העותר יטען ובצדק החשבונית שיש בידיו ושצורפה לתגובה זו הינה ע״ס 11,000 ₪ מחודש יוני2020.\n10. העותר יטען כי התבקש לצרף לפחות שתי חשבוניות ע״ס 10,000 לכל אחת מהן בחודשים 4/2020 5/20201 !!",
      "פלסטיני, אשר תבע אותו ודרש ממנו כספים, כביכול בעבור הסרת המניעה הביטחונית מעל העותר בשנת 2020. טענות העותר בבית המשפט התקבלו, ונקבע שהוא אינו חייב כספים, אולם לאור אופי הסכסוך ומסרים שהעביר המתווך שטען שהוא מקושר לגורמי הביטחון, יתכן שמידע שקרי נמסר לגורמי הביטחון כדי \"לנקום\" בעותר או כדי לגרום לו לשלם כספים. 9. העותר אינו יודע מדוע הוטלה נגדו מניעה ביטחונית לפני מספר חודשים, ומדוע סירבו המשיבים להסירה. המשיבים הזמינו את העותר לתשאול רק לאחר שהם סירבו לבקשתו להסרת המניעה, ובמהלך התשאול הוא נשאל אך ורק על אירועים ישנים, שהתרחשו לפני שנים, ושלאחריהם הוא קיבל היתר תעסוקה.",
      "14. העותר יטען כי עד היום לא קיבל תשובה מרשות המס ברשות הפלסטינאית סניף טול כרם והם הבטיחו לו לעשות מאמצים למצוא.\n15. העותר יטען כי כל החשבוניות חייבות לעבור דרך הרשות לחתימה ולאישור ולאחר שמשלמים את המס.\n16. העותר יטען כי לא ניתן לבקש ממנו להמציא חשבוניות על רכישה שעה שהוא בכלל לא נכנס בחודשים שצוינו לעיל.\n17. העותר יטען שוב כי לגבי השעות הינו מבטיח לא לכנס אלא בשעות שמותר לו לעבור.\n18. העותר יטען כי למשל במעבר אלג׳למה שם יש הקפדה על הכניסה ולא מרשים לכנס אלא בשעות מדויקות ובמעברים אחרים כמו מעבר טייבה אין הקפדה מכאן כל תושבי האיזור יודעים איפה מקפידים והיכן מאפשרים לעבור בצורה חופשית ומכאן הבלבול והתחושה אצל אוכלוסיה ניכרת של תושבי האזור כי בעצם מותר להם לכנס בשעות\nהמוקדמות וזה מה שהעותר הבין כמו כולם אך מהיום ברור לו שחייב לציית ולהקפיד לכנס בשעה המצוינת על גבי ההיתר."
    ]
  },
  {
    "question": "אילו נהלים יש לגבש כדי להטיל עיצומים כספיים בתחום מסוים?",
    "reference_answer": "א.נוהל לבחירת אמצעי אכיפה ב.נוהל לניתוב תיקים בין אכיפה מנהלית לפלילית ג. נוהל הפחתות",
    "rag_answer": "המידע הנוגע לנהלים שיש לגבש כדי להטיל עיצומים כספיים בתחום מסוים אינו מופיע במפורש במקורות שסופקו. עם זאת, ניתן להבין מהמקורות כי יש למצות את ההליכים במישור המינהלי לפני פנייה לערכאות משפטיות, וכי יש צורך בתיקוני חקיקה ועדכונים רגולטוריים כדי לאפשר אכיפה אפקטיבית של עיצומים כספיים.\n\nלדוגמה, בדוח מבקר המדינה נכתב כי \"תיקון הצו בנושא אכיפת עבירות מינהליות, אשר משרד הביטחון הגדירו כנושא לטיפול שנמצא בסדר עדיפות גבוה (א׳), נכלל בתוכנית העבודה של לשכת יועמ״ש איו״ש לשנת 2018, ובמועד סיום הביקורת טרם תוקן\" ([דוח מבקר המדינה](https://tikshuv.sharepoint.com/sites/syntaxOcrTest/DocLib1/Forms/AllItems.aspx?id=/sites/syntaxOcrTest/DocLib1/%D7%A2%D7%A0%D7%A3%20%D7%91%D7%99%D7%98%D7%97%D7%95%D7%9F/%D7%9E%D7%93%D7%95%D7%A8%20%D7%90%D7%95%D7%9B%D7%9C%D7%95%D7%A1%D7%99%D7%9F/%D7%90.%20%D7%9B%D7%A0%D7%99%D7%A1%D7%94%20%D7%9C%D7%99%D7%A9%D7%A8%D7%90%D7%9C/%D7%92.1.%20%D7%94%D7%9C%D7%99%D7%9B%D7%99%D7%9D%20%D7%9E%D7%A9%D7%A4%D7%98%D7%99%D7%99%D7%9D%20%D7%95%D7%A4%D7%A0%D7%99%D7%95%D7%AA%20-%20%D7%9E%D7%98%D7%A8%D7%95%D7%AA%20%D7%9B%D7%A0%D7%99%D7%A1%D7%94%20%D7%9C%D7%99%D7%A9%D7%A8%D7%90%D7%9C/%D7%AA%D7%A2%D7%A1%D7%95%D7%A7%D7%94%20%D7%91%D7%99%D7%A9%D7%A8%D7%90%D7%9C/%D7%9E%D7%95%D7%93%D7%9C%20%D7%94%D7%AA%D7%A2%D7%A1%D7%95%D7%A7%D7%94%20%D7%94%D7%97%D7%93%D7%A9/%D7%93%D7%95%D7%97%D7%95%D7%AA/%D7%93%D7%95%D7%97%20%D7%9E%D7%91%D7%A7%D7%A8%20%D7%94%D7%9E%D7%93%D7%99%D7%A0%D7%94.pdf&parent=/sites/syntaxOcrTest/DocLib1)).\n\nלכן, ניתן להסיק כי יש צורך בתיקוני חקיקה ועדכונים רגולטוריים כדי לאפשר אכיפה אפקטיבית של עיצומים כספיים, וכי יש למצות את ההליכים במישור המינהלי לפני פנייה לערכאות משפטיות.",
    "contexts": [
      "כי יש למצות את ההליכים במישור המינהלי. משקיים מסלול חלופי שבגדרו ניתן להעלות טענות עקרוניות או פרטניות כנגד האיסור על שדרוגם של תושבי אזור השוהים בישראל תקופה ארוכה (מבלי להכריע בשאלה אם המסלול המתאים הוא במסגרת עתירה לבית-משפט זה או במסגרת אחרת), איני רואה מקום בשלב זה למתן סעד חוקתי. התערבות בחוק של הכנסת - ודאי לאחר שהוא נמצא חוקתי בשני פסקי-דין שניתנו בהרכבים מורחבים של בית- משפט זה - צריכה לשמש בנסיבות כאמצעי אחרון אשר יש לפנות אליו רק לאחר מיצוי דרכים משפטיות אחרות, ככל שישנן כאלה. כך יש לנהוג במקרה שלפנינו\" (פסקה 24 לחוות-דעתה).",
      "בית משפט המחוזי ירושלים\t   עת\"מ 30206-07-23\nבשבתו כבית משפט לעניינים מנהליים\nבפני כבוד השופט נמרוד פלקס\t\n\t\t\nהעותרים:\t\t \t1. נדים נצאר ת\"ז 954766473\n\t\t\t2. אחמד נצאר ת\"ז 859778151\n\t\t \tע\"י ב\"כ עו\"ד מור סוקר (מ.ר. 65650) \n\t\t\tמרח' ז'בוטינסקי 33 רמת גן, מגדל התאומים 1 קומה 11\n\t\t \tטל': 03-5750750; 054-4312005 פקס: 077-4701867\n-  נ  ג  ד  -\nהמשיבים:                         1. מפקד כוחות צה\"ל בגדה המערבית \n2. המנהל האזרחי לאזור יהודה ושומרון\n3. שרות הביטחון הכללי \n\tע\"י פרקליטות מחוז ירושלים - אזרחי\n\t\t \tמרח' מח\"ל 7, ירושלים 9149301 ת\"ד 49333\n\t\t \tטל': 073-3920000 פקס: 02-6468053\n\t\t \tכתובת דוא\"ל: ez-jer@justice.gov.il\nבקשה לפסיקת הוצאות מטעם המשיבים\nבהתאם לפסק דינו של בית המשפט הנכבד מיום 14.11.2023, מתכבדים המשיבים להגיש את טיעוניהם בבקשה לפסיקת הוצאות, בגין ניהול העתירה בהליך דנא. זאת מהטעמים שיפורטו להלן:",
      "יחד עם זאת, לאור כלל המפורט לעיל, יתבקש בית המשפט הנכבד לפסוק הוצאות לטובת המשיבים כנגד העותרות. כאמור, העותרות חטאו בהעלמת פרטים ועובדות, תוך הפגנת חוסר ניקיון כפיים, ומן הדין היה לדחות את עתירתן על הסף. \nהמשיבים נצרכו לטיפול ולהשקעת משאבים מצד גורמים רבים, כדוגמת המחלקה המשפטית במינהל האזרחי וכן גורמי הפרקליטות, שאף נדרשת כעת להכנת תגובה זו, ולפיכך הדבר מזכה בפסיקת הוצאות לטובת המינהל האזרחי. \nאשר על כן, בית המשפט הנכבד מתבקש לדחות את בקשת העותרות לפסיקת הוצאות ולחייבן בהוצאות לטובת המשיבים.",
      "שנדרשו לניהולו ובהתנהלות בעלי הדין (השוו תקנה 151 לתקנות סדר הדין האזרחי, תשע\"ט-2018).\" עת\"מ (מינהליים י-ם) 35346-11-21 ניפין גרקוד נ' מתאם פעולות הממשלה בשטחים (נבו 16.08.2022)‏‏, פס' 12 לפסק דינו של כבוד הנשיא סובל.",
      "כי יש למצות את ההליכים במישור המינהלי. משקיים מסלול חלופי שבגדרו ניתן להעלות טענות עקרוניות או פרטניות כנגד האיסור על שדרוגם של תושבי אזור השוהים בישראל תקופה ארוכה (מבלי להכריע בשאלה אם המסלול המתאים הוא במסגרת עתירה לבית-משפט זה או במסגרת אחרת), איני רואה מקום בשלב זה למתן סעד חוקתי. התערבות בחוק של הכנסת - ודאי לאחר שהוא נמצא חוקתי בשני פסקי-דין שניתנו בהרכבים מורחבים של בית-משפט זה - צריכה לשמש בנסיבות כאמצעי אחרון אשר יש לפנות אליו רק לאחר מיצוי דרכים משפטיות אחרות, ככל שישנן כאלה. כך יש לנהוג במקרה שלפנינו\" (פסקה 24 לחוות-דעתה; ההדגשה לא במקור).",
      "ברי כי בהתאם לנהלי המשיב, המועד לקיום אבחון בטחוני חדש, ייספר רק החל האבחון האחרון שבוצע בעניינם של העותרים. \nלצד זאת, גורמים משפטיים בשירות הבטחון הכללי ובמינהל האזרחי, נדרשו לבחינת טענותיהם המשפטיות של העותרים, אשר אינן מבוססות ואין להן כל אחיזה בדין. העותרים מודעים להלכת בית המשפט הנכבד והלכות בית המשפט העליון לפניו, כי הם אינם מחזיקים בכל זכות כניסה או שהייה ב/לישראל, ועל כן עתירתם נגועה בהעדר עילה מעת הגשתה.",
      "של הצו תדרוש מספר תיקוני חקיקה, ובפרט, תדרוש את עדכון התוספת לצו, הקובעת את העבירות המנהליות\". יצוין כי יועמ״ש איו״ש כתב כי תיקון הצו בנושא אכיפת עבירות מינהליות, אשר משרד הביטחון הגדירו כנושא לטיפול שנמצא בסדר עדיפות גבוה (א׳), נכלל בתוכנית העבודה של לשכת יועמ״ש איו״ש לשנת 2018, ובמועד סיום הביקורת טרם תוקן. בפברואר 2019 מסר קמ״ט תעסוקה לצוות הביקורת כי אין לו כלים אפקטיביים לאכיפת הדין על מעסיקים שמבצעים שימוש חריג בהיתרי העסקה באיו״ש, שכן באיו״ש - שלא כמו בישראל - אין מנגנון של הטלת קנסות מינהליים על מעסיקים הפועלים שלא כדין. עוד מסר כי אכיפה פלילית היא מסורבלת, ולכן לא נעשה בה שימוש. לדבריו, האכיפה שהוא מבצע מסתכמת בשלילת אישורים נקודתיים ממעסיקים שהפרו את תנאי ההיתר.",
      "לאור פרוץ מלחמת \"חרבות ברזל\", הדיון שהיה קבוע ליום 18.10.2023 בוטל. העותרים, לאחר ששקלו את שיקוליהם, בחרו להגיש ביום 14.11.2023 בקשה למחיקת העתירה. המשיבים הסכימו לבקשת העותרים, אך יטענו כי יש לחייב אותם בהוצאותיהם לאור הטיפול הרב בעתירה, שנדרש ממספר לא מבוטל של גורמים בכמה גופי מדינה, עד לאחר הגשת התגובה.",
      "כי יש למצות את ההליכים במישור המינהלי. משקיים מסלול חלופי שבגדרו ניתן להעלות טענות עקרוניות או פרטניות כנגד האיסור על שדרוגם של תושבי אזור השוהים בישראל תקופה ארוכה (מבלי להכריע בשאלה אם המסלול המתאים הוא במסגרת עתירה לבית-משפט זה או במסגרת אחרת), איני רואה מקום בשלב זה למתן סעד חוקתי. התערבות בחוק של הכנסת - ודאי לאחר שהוא נמצא חוקתי בשני פסקי-דין שניתנו בהרכבים מורחבים של בית- משפט זה - צריכה לשמש בנסיבות כאמצעי אחרון אשר יש לפנות אליו רק לאחר מיצוי דרכים משפטיות אחרות, ככל שישנן כאלה. כך יש לנהוג במקרה שלפנינו\" (פסקה 24 לפסק דינה של כב׳ הנשיאה נאור).",
      "לדוגמה, העותרים טענו להבדל משפטי מהותי בין תושב שהחזיק בהיתר כניסה לישראל לצרכי תעסוקה בעבר לבין תושב שמבקש היתר תעסוקה לראשונה. בין היתר, העותרים טענו כי לראשונים נצברות זכויות מנהליות כגון זכות טיעון, שימוע וחובת הנמקה לרשות. בנוחות יתר בוחרים העותרים להתבסס על פסיקה שאינה רלוונטית לתושבי אזור המבקשים להיכנס לישראל לצרכי תעסוקה, ובוחרים להתעלם מהלכת בתי המשפט המנהליים כי אף תושב אינו מחזיק בזכות קנויה לקבל היתר או להחזיק בו, מעת שניתן לו, וממילא אין כל תושב איו\"ש המחזיק בזכות שהייה בישראל. \nמתווספת על כך עבודת גורמי הפרקליטות- הטיפול בתיק מעת המצאת העתירה לפרקליטות, הצורך לבירור הטענות המשפטיות החדשות שהועלו על ידי העותרים, תיאום העמדה מול גורמי הבטחון וגורמי המינהל האזרחי, וניסוח התגובה ואישורה. \nעוד יצוין כי הגורמים במדינה טיפלו בהליך, בהינתן עומס העבודה הכבד המוטל על כלל גורמים המעורבים כמתואר לעיל."
    ]
  },
  {
    "question": "לאיזה ערכאה ניתן לערער על עיצום כספי?",
    "reference_answer": "לא ניתן להגיש ערעור לבית המשפט הצבאי. כיום סמכות הערעור נתונה לבית המשפט העליון בשבתו כבג\"ץ",
    "rag_answer": "התשובה לשאלה זו אינה זמינה במקורות שסופקו. אנא ספק מקורות נוספים או פרטים נוספים כדי שאוכל לסייע לך.",
    "contexts": [
      "שיש לכך קשר לדרישה הכספית הבלתי מוצדקת. 11. המבקש סבור כי אין עוד סיבה לקבוע שנשקפת ממנו סכנה. 12. לאור האמור, מבוקש להסיר את המניעה המונעת מן המבקש לקבל היתרי כניסה לישראל. אנא העבירו בקשה זו לבחינת גורמי הביטחון המוסמכים, בהקדם האפשרי.",
      "מטרת הנוהל: הגדרת אופן הטיפול במכסות שמורות של תושב פלסטיני שהועסק בענף הבניה; אופן הארכת שמירת מכסה וכן ביטול מכסה. \nשמירת מכסה אוטומטית לתושב פלסטיני- קריטריונים:\nשמירת המכסה תתאפשר עבור תושב פלסטיני שסיים את עבודתו בסקטור הבניין, בין אם פוטר, התפטר או הושהה מהעבודה בשל פציעה/ נסיבות אישיות ייחודיות, שלו או של מעסיקו (רישיונו הופסק). \nתושב שמעסיקו דיווח על הפסקת העסקתו, או אשר לא דווחו עבורו תלושי שכר תישמר עבורו המכסה ל-60 ימים ממועד פקיעת הרישיון, למעט במקרים שיצויינו בנוהל זה.  \nשמירת מכסה לתושב לא תתאפשר במקרים הבאים:\nתושב אשר הוזנה בעניינו מניעת כניסה לישראל, למעט מניעות \"אג\"ם – קורונה\", המוזנות לתקופה זמנית, על רקע החשש להידבקות בנגיף הקורונה.\nתושב אשר הונפק לו רישיון עבודה באזור (תעסוקה בהתיישבות) או היתר מסחר/BMC.\nתושב שהודיע בתום העסקתו, כי אינו מעוניין בשמירת מכסה.",
      "החלטה בבקשה: \nהבקשה תועבר למשרד קמ\"ט תעסוקה במנהל האזרחי, אשר ייבחן את עמידת הבקשה בקריטריונים ואת קיומן של נסיבות חריגות בעניינו של התושב. \nהחליט הקמ\"ט לאשר את הבקשה – תועבר הודעה בעניין לתושב תוך ציון מספר הימים הנוספים לשמירת המכסה. \nבמידה שהחליט לסרב את הבקשה – יעביר את החלטתו המנומקת לפונה. \nמכל מקום, לא תעלה תקופת הארכת המכסה על 30 ימים. \nערעור:\nבמידה שלא יסופק התושב מהחלטת קמ\"ט תעסוקה, יוכל להגיש ערר אל מוקד פניות המנהא\"ז. הערר יבחן ע\"י ראש ענף אזרחי במנהא\"ז.\nבבקשת הערר (מצ\"ב בנספח ב'), יש לפרט את הסיבות שבגינן מבקש התושב לבחון בשנית את בקשתו לשמירת מכסה, וכמו כן, יש להוסיף את כלל המסמכים התומכים טענות אלו לרבות הבקשה המקורית והחלטת קמ\"ט תעסוקה.",
      "הצעת \"קו לעובד\" מבקשת לייתר את הקצאת ההיתרים לקבלנים השונים באופן פרטני על ידי מעבר לשיטת הקצאה ענפית כללית. מסך המכסה הענפית הכללית יוכל כל קבלן בענף הבניין והשיפוצים, הרשום בפנקס הקבלנים, להעסיק עובדים פלסטינים שבידם רישיון עבודה בבניין, ללא הגבלה מספרית. לדעתנו שיטה זו טובה לאין ערוך מזו המקובלת כיום, והיא עשויה למנוע הפרות חוק\nוכשלי התנהלות.\nאיך תעבוד השיטה?",
      "להלן יפורטו הקריטריונים לשמירת מכסה:\nנשמרה עבורו מכסה למשך 60 ימים. \nאין לתושב מניעה.\nיש לתושב כר\"ח בתוקף.\nלתושב אין היתר מסוג מסחר/BMC או רישיון תעסוקה בהתיישבות.\nקיימות נסיבות אובייקטיביות אשר סבר הגורם המוסמך שיש בהן כדי למנוע מציאת מעסיק ומצדיקות את הארכת המכסה בעניינו, כדוגמת מצב רפואי שלו או של קרוב משפחה מדרגה ראשונה. \nאופן העברת הבקשה:\nיש לצרף את המסמכים הבאים:\nצילום ת\"ז.\nטופס בקשה (מצ\"ב בנספח).\nמסמכים רלוונטיים המעידים על הצורך החריג של התושב בהארכת שמירת המכסה.\nהבקשה תוגש למוקד פניות הציבור במנהל האזרחי בכתובת: mgar@mnz.gov.il ולא יאוחר מ-7 ימים בטרם מועד פקיעת המכסה. \nהחלטה בבקשה: \nהבקשה תועבר למשרד קמ\"ט תעסוקה במנהל האזרחי, אשר ייבחן את עמידת הבקשה בקריטריונים ואת קיומן של נסיבות חריגות בעניינו של התושב.",
      "הצעת \"קו לעובד\" מבקשת לייתר את הקצאת ההיתרים לקבלנים השונים באופן פרטני על ידי מעבר לשיטת הקצאה ענפית כללית. מסך המכסה הענפית הכללית יוכל כל קבלן בענף הבניין והשיפוצים, הרשום בפנקס הקבלנים, להעסיק עובדים פלסטינים שבידם רישיון עבודה בבניין, ללא הגבלה מספרית. לדעתנו שיטה זו טובה לאין ערוך מזו המקובלת כיום, והיא עשויה למנוע הפרות חוק וכשלי התנהלות.\nאיך תעבוד השיטה?",
      "השירות בנוגע לבקשה כזו. 11. נציגי הפרקליטות וייעוץ וחקיקה הוסיפו כי אף בהינתן חוות דעת, נראה שיהיה מקום לפרט תבחינים להפעלת הסמכות בשים לב לנסיבות כל מקרה, למשל תוצאות הפיגוע בו מדובר, מיקומו של המבקש בתוך מעגל ה\"חמולה\", חלוף הזמן מאז נשלל ההיתר - כל זאת כדי לבסס הפעלה סבירה של הסמכות, מעבר לשאלת הסמכות. 12. אשר להצעת משרד הביטחון לבחון אפשרות לבסס את הסמכות בנוסף, או לחילופין, על סעיף 3ד לחוק - הוסכם על כלל משתתפי הדיון שישנו הבדל בין תכליתו של סעיף 3ד לחוק לבין התכלית ההרתעתית שבבסיס החלטת הקבינט. עם זאת, נראה שנדרש ליבון נוסף של הנושא ובפרט של השאלה אם ואיזו חוות דעת נדרשת לצורך הפעלת הסמכות במסלול זה.",
      "הנחיות נוספות:\nבמידה שהוחלט להאריך באופן חריג את שמירת המכסה, יקבל התושב הודעה בנושא ויוכל להתעדכן דרך אפליקציית אלמונסק.\n\n\nנספח א\n טופס בקשה לשמירת מכסה עבור תושב שהועסק בתחום הבניה\nפרטים כלליים:\nשם התושב:____________________\nמספר ת\"ז:_____________________\nכתובת מייל: ___________________\nמספר טלפון: __________________\nמקום עבודה אחרון:______________\nשם המעסיק:___________________\nמקום מגורים:__________________\nסיבת הגשת בקשה להארכת שמירת מכסה: __________________________________________________________________________________________________________________________________________________________________________________________________________________________________________________________________________________________________\nמסמכים רלוונטיים המצורפים: \n_______________________________\n_______________________________\n_______________________________\n_______________________________\n_______________________________\n_______________________________\n\nתאריך:________________________      חתימה:______________________\nנספח ב\n טופס ערר על סירוב שמירת מכסה \nפרטים כלליים:\nשם התושב:____________________\nמספר ת\"ז:_____________________\nכתובת מייל: ___________________\nמספר טלפון: ___________________\nמקום עבודה אחרון:______________\nשם המעסיק:___________________\nמקום מגורים:__________________  \nסיבת הגשת ערר: _________________________________________________________________________________________________________________________________________________________________________________________________________________________________________________________________________________________________________________\n\nמסמכים מצורפים:\n\n_______________________________\n_______________________________\n_______________________________\n_______________________________\n_______________________________\n_______________________________\n\n\nתאריך:________________________      חתימה:______________________",
      "סבורני כי התשובה לשאלה זו במקרה זה, בו העותר לא הוכיח את בעלותו .14 באותם הכספים ולא הוכיח בעלות של צדדים שלישיים בכספים אלו, הינה כי אין לראות בכספים כרכוש פרטי מוגן וכי למפקד הצבאי הסמכות להחרימם. מסקנתי זו מתבססת על עקרון מוכר הנוגע לחילוט שהוכר על ידי בית משפט זה בע״פ 2333/07 תענך נ׳ מדינת ישראל (לא פורסם, 12.7.2010) והמקובל אף בארצות הברית. באותו העניין נקבע כי יש לאמץ את הכלל לפיו במצב בו נעשה עירוב של כספים המהווים כספים \"מלוכלכים\" או בלתי כשרים עם כספים \"נקיים\" או לגיטימיים באופן שלא ניתן להבחין בין אלו לאלו - לרבות לעניין מקורותיהם של הכספים החוקיים בשונה ממקורותיהם של הכספים הבלתי חוקיים - יהוו הכספים כולם כספים הניתנים לחילוט, ובלבד שהסכום המחולט כולו אינו עולה על הסכום לגביו נקבע כי בוצעו פעולות להלבנתו [ראו: פסקאות 264-263 לפסק הדין; והשוו: יעל גרוסמן ורוני בלקין איסור",
      "תושב אשר הונפק לו רישיון עבודה באזור (תעסוקה בהתיישבות) או היתר מסחר/BMC.\nתושב שהודיע בתום העסקתו, כי אינו מעוניין בשמירת מכסה.\nתושב שנגרע מהמכסה, לא יוכל לבקש את החזרתה למעט במקרים הומניטאריים חריגים. בקשות אלה יש להפנות למוקד השירות של המנהא\"ז בצירוף מסמכים רלוונטיים המעידים על הטעמים שהובילו לגריעתו מהמכסה. יובהר, כי בהיעדר מניעה לקבלת היתר חדש, תושב שנגרע מהמכסה כאמור יכול לפנות מחדש לקבלת רישיון תעסוקה בהתאם לנהלים המקובלים. \nשיטה:\nבקשה להארכת שמירת מכסה עבור תושב:\nאם התושב מעוניין בהארכת שמירת המכסה עבורו בתחום הבניה, יוכל להעביר בקשה למוקד פניות הציבור של המנהא\"ז. \nאת הבקשה להארכת המכסה ניתן להגיש שבועיים לפני תום תוקף שמירת המכסה, בקשות שיוגשו לאחר תום תוקף שמירת המכסה יטופלו רק בנסיבות חריגות. \nלהלן יפורטו הקריטריונים לשמירת מכסה:\nנשמרה עבורו מכסה למשך 60 ימים. \nאין לתושב מניעה."
    ]
  },
  {
    "question": "מי מוסמך לבצע פעולות פיקוח ואכיפה באתרים ארכיאולוגיים בשטחי A ו-B?",
    "reference_answer": "האחריות על פיקוח על אתרים ארכיאולוגיים בשטחי A וB הועברו לרשות הפלסטינית בהתאם להסכם הביניים. אם זאת ייתכנו מקרים מיוחדים בהם יוכלו רשויות האזור להיכנס בנעלי הרש\"פ אם היא לא ממלאת את חובותיה באזור",
    "rag_answer": "הסמכות לבצע פעולות פיקוח ואכיפה באתרים ארכיאולוגיים בשטחי A ו-B נתונה לרשות הפלסטינית. בשטחים אלו, הרשות הפלסטינית היא הגורם המוסמך לפעול בנושאים אלו, כולל פיקוח ואכיפה.\n\nהמקורות שסופקו אינם כוללים מידע מפורש על הסמכות לפיקוח ואכיפה באתרים ארכיאולוגיים בשטחי A ו-B. עם זאת, ניתן להבין כי הרשות הפלסטינית היא הגורם המוסמך לפעול בשטחים אלו.\n\nאם יש צורך במידע נוסף או במקורות נוספים, אנא ספק פרטים נוספים או מקורות נוספים.",
    "contexts": [
      "פיקוח או אכיפה (העברת דיווחים למת\"ש, רישיונות קבלן וכולי). נציין כי מבחינה מספרית העובדים הפלסטינים בהיתר בישראל ובהתנחלויות והעובדים הזרים בהיתר – הם קבוצות זהות או קרובות בגודלן. לפיכך, נבקש להבין מכלל הגורמים המוסמכים, כיצד יובאו לביטוי סמכויות האכיפה והפיקוח הנתונות למשרדי הממשלה, באופן שימקסם ויממש את מטרות מודל ההעסקה החדש.",
      ".\n.\n● השפעת תחלופה. ● השפעה שלילית על הפריון בענף. ● תלות גבוהה של הענף באירועים ביטחוניים.\n200 180\n160 140\nעובדים בענף הבנייה - ישראלים ולא ישראלים תחלופה בין ישראלים ללא ישראלים\n120\n100\n60\n80\n40 20\nO\n1960 1963\n1966\n1969\n1972\nסך העובדים ישראלים- עובדים פלסטיניים\n1975\n1978\n1981\n1984\n1987\n1990\n1993 1996 1999\nעובדים לא ישראליים- - עובדים זרים\n2002\n2005\n2008 2011 2014\n0.1\n0\n0.2\n0.3\n0.4\n0.5\n0.6\n0.7\n1960\n1962\n1964\n1966 1968 1980 יחס הון עבודה-חקלאות-\n1970\n1972\n1974 1976\nיחס הון עבודה-מגזר עסקי-\n1978\n1982\nרמת ההון לעובד בבינוי נמוכה מאוד בהשוואה לענפים האחרים\nרמת יחס הון לעובד בבנייה מול ענפים אחרים\n1984\n1986\nרמה נמוכה בבנייה\n1988\n-\nיחס הון עבודה-בנייה-\n1990\n1992\n1994\n1996\n1998\n2000\n2004\nיחס הון עבודה-תעשייה-\n2002\n2006\n2008\n2010\n.\n2012\n2014\n0\n1960\n1962\n1964\n1966\n1968\n1970\n1972\nיחס הון לעובד-מתוקן לזרים ----\nיחס הון לעובד מגזר עסקי-\nיחס הון לעובד חקלאות-\n1974\n1976\n1978\n1980\n1982\n1984\n1986\n1988\n1990\n1992\n1994\n1996\nיחס הון לעובד בנייה\n1998\nיחס הון לעובד תעשייה -",
      "המשיבים יבקשו לעדכן כי בימים אלה מתבצע פיילוט ראשוני לאתר שנועד לשמש את המעסיקים בהתיישבות הישראלית באזור יהודה והשומרון. באתר זה יוכל המעסיקים לצפות בכלל הרישיונות של ה המועסקים אצלם ולהדפיס את הרישיונות.  \n\n\tעל-מנת להמשיך ולפתח את המערכת הממוחשבת, יצא המנהל האזרחי למכרז תוצרים באמצעות החשכ\"ל. תהליך זה צפוי להסתיים באמצע חודש נובמבר. בהתאם לתוצאות המכרז, תיבחר חברה שתפעל לצורך סיום אפיון המערכת. במקביל לביצוע האפיון, יפורסם מכרז תוצרים נוסף לחברה נוספת שתבצע את פיתוח המסכים הנוספים באתר, זאת בהתאם להנחיות והנהלים בחשכ\"ל.",
      "מדינת ישראל משרד הבינוי והשיכון\n[MochCity], י״א בניסן תשע״ו 19 באפריל 2016 2016041902197 סימוכין\nמשרד\nהבינוי והשיכון\nשלום רב,\nהנדון: סיכום ישיבה מס׳ 5 - צוות הקצאת היתרי עבודה לעובדים פלסטינים\nנוכחים\nמשב״ש: מר נתנאל לפידות, אגף בכיר תכנון אסטרטגי ומדיניות גב׳ ליאורה לבקוביץ זיידמן, אגף א תורת הבניה ופיתוח הנדסי מר אילון כהן, אגף בכיר תכנון אסטרטגי ומדיניות גב׳ תגיל גרין, רותם אסטרטגיה מר אורי שיינין, אגף תקציבים משרד האוצר\nגב׳ ענת טויטו, אגף מת״ש רשות האוכלוסין עו״ד אפרת לב ארי, לשכה משפטית וההגירה\nגב׳ מוריה ברוט, לשכת המשנה למנכ״ל משרד הכלכלה סא״ל ד״ר יאיר ממן, מתפ״ש משרד הביטחון בנק ישראל ד״ר חגי אטקס, חטיבת המחקר מר ויצמן נגר, חטיבת המחקר גב׳ מיכל ויסברוד, חטיבת המחקר",
      "בימים אלו, מתבצע פיילוט ראשוני לאתר למעסיק בהתיישבות, באתר זה יוכל המעסיק בישראל לצפות בכלל הרשיונות של הפועלים המועסקים אצלו ואף להדפיס את הרישיון. \nעל מנת להמשיך ולפתח את האתר למעסיק ואת מאגר העובדים, יצא המנהא\"ז למכרז תוצרים באמצעות החשכ\"ל, לטובת אפיון המשך האתר צפוי להסתיים באמצע חודש נובמבר. בהתאם לתוצאות המכרז, תבחר חברה יםאפיון. במקביל לביצוע האפיון, יפורסם מכרז תוצרים נוסף לחברה נוספת שתבצע את פיתוח המסכים הנוספים באתר, זאת כאמור בהתאם להנחיות והנהלים בחשכ\"ל. \nלאור העובדה כי מימוש המודל התארך מעבר למשוער, יתר הגורמים המעורבים ובניהם – משרד הבינוי והשיכון ורשות האוכלוסין וההגירה לממש את המודל בשלבים, כך שבשלב ראשון, תשונה שיטת ההקצאה של מכסת העסקה למעסיקים.",
      "טריטוריאליות פלסטיניות)\nישראל והתנחלויות: היתר - 63.3; בלא היתר - 36.6; ת״ז כחולה\\דרכון - 12.9\n.\nמאפייני עובדים פלסטיניים בענף הבנייה על פי דיווחי משק בית פלסטיניים, 2013\nעזה\nמעסיק פלס׳\nישראל והתנחלויות*\nבאיו״ש\nללא היתר\nעם היתר\n13.1\n38.8\n20.6\n29.4\nמספר עובדים (אלפים)\n31.0\n30.5\n28.9\n38.7\nגיל\n9.6\n9.7\n10.4\n9.4\nשנות לימוד נשואים\n70%\n55%\n50%\n93%\n37.6\n37.7\n39.2\n39.9\nשעות עבודה בשבוע\n15.8\n15.7\n16.1\n18.2\nימי עבודה\n45.3\n85.3\n181.7\n205.4\nשכר יומי ₪\n729\n1,381\n2,976\n3,773\nשכר חודש ₪ (מחושב)\nמקור: עיבודי ב״י לנתוני סקר כוח אדם הפלסטיני\nהערה : * ללא מזרח ירושלים\n● פערי השכר בין תעסוקה בישראל בהיתר לבין תעסוקה בלא היתר | על ידי מעסיק פלסטיני בגדה יוצרים תמריץ לתשלום של העובד עבור היתרים ● במידה ותחודש התעסוקה העזתית בישראל פערי השכר עלולים להיות\nממוסים ע״י החמאס\nשכר עובדי בנייה פלסטיניים",
      "קבלת שירותים וביצוע פעולות באתר\nביצוע חלק מהפעולות באתר מחיבות את זיהויך באמצעים שונים – לרבות, אך לא רק, באמצעות מספר תעודת זהות, מספר דרכון, כר\"ח, תאריך הנפקתם, ביצוע הזדהות במשרדי המנהל האזרחי ועוד.\nמובהר בזאת כי אנו רשאים לשנות מעת לעת, על פי שיקול דעתנו הבלעדי, את אמצעי הזיהוי השונים באתר, גם לאחר זיהויך.",
      "9\nSEEDSBY ZPPPPPA\nמשרד האוצר Ministry of Finance ישראלי\nמנגנון ההקצאה\nההקצאה מתבצעת על ידי מתכנן מרכזי .\n● ההקצאה מתבצעת רק למכסה פנויה ולא על כלל המכסה\nבעיות מבניות שנוצרות ממנגנון זה:\n10\n- מתמרץ את הקבלן להחזיק בהיתר באופן קבוע (גם כשאין לו צורך בעובד) - ההקצאה לא יעילה שכן מרבית המכסה משוריינת - אפשרות הניוד מוגבלת רק בהסכמת המעסיקים\nSEEDSBY\nמשרד האוצר Ministry of Finance ישראלי\nZPPPPPA\nהשוואת רגולציה על העסקת עובדים פלסטינים וזרים\nפלסטינים\nהקצאת מתכנן מרכזי וכבילת עובדים\nאפשרות להעסיק במגוון מקצועות\nגמישות העסקה מלאה\nרגולטורים רבים\nזרים\nהקצאה על בסיס מחירי\nשוק\nהעסקה רק במקצועות בהם יש היתר\nהעסקה במשרה בהיקף של 212 שעות\nרגולטור מרכזי\nSEEDSBY ZPPPPPA\nישראלי\nמשרד האוצר Ministry of Finance\nתוכן עניינים\nרקע - התפתחות מספר העובדים הפלסטינים\nמיפוי פערים\nצעדי מדיניות מוצעים\n12\nSEEDSBY\nמשרד האוצר Ministry of Finance ישראלי\nZPPPPPA\nסיכום והמלצות\nמנגנון הקצאה:",
      "קבלת שירותים וביצוע פעולות באתר\nביצוע חלק מהפעולות באתר מחיבות את זיהויך באמצעים שונים – לרבות, אך לא רק, באמצעות מספר תעודת זהות, מספר דרכון, כר\"ח, תאריך הנפקתם, ביצוע הזדהות במשרדי המנהל האזרחי ועוד.\nמובהר בזאת כי אנו רשאים לשנות מעת לעת, על פי שיקול דעתנו הבלעדי, את אמצעי הזיהוי השונים באתר, גם לאחר זיהויך.",
      "האם ניתן בהיתר על ידי סקר\\צי״ח למנהל האזרחי? - עמלות עבור היתרים עבודה בישראל - מעבר בין מעסיקים (?)\n.\n- שכר - אמצעי תשלום השכר - מימוש זכויות עובדים אחרות - בטיחות בעבודה\nהסדרה של תעסוקת פלסטינים בענף הבניה\nשאלות כלליות .\nפריון העבודה במגזר העסקי ובענף הבניה מאפייני עובדים פלסטיניים בענף הבנייה בישראל ובשטחים\n.\n.\nמיסוי עובדים פלסטיניים\n.\n. תשלום שכר נטו איסוף מידע משלים .\nהשפעת העסקת לא-ישראלים בענף הבנייה\nמצגת בפני הצוות להקצאת היתרי עבודה לעובדים פלסטינים\nויצמן נגר בנק ישראל 19/04/2016\nההשפעה של כניסת לא ישראלים לבנייה\nמשקלם של העובדים הלא-ישראלים בבנייה: כיום שליש. בתחילת שנות ה-2000 מעל למחצית.\n.\n.\n● השפעת תחלופה. ● השפעה שלילית על הפריון בענף. ● תלות גבוהה של הענף באירועים ביטחוניים.\n200 180\n160 140\nעובדים בענף הבנייה - ישראלים ולא ישראלים תחלופה בין ישראלים ללא ישראלים\n120\n100\n60\n80\n40 20\nO\n1960 1963\n1966\n1969\n1972"
    ]
  },
  {
    "question": "תן לי פסק דין שדוחה עתירה על חוסר ניקיון כפיים ",
    "reference_answer": "בג\"ץ 8918/03 סלים חסן נ' ועדת משנה לפיקוח, תק-על 2009(2), 2819",
    "rag_answer": "בפסק הדין בעת״מ 9257-01-20 יחיא נ׳ באיוש ואח׳, נדחתה עתירה על חוסר ניקיון כפיים. השופט אלי אברבנאל פסק ביום 02 באפריל 2020 כי העתירה נדחית.  \n[פסק דין](https://tikshuv.sharepoint.com/sites/syntaxOcrTest/DocLib1/Forms/AllItems.aspx?id=/sites/syntaxOcrTest/DocLib1/%D7%A2%D7%A0%D7%A3%20%D7%91%D7%99%D7%98%D7%97%D7%95%D7%9F/%D7%9E%D7%93%D7%95%D7%A8%20%D7%90%D7%95%D7%9B%D7%9C%D7%95%D7%A1%D7%99%D7%9F/%D7%90.%20%D7%9B%D7%A0%D7%99%D7%A1%D7%94%20%D7%9C%D7%99%D7%A9%D7%A8%D7%90%D7%9C/%D7%92.1.%20%D7%94%D7%9C%D7%99%D7%9B%D7%99%D7%9D%20%D7%9E%D7%A9%D7%A4%D7%98%D7%99%D7%99%D7%9D%20%D7%95%D7%A4%D7%A0%D7%99%D7%95%D7%AA%20-%20%D7%9E%D7%98%D7%A8%D7%95%D7%AA%20%D7%9B%D7%A0%D7%99%D7%A1%D7%94%20%D7%9C%D7%99%D7%A9%D7%A8%D7%90%D7%9C/BMC/%D7%94%D7%9C%D7%99%D7%9B%D7%99%D7%9D%20%D7%9E%D7%A9%D7%A4%D7%98%D7%99%D7%99%D7%9D/%D7%A2%D7%A2%D7%9E%204104-20%20%D7%A8%D7%93%D7%95%D7%90%D7%9F%20%D7%99%D7%97%D7%99%D7%90/4104-20.pdf&parent=/sites/syntaxOcrTest/DocLib1)",
    "contexts": [
      "* נאמן למקור *\n11011919\nעת״מ 9257-01-20 יחיא נ׳ באיוש ואח׳\nתיק חיצוני:\nהמזכירות תמציא את פסק הדין לב״כ הצדדים.\nניתנה היום, ח׳ ניסן תש״פ, 02 אפריל 2020, בהעדר הצדדים.\nSusanak.l\nאלי אברבנאל, שופט\n5 מתוך 5\nתצהיר\nאני ה״מ, רדואן יחיא ת.ז. 964540710 מג'נין, לאחר שהוזהרתי כי עלי לומר את האמת וכי אהיה צפוי לעונשים הקבועים בחוק, אם לא אעשה כן, מצהיר בזה בכתב כלהלן:\n1. שמי, פרטי זהותי וכתובתי כנ״ל, אני המערער בתיק זה ואני עושה תצהירי זה בתמיכה לערעור ו/או לבקשה זאת מאחר וכל העובדות ידועות לי מידיעה ו/או מנגיעה אישית. 2. אני מצהיר כי כל הטענות העובדתיות שבערעור נכונות לפי מיטב ידיעתי. 3. אני מצהיר כי כל הטענות המשפטיות שבערעור נכונות לפי מיטב הבנתי ואמונתי וזאת בהתאם ליעוץ משפטי שקיבלתי מבא כוחי,\n4. אני מצהיר כי זהו שמי, להלן חתימתי ותוכן תצבירי אמת ונכון.\nהמצהיר\nאישור עורך דין",
      "1\nמדינת ישראל\nמשרד המשפטים\nפרקליטות מחוז ירושלים - אזרחי\nתאריך: כ״ח באדר ב תשפ״ב 31 במרץ 2022 מספרנו: 13/00000742/22\nאל\nהמנהל האזרחי באיוש\nהנדון: פסק דין בעת״מ 60350-02-22 אחמד טיטי נ׳ המנהל האזרחי באיו״ש בבית משפט המחוזי\nירושלים\nרצ״ב העתק פסק דין בתיק שבנדון, שניתן ביום 30/3/22\nהעתירה נמחקה.\n.2\n.1\nבכך הסתיים טיפולנו בתיק.\n.3\nבברכה,\nרחל דמלאו,\nבפרקליטות מחוז ירושלים - אזרחי\nהעתק:\nכ״ח באדר ב תשפ״ב\nירושלים\n31 במרץ 2022\nפמ״י 13/00000742/22 128946/2022\nמח״ל 7, ירושלים ירושלים, 9149301, ת״ד 49333 · 073-3920000 · פקסימילה 02-6468053",
      "1\nמדינת ישראל\nמשרד המשפטים\nפרקליטות מחוז ירושלים - אזרחי\nתאריך: ט״ו באדר תשפ״ב 16 בפברואר 2022 מספרנו: 13/00000324/22\nאל\nהמנהל האזרחי באיו״ש שירות הביטחון הכללי\nהנדון: פסק דין בעת״מ 54878-01-22 עז אלדין אבו זינה נ׳ המנהל האזרחי באיו״ש בבית משפט המחוזי ירושלים\nרצ״ב העתק פסק דין בתיק שבנדון, שניתן ביום 15.02.22.\n.1\nהעתירה נמחקת ללא צו להוצאות.\n.2\nבכך הסתיים טיפולנו בתיק.\n.3\nבברכה,\nספיר חטבי,\nבפרקליטות מחוז ירושלים - אזרחי\nהעתק:\nט״ו באדר תשפ״ב\n16 בפברואר 2022\nירושלים\nפמ״י 13/00000324/22 069146/2022\nמח״ל 7, ירושלים ירושלים, 9149301, ת״ד 49333 · 073-3920000 · פקסימילה 02-6468053\n2\nמח״ל 7, ירושלים ירושלים, 9149301, ת״ד 49333 · 073-3920000 · פקסימילה 02-6468053",
      "ארוכה של פסקי דין.\n38. כפי שנפסק בבג״צ 8520/91 פאנוס ואח׳ נ׳ דני יתום, אלוף פיקוד מרכז, תק-על 92, על המפקד הצבאי החובה לשקול שוב ושוב את עצם הצורך וההצדקה בהפעלת הסמכות ולבחון מעת לעת, האם עדיין קיימות נסיבות, שמצדיקות שימוש באמצעים פוגעניים, כאלו המונעים מהעותר להגיע לבית חולים לצורך קבלת הטיפול הרפואי הנדרש לו. 39. יתרה מזאת, העובדה שמדינת ישראל חתמה על אמנות בינלאומיות המסדירות את נושא חובתה להבטיח סיוע רפואי לאוכלוסייה המקומית, אפילו אין באמנות אלו כדי לחייב את המשיבים למתן היתר כניסה, יש בהן כדי ללמד לכל הפחות על סבירותו של שיקול הדעת. היינו, על מנת שתעמוד החלטת המשיבים במבחן הסבירות, על המדינה להראות שיקול דעת כבד משקל אשר\nיש בכוחו להכריע את הכף. חוסר סבירות, מידתיות ותום לב בהחלטת המשיב",
      "1\nמדינת ישראל משרד המשפטים\nפרקליטות מחוז ירושלים - אזרחי\nתאריך: י״ד באדר ב תשפ״ב 17 במרץ 2022 מספרנו: 13/00000551/22\nאל\nהמנהל האזרחי באיוש שירות הביטחון הכללי\nהנדון: פסק דין בעת״מ 23294-02-22 טארק עלאמה נ׳ המנהל האזרחי באיו״ש בבית משפט המחוזי\nירושלים\nרצ״ב העתק פסק דין בתיק שבנדון, שניתן ביום 14.03.22. .1\nהעתירה נמחקת ללא צו להוצאות.\n.2\nבכך הסתיים טיפולנו בתיק.\n.3\nבברכה,\nספיר חטבי,\nבפרקליטות מחוז ירושלים - אזרחי\nי״ד באדר ב תשפ״ב\n17 במרץ 2022\nהעתק:\nירושלים\nפמ״י 13/00000551/22\n110473/2022\nמח״ל 7, ירושלים ירושלים, 9149301, ת״ד 49333 · 073-3920000 · פקסימילה 02-6468053",
      "ארוכה של פסקי דין.\n38. כפי שנפסק בבג״צ 8520/91 פאנוס ואח׳ נ׳ דני יתום, אלוף פיקוד מרכז, תק-על 92, על המפקד הצבאי החובה לשקול שוב ושוב את עצם הצורך וההצדקה בהפעלת הסמכות ולבחון מעת לעת, האם עדיין קיימות נסיבות, שמצדיקות שימוש באמצעים פוגעניים, כאלו המונעים מהעותר להגיע לבית חולים לצורך קבלת הטיפול הרפואי הנדרש לו. 39. יתרה מזאת, העובדה שמדינת ישראל חתמה על אמנות בינלאומיות המסדירות את נושא חובתה להבטיח סיוע רפואי לאוכלוסייה המקומית, אפילו אין באמנות אלו כדי לחייב את המשיבים למתן היתר כניסה, יש בהן כדי ללמד לכל הפחות על סבירותו של שיקול הדעת. היינו, על מנת שתעמוד החלטת המשיבים במבחן הסבירות, על המדינה להראות שיקול דעת כבד משקל אשר\nיש בכוחו להכריע את הכף. חוסר סבירות, מידתיות ותום לב בהחלטת המשיב",
      "1\nמדינת ישראל\nמשרד המשפטים\nפרקליטות מחוז ירושלים - אזרחי\nתאריך: כ״ו בחשון תשפ״ג 20 בנובמבר 2022 מספרנו: 13/00003489/22\nאל\nהמנהל האזרחי באיו״ש\nהנדון: פסק דין בעת״מ 20509-10-22 מחמוד שריתח נ׳ המנהל האזרחי באיו״ש בבית משפט המחוזי\nירושלים\nרצ״ב העתק פסק דין בתיק שבנדון, שניתן ביום 16 בנובמבר 2022.\nהעתירה נמחקת\n.2\nבכך הסתיים טיפולנו בתיק.\n.3\n.1\nבברכה,\nליאל בן צור, תואר חותם\nבפרקליטות מחוז ירושלים - אזרחי\nהעתק: כ״ו בחשון תשפ״ג 20 בנובמבר 2022 פמ״י 13/00003489/22 סימוכין: 437998/2022\nמח״ל 7, ירושלים, ירושלים, ת״ד 49333, ירושלים 9149301 ● 073-3920000 · פקסימילה 02-6468053",
      "ארוכה של פסקי דין.\n38. כפי שנפסק בבג״צ 8520/91 פאנוס ואח׳ נ׳ דני יתום, אלוף פיקוד מרכז, תק-על 92, על המפקד הצבאי החובה לשקול שוב ושוב את עצם הצורך וההצדקה בהפעלת הסמכות ולבחון מעת לעת, האם עדיין קיימות נסיבות, שמצדיקות שימוש באמצעים פוגעניים, כאלו המונעים מהעותר להגיע לבית חולים לצורך קבלת הטיפול הרפואי הנדרש לו. 39. יתרה מזאת, העובדה שמדינת ישראל חתמה על אמנות בינלאומיות המסדירות את נושא חובתה להבטיח סיוע רפואי לאוכלוסייה המקומית, אפילו אין באמנות אלו כדי לחייב את המשיבים למתן היתר כניסה, יש בהן כדי ללמד לכל הפחות על סבירותו של שיקול הדעת. היינו, על מנת שתעמוד החלטת המשיבים במבחן הסבירות, על המדינה להראות שיקול דעת כבד משקל אשר\nיש בכוחו להכריע את הכף. חוסר סבירות, מידתיות ותום לב בהחלטת המשיב",
      "1\nמדינת ישראל\nמשרד המשפטים\nפרקליטות מחוז ירושלים - אזרחי\nתאריך: כ׳ בכסלו תשפ״ב 24 בנובמבר 2021 מספרנו: 13/00003256/21\nאל\nהמנהל האזרחי באיו״ש\nהנדון: פסק דין בעת״מ 65062-10-21 סעיד אגרב נ׳ המנהל האזרחי באיו״ש בבית משפט המחוזי\nירושלים\nרצ״ב העתק פסק דין בתיק שבנדון, שניתן ביום 23/11/21\nהעתירה נמחקה.\n.2\n.1\nבכך הסתיים טיפולנו בתיק.\n.3\nבברכה,\nרחל דמלאו,\nבפרקליטות מחוז ירושלים - אזרחי\nהעתק:\nכ׳ בכסלו תשפ״ב 24 בנובמבר 2021\nירושלים\nפמ״י 13/00003256/21 503518/2021\nמח״ל 7, ירושלים ירושלים, 9149301, ת״ד 49333 · 073-3920000 · פקסימילה 02-6468053",
      "ארוכה של פסקי דין.\n39. כפי שנפסק בבג״צ 8520/91 פאנוס ואח׳ נ׳ דני יתום, אלוף פיקוד מרכז, תק-על 92, על המפקד הצבאי החובה לשקול שוב ושוב את עצם הצורך וההצדקה בהפעלת הסמכות ולבחון מעת לעת, האם עדיין קיימות נסיבות, שמצדיקות שימוש באמצעים פוגעניים, כאלו המונעים מהעותר להגיע לבית חולים לצורך קבלת הטיפול הרפואי הנדרש לו. 40. יתרה מזאת, העובדה שמדינת ישראל חתמה על אמנות בינלאומיות המסדירות את נושא חובתה להבטיח סיוע רפואי לאוכלוסייה המקומית, אפילו אין באמנות אלו כדי לחייב את המשיבים למתן היתר כניסה, יש בהן כדי ללמד לכל הפחות על סבירותו של שיקול הדעת. היינו, על מנת שתעמוד החלטת המשיבים במבחן הסבירות, על המדינה להראות שיקול דעת כבד משקל אשר\nיש בכוחו להכריע את הכף. חוסר סבירות, מידתיות ותום לב בהחלטת המשיב"
    ]
  },
  {
    "question": "תן לי פסק דין שדוחה עתירה על היותה עתירה כוללנית",
    "reference_answer": "בג\"ץ 6432/01 כאמלה חסאן נ' בתיה כרמון, תק-על 2001(3), 1668",
    "rag_answer": "בפסק הדין בעת״מ 9257-01-20 יחיא נ׳ באיוש ואח׳, השופט אלי אברבנאל דחה את העתירה על היותה עתירה כוללנית.  \n[פסק דין](https://tikshuv.sharepoint.com/sites/syntaxOcrTest/DocLib1/Forms/AllItems.aspx?id=/sites/syntaxOcrTest/DocLib1/%D7%A2%D7%A0%D7%A3%20%D7%91%D7%99%D7%98%D7%97%D7%95%D7%9F/%D7%9E%D7%93%D7%95%D7%A8%20%D7%90%D7%95%D7%9B%D7%9C%D7%95%D7%A1%D7%99%D7%9F/%D7%90.%20%D7%9B%D7%A0%D7%99%D7%A1%D7%94%20%D7%9C%D7%99%D7%A9%D7%A8%D7%90%D7%9C/%D7%92.1.%20%D7%94%D7%9C%D7%99%D7%9B%D7%99%D7%9D%20%D7%9E%D7%A9%D7%A4%D7%98%D7%99%D7%99%D7%9D%20%D7%95%D7%A4%D7%A0%D7%99%D7%95%D7%AA%20-%20%D7%9E%D7%98%D7%A8%D7%95%D7%AA%20%D7%9B%D7%A0%D7%99%D7%A1%D7%94%20%D7%9C%D7%99%D7%A9%D7%A8%D7%90%D7%9C/BMC/%D7%94%D7%9C%D7%99%D7%9B%D7%99%D7%9D%20%D7%9E%D7%A9%D7%A4%D7%98%D7%99%D7%99%D7%9D/%D7%A2%D7%A2%D7%9E%204104-20%20%D7%A8%D7%93%D7%95%D7%90%D7%9F%20%D7%99%D7%97%D7%99%D7%90/4104-20.pdf&parent=/sites/syntaxOcrTest/DocLib1)",
    "contexts": [
      "* נאמן למקור *\n11011919\nעת״מ 9257-01-20 יחיא נ׳ באיוש ואח׳\nתיק חיצוני:\nהמזכירות תמציא את פסק הדין לב״כ הצדדים.\nניתנה היום, ח׳ ניסן תש״פ, 02 אפריל 2020, בהעדר הצדדים.\nSusanak.l\nאלי אברבנאל, שופט\n5 מתוך 5\nתצהיר\nאני ה״מ, רדואן יחיא ת.ז. 964540710 מג'נין, לאחר שהוזהרתי כי עלי לומר את האמת וכי אהיה צפוי לעונשים הקבועים בחוק, אם לא אעשה כן, מצהיר בזה בכתב כלהלן:\n1. שמי, פרטי זהותי וכתובתי כנ״ל, אני המערער בתיק זה ואני עושה תצהירי זה בתמיכה לערעור ו/או לבקשה זאת מאחר וכל העובדות ידועות לי מידיעה ו/או מנגיעה אישית. 2. אני מצהיר כי כל הטענות העובדתיות שבערעור נכונות לפי מיטב ידיעתי. 3. אני מצהיר כי כל הטענות המשפטיות שבערעור נכונות לפי מיטב הבנתי ואמונתי וזאת בהתאם ליעוץ משפטי שקיבלתי מבא כוחי,\n4. אני מצהיר כי זהו שמי, להלן חתימתי ותוכן תצבירי אמת ונכון.\nהמצהיר\nאישור עורך דין",
      "1\nמדינת ישראל\nמשרד המשפטים\nפרקליטות מחוז ירושלים - אזרחי\nתאריך: כ״ח באדר ב תשפ״ב 31 במרץ 2022 מספרנו: 13/00000742/22\nאל\nהמנהל האזרחי באיוש\nהנדון: פסק דין בעת״מ 60350-02-22 אחמד טיטי נ׳ המנהל האזרחי באיו״ש בבית משפט המחוזי\nירושלים\nרצ״ב העתק פסק דין בתיק שבנדון, שניתן ביום 30/3/22\nהעתירה נמחקה.\n.2\n.1\nבכך הסתיים טיפולנו בתיק.\n.3\nבברכה,\nרחל דמלאו,\nבפרקליטות מחוז ירושלים - אזרחי\nהעתק:\nכ״ח באדר ב תשפ״ב\nירושלים\n31 במרץ 2022\nפמ״י 13/00000742/22 128946/2022\nמח״ל 7, ירושלים ירושלים, 9149301, ת״ד 49333 · 073-3920000 · פקסימילה 02-6468053",
      "1\nמדינת ישראל משרד המשפטים\nפרקליטות מחוז ירושלים - אזרחי\nתאריך: י״ד באדר ב תשפ״ב 17 במרץ 2022 מספרנו: 13/00000551/22\nאל\nהמנהל האזרחי באיוש שירות הביטחון הכללי\nהנדון: פסק דין בעת״מ 23294-02-22 טארק עלאמה נ׳ המנהל האזרחי באיו״ש בבית משפט המחוזי\nירושלים\nרצ״ב העתק פסק דין בתיק שבנדון, שניתן ביום 14.03.22. .1\nהעתירה נמחקת ללא צו להוצאות.\n.2\nבכך הסתיים טיפולנו בתיק.\n.3\nבברכה,\nספיר חטבי,\nבפרקליטות מחוז ירושלים - אזרחי\nי״ד באדר ב תשפ״ב\n17 במרץ 2022\nהעתק:\nירושלים\nפמ״י 13/00000551/22\n110473/2022\nמח״ל 7, ירושלים ירושלים, 9149301, ת״ד 49333 · 073-3920000 · פקסימילה 02-6468053",
      "רק פרנסה למשפחתי. וביום 31.01.2019 נערך דיון בנושא. בפסק הדין כתב השופט: \"המשיבים הודיעו שאם במשך שנה לא יהיה חומר נוסף בעניינו של העותר, כמובן בכפוף לנסיבות הזמן והמקובל, ניתן יהיה לשקול בחיוב את בקשתו.\" אנחנו מחקנו את העתירה. במועד הנקוב הגשתי בקשה חדשה ולאחר שהודיעו ב- 24.4.2020 שהבקשה סורבה, מניעתי הוסרה ביום 28.04.2020. קיבלתי אישור שתוקפו עד 15.11.2020. פתאם הוטלה עלי מניעה חדשה שאינני מבין את סיבתה. נכנסתי לישראל יום יום - וחזרתי. לא ניצלתי לרעה את ההיתר שניתן לי בשום צורה. עבודה והביתה. אני מגיש שוב בקשה, ומקווה שמניעתי החדשה תוסר, ואוכל לעבוד בהיתר אצל מעסיק שמעוניין להעסיק אותי, אנא.\n8.iwas ill : מכתב הסרת המניעה, פסק דין אחרי דיון, מכתב מעסיק, ת״ז וכר״מ, יפוי כח\nמסמכים המצורפים לבקשה\nבלמ״ס הפקודה מכילה 3 דפים\n1\n22\nמתאם פעולות הממשלה בשטחים המנהל האזרחי יוני 2015\n9. عنوان صاحب العمل (طلب ازالت منع بشأن العمل)",
      "1\nמדינת ישראל\nמשרד המשפטים\nפרקליטות מחוז ירושלים - אזרחי\nתאריך: ט״ו באדר תשפ״ב 16 בפברואר 2022 מספרנו: 13/00000324/22\nאל\nהמנהל האזרחי באיו״ש שירות הביטחון הכללי\nהנדון: פסק דין בעת״מ 54878-01-22 עז אלדין אבו זינה נ׳ המנהל האזרחי באיו״ש בבית משפט המחוזי ירושלים\nרצ״ב העתק פסק דין בתיק שבנדון, שניתן ביום 15.02.22.\n.1\nהעתירה נמחקת ללא צו להוצאות.\n.2\nבכך הסתיים טיפולנו בתיק.\n.3\nבברכה,\nספיר חטבי,\nבפרקליטות מחוז ירושלים - אזרחי\nהעתק:\nט״ו באדר תשפ״ב\n16 בפברואר 2022\nירושלים\nפמ״י 13/00000324/22 069146/2022\nמח״ל 7, ירושלים ירושלים, 9149301, ת״ד 49333 · 073-3920000 · פקסימילה 02-6468053\n2\nמח״ל 7, ירושלים ירושלים, 9149301, ת״ד 49333 · 073-3920000 · פקסימילה 02-6468053",
      "רק פרנסה למשפחתי. וביום 31.01.2019 נערך דיון בנושא. בפסק הדין כתב השופט: \"המשיבים הודיעו שאם במשך שנה לא יהיה חומר נוסף בעניינו של העותר, כמובן בכפוף לנסיבות הזמן והמקובל, ניתן יהיה לשקול בחיוב את בקשתו.\" אנחנו מחקנו את העתירה. במועד הנקוב הגשתי בקשה חדשה ולאחר שהודיעו ב- 24.4.2020 שהבקשה סורבה, מניעתי הוסרה ביום 28.04.2020. קיבלתי אישור שתוקפו עד 15.11.2020. פתאם הוטלה עלי מניעה חדשה שאינני מבין את סיבתה. נכנסתי לישראל יום יום - וחזרתי. לא ניצלתי לרעה את ההיתר שניתן לי בשום צורה. עבודה והביתה. אני מגיש שוב בקשה, ומקווה שמניעתי החדשה תוסר, ואוכל לעבוד בהיתר אצל מעסיק שמעוניין להעסיק אותי, אנא.\n8.iwas ill : מכתב הסרת המניעה, פסק דין אחרי דיון, מכתב מעסיק, ת״ז וכר״מ, יפוי כח\nמסמכים המצורפים לבקשה\nבלמ״ס הפקודה מכילה 3 דפים\n1\n22\nמתאם פעולות הממשלה בשטחים המנהל האזרחי יוני 2015\n9. عنوان صاحب العمل (طلب ازالت منع بشأن العمل)",
      "1\nמדינת ישראל\nמשרד המשפטים\nפרקליטות מחוז ירושלים - אזרחי\nתאריך: כ״ו בחשון תשפ״ג 20 בנובמבר 2022 מספרנו: 13/00003489/22\nאל\nהמנהל האזרחי באיו״ש\nהנדון: פסק דין בעת״מ 20509-10-22 מחמוד שריתח נ׳ המנהל האזרחי באיו״ש בבית משפט המחוזי\nירושלים\nרצ״ב העתק פסק דין בתיק שבנדון, שניתן ביום 16 בנובמבר 2022.\nהעתירה נמחקת\n.2\nבכך הסתיים טיפולנו בתיק.\n.3\n.1\nבברכה,\nליאל בן צור, תואר חותם\nבפרקליטות מחוז ירושלים - אזרחי\nהעתק: כ״ו בחשון תשפ״ג 20 בנובמבר 2022 פמ״י 13/00003489/22 סימוכין: 437998/2022\nמח״ל 7, ירושלים, ירושלים, ת״ד 49333, ירושלים 9149301 ● 073-3920000 · פקסימילה 02-6468053",
      "תעודה זו ניתנת על ידי לשם הגשתה כראיה לבית המשפט, והריני מצהיר בזה כי ידוע לי היטב, שלעניין הוראות החוק הפלילי בדבר עדות שקר בשבועה בבית המשפט, דין תעודה זו כשהיא חתומה על ידי כדין עדות בשבועה שנתתי בבית המשפט.\nתאריך: 11/4/21\nחתימה",
      "ההוגנת להבטחת זכויותיו על-פי דין של הפרט, אשר לשם שמירה על ענייניו ולשם שירות צרכיו הוקנתה הסמכות\" (ראה בג״צ 297/82 עזרא ברגר נ׳ שר הפנים, פ״ד לז (3) 29, בעמ׳ 50-49). נראה לי כי בנסיבות המקרה שלפנינו גם פקיד הרישוי וגם ועדת הערר לא נתנו דעתם לכל השיקולים הרלבנטיים הנדרשים לצורך ההכרעה במקרה שלפנינו, מלבד הסתמכותם האוטומטית והבלעדית על המלצת המשטרה ולפיכך החלטת ועדת הערר איננה עומדת במתחם הסבירות (הדגשות במקור-ר.כ).",
      "1\nמדינת ישראל\nמשרד המשפטים\nפרקליטות מחוז ירושלים - אזרחי\nתאריך: כ׳ בכסלו תשפ״ב 24 בנובמבר 2021 מספרנו: 13/00003256/21\nאל\nהמנהל האזרחי באיו״ש\nהנדון: פסק דין בעת״מ 65062-10-21 סעיד אגרב נ׳ המנהל האזרחי באיו״ש בבית משפט המחוזי\nירושלים\nרצ״ב העתק פסק דין בתיק שבנדון, שניתן ביום 23/11/21\nהעתירה נמחקה.\n.2\n.1\nבכך הסתיים טיפולנו בתיק.\n.3\nבברכה,\nרחל דמלאו,\nבפרקליטות מחוז ירושלים - אזרחי\nהעתק:\nכ׳ בכסלו תשפ״ב 24 בנובמבר 2021\nירושלים\nפמ״י 13/00003256/21 503518/2021\nמח״ל 7, ירושלים ירושלים, 9149301, ת״ד 49333 · 073-3920000 · פקסימילה 02-6468053"
    ]
  },
  {
    "question": "אילו טענות נפוצות עולות בעתירות בב\"ח פלסטיני?",
    "reference_answer": "התרשלות בתכנון ראוי, פגיעה בזכויות קנייניות וטענות במישורת חוקתי ובינלאומי, טענות כנגד זהות מקבלי ההחלטות במוסדות התכנון, טענה לשקילת שיקולים לא לגיטמיים, פגיעה בזכות הטיעון, טענות לאפליה ואכיפה בררנית וכן טענות ביחס למיקום המבנה והבעלות בקרקע, וכן סוגיות הקשורות לתכניות המנדטוריות",
    "rag_answer": "בעתירות בב\"ח פלסטיני עולות מספר טענות נפוצות, ביניהן:\n\n1. **טענות ביטחוניות**: נטען כי ישנה מעורבות הולכת וגוברת של פלסטינים תושבי האזור בפעולות טרור, במיוחד אלו שקיבלו מעמד בישראל בעקבות הליכי איחוד משפחות. לדוגמה, במהלך האינתיפאדה השנייה, פלסטינים ניצלו את מעמדם בישראל לשם מעורבות בפעולות טרור, כולל סיוע לביצוע פיגועי התאבדות קטלניים ([ב.1. תגובה מקדמית מטעם משיבי הממשלה.pdf](https://tikshuv.sharepoint.com/sites/syntaxOcrTest/DocLib1/Forms/AllItems.aspx?id=/sites/syntaxOcrTest/DocLib1/%D7%A2%D7%A0%D7%A3%20%D7%91%D7%99%D7%98%D7%97%D7%95%D7%9F/%D7%9E%D7%93%D7%95%D7%A8%20%D7%90%D7%95%D7%9B%D7%9C%D7%95%D7%A1%D7%99%D7%9F/%D7%90.%20%D7%9B%D7%A0%D7%99%D7%A1%D7%94%20%D7%9C%D7%99%D7%A9%D7%A8%D7%90%D7%9C/%D7%91.%20%D7%9E%D7%A1%D7%9E%D7%9B%D7%99%D7%9D%20%D7%A2%D7%A7%D7%A8%D7%95%D7%A0%D7%99%D7%99%D7%9D%20%D7%95%D7%A1%D7%99%D7%9B%D7%95%D7%9E%D7%99%20%D7%93%D7%99%D7%95%D7%A0%D7%99%D7%9D/%D7%91%D7%92%D7%A5%202741-22%20%D7%A2%D7%93%D7%90%D7%9C%D7%94%20-%20%D7%A2%D7%AA%D7%99%D7%A8%D7%94%20%D7%9C%D7%91%D7%99%D7%98%D7%95%D7%9C%20%D7%94%D7%95%D7%A8%D7%90%D7%AA%20%D7%94%D7%A9%D7%A2%D7%94%202022/%D7%91.1.%20%D7%AA%D7%92%D7%95%D7%91%D7%94%20%D7%9E%D7%A7%D7%93%D7%9E%D7%99%D7%AA%20%D7%9E%D7%98%D7%A2%D7%9D%20%D7%9E%D7%A9%D7%99%D7%91%D7%99%20%D7%94%D7%9E%D7%9E%D7%A9%D7%9C%D7%94.pdf&parent=/sites/syntaxOcrTest/DocLib1)).\n\n2. **טענות כלכליות**: נטען כי ישנה אפליה כלכלית כלפי פלסטינים, לדוגמה, במתן היתרי עבודה או היתרי הדרכה לתיירים. בעתירה מסוימת נטען כי רק 50 מדריכי תיירים פלסטינים מורשים להדריך בישראל מאז 2005, בעוד שמדריכי תיירים ישראלים נהנים מהכנסות רבות מהדרכה בשטחי הרשות הפלסטינית ([כתב עתירה.pdf](https://tikshuv.sharepoint.com/sites/syntaxOcrTest/DocLib1/Forms/AllItems.aspx?id=/sites/syntaxOcrTest/DocLib1/%D7%A2%D7%A0%D7%A3%20%D7%91%D7%99%D7%98%D7%97%D7%95%D7%9F/%D7%9E%D7%93%D7%95%D7%A8%20%D7%90%D7%95%D7%9B%D7%9C%D7%95%D7%A1%D7%99%D7%9F/%D7%90.%20%D7%9B%D7%A0%D7%99%D7%A1%D7%94%20%D7%9C%D7%99%D7%A9%D7%A8%D7%90%D7%9C/%D7%92.1.%20%D7%94%D7%9C%D7%99%D7%9B%D7%99%D7%9D%20%D7%9E%D7%A9%D7%A4%D7%98%D7%99%D7%99%D7%9D%20%D7%95%D7%A4%D7%A0%D7%99%D7%95%D7%AA%20-%20%D7%9E%D7%98%D7%A8%D7%95%D7%AA%20%D7%9B%D7%A0%D7%99%D7%A1%D7%94%20%D7%9C%D7%99%D7%A9%D7%A8%D7%90%D7%9C/%D7%9E%D7%95%D7%A8%D7%99%20%D7%93%D7%A8%D7%9A%20%D7%A4%D7%9C%D7%A1%D7%98%D7%99%D7%A0%D7%99%D7%9D/%D7%9B%D7%AA%D7%91%20%D7%A2%D7%AA%D7%99%D7%A8%D7%94.pdf&parent=/sites/syntaxOcrTest/DocLib1)).\n\n3. **טענות משפטיות**: נטען כי הסכמים בינלאומיים, כמו נספח התיירות, אינם מקנים זכות ישירה ליחידים לתבוע סעד מהמדינה, ולכן אין לעותרים זכות אישית לעתור לאכיפת או התערבות ביישום ההסכם ([פסק דין.pdf](https://tikshuv.sharepoint.com/sites/syntaxOcrTest/DocLib1/Forms/AllItems.aspx?id=/sites/syntaxOcrTest/DocLib1/%D7%A2%D7%A0%D7%A3%20%D7%91%D7%99%D7%98%D7%97%D7%95%D7%9F/%D7%9E%D7%93%D7%95%D7%A8%20%D7%90%D7%95%D7%9B%D7%9C%D7%95%D7%A1%D7%99%D7%9F/%D7%90.%20%D7%9B%D7%A0%D7%99%D7%A1%D7%94%20%D7%9C%D7%99%D7%A9%D7%A8%D7%90%D7%9C/%D7%92.1.%20%D7%94%D7%9C%D7%99%D7%9B%D7%99%D7%9D%20%D7%9E%D7%A9%D7%A4%D7%98%D7%99%D7%99%D7%9D%20%D7%95%D7%A4%D7%A0%D7%99%D7%95%D7%AA%20-%20%D7%9E%D7%98%D7%A8%D7%95%D7%AA%20%D7%9B%D7%A0%D7%99%D7%A1%D7%94%20%D7%9C%D7%99%D7%A9%D7%A8%D7%90%D7%9C/%D7%9E%D7%95%D7%A8%D7%99%20%D7%93%D7%A8%D7%9A%20%D7%A4%D7%9C%D7%A1%D7%98%D7%99%D7%A0%D7%99%D7%9D/%D7%A4%D7%A1%D7%A7%20%D7%93%D7%99%D7%9F.pdf&parent=/sites/syntaxOcrTest/DocLib1)).\n\n4. **טענות על אפליה ואי-שוויון**: נטען כי ישנה אפליה כלפי פלסטינים במתן היתרים וביישום הסכמים בינלאומיים, כמו נספח התיירות, אשר אינם מקנים כמות מסוימת של היתרים או תנאים להענקתם ([פסק דין.pdf](https://tikshuv.sharepoint.com/sites/syntaxOcrTest/DocLib1/Forms/AllItems.aspx?id=/sites/syntaxOcrTest/DocLib1/%D7%A2%D7%A0%D7%A3%20%D7%91%D7%99%D7%98%D7%97%D7%95%D7%9F/%D7%9E%D7%93%D7%95%D7%A8%20%D7%90%D7%95%D7%9B%D7%9C%D7%95%D7%A1%D7%99%D7%9F/%D7%90.%20%D7%9B%D7%A0%D7%99%D7%A1%D7%94%20%D7%9C%D7%99%D7%A9%D7%A8%D7%90%D7%9C/%D7%92.1.%20%D7%94%D7%9C%D7%99%D7%9B%D7%99%D7%9D%20%D7%9E%D7%A9%D7%A4%D7%98%D7%99%D7%99%D7%9D%20%D7%95%D7%A4%D7%A0%D7%99%D7%95%D7%AA%20-%20%D7%9E%D7%98%D7%A8%D7%95%D7%AA%20%D7%9B%D7%A0%D7%99%D7%A1%D7%94%20%D7%9C%D7%99%D7%A9%D7%A8%D7%90%D7%9C/%D7%9E%D7%95%D7%A8%D7%99%20%D7%93%D7%A8%D7%9A%20%D7%A4%D7%9C%D7%A1%D7%98%D7%99%D7%A0%D7%99%D7%9D/%D7%A4%D7%A1%D7%A7%20%D7%93%D7%99%D7%9F.pdf&parent=/sites/syntaxOcrTest/DocLib1)).\n\nטענות אלו משקפות את המורכבות והרגישות של הנושאים הנדונים בעתירות בב\"ח פלסטיני.",
    "contexts": [
      "7. ההתרחשויות בזירה הפלסטינית משמרות אצל אוכלוסיית האחמ״ש ובני משפחתם רגישות מוגברת לטריגרים, באופן שעלול להעצים את נכונותם לקדם פעילות טרור בעיקר בעתות הסלמה ביטחונית.\n8. זאת, כפי שבא לידי ביטוי באירועי ההסלמה המרכזיים של השנים האחרונות:\nא. ההסלמה הביטחונית של 2015-2016, במהלכה ניכרה עלייה במעורבותם בטרור של מפגעים, שהם בני משפחה של בעלי מעמד מכוח איחוד משפחות. כך, מתוך 8 פיגועים משמעותיים (פיגוע עם נפגעים; שימוש בנשק חם/קר או דריסה) שביצעו ערבים ישראלים, 4 בוצעו על ידי צאצאי אחמ״שים. בין אלה בלטו:",
      "5 שיוסכמו בין מדינת ישראל לרש״פ בוועדה הכלכלית המשותפת או בוועדת משנה לתיירות שתוקם על-ידה. 6\n7\n8 המשיב פירט בתגובתו המקדמית מיום 30.11.2022 ובתגובתו המשלימה מיום .3\n9 16.2.2023 את האופן בו יושם נספח התיירות הלכה למעשה. הפירוט העובדתי בעניין 10 זה נתמך במסמכים שהמשיב ביקש למסור לעיוני במעמד צד אחד, בנימוק לפיו מדובר\n11 במידע שאין למסרו לעותרים עקב הגנה על יחסי חוץ, או מידע שאין חובה למסרו\n12 לעותרים בהיותו תרשומות פנימיות (ראו: סעיף 9(א) (1) וסעיף 9 (ב) (4) לחוק חופש 13 המידע, התשנ״ח-1998, בשילוב עם תקנה 13 לתקנות בתי משפט לעניינים מנהליים\n14 (סדרי דין), התשס״א-2000). 15\n16 בהעדר התנגדות לכך מצד ב״כ העותרים, עיינתי במסמכים האמורים במהלך\n17 הדיון שהתקיים לפניי ביום 11.6.2023 (העיון נעשה כאשר כלל הצדדים נוכחים באולם 18 הדיונים). במקביל לעיון, הכתבתי לפרוטוקול פרפרזות מתוך המסמכים על דעת ב״כ 19 המשיב (שם, עמ׳ 2).\n20",
      "סיכם: אילון כהן\ngov www.gov.il\nפקס: טלפון: http://www.moch.gov.il\nטר\nצוות ההסדרה של תעסוקת פלסטינים בענף הבניה\nFRANK\nמיכל ויסברוד וחגי אטקס (בנק ישראל)\nOF\n19 אפריל 2016\nISRAE\nהסדרה של תעסוקת פלסטינים בענף הבניה\nשאלות כלליות .\nפריון העבודה במגזר העסקי ובענף הבניה מאפייני עובדים פלסטיניים בענף הבנייה בישראל ובשטחים\n.\n.\nמיסוי עובדים פלסטיניים\n.\n. תשלום שכר נטו איסוף מידע משלים .\nהסדרה של תעסוקת פלסטינים בענף הבניה שאלות כלליות\nהאם הצוות יגיש המלצות לגבי התעסוקה בבניה בישראל בלבד או גם - פער מטריד בין דיווחים לבט״ל בענף הבנייה באיו״ש לבין היתרים בהתיישבות שהמנהל מנפיק\n. בהתנחלויות?\nמה החזון של מ״י למבנה התעסוקה והטכנולוגיה של ענף הבנייה? - האם וכיצד ההסדרה של התעסוקה הפלסטינית בענף עולה בקנה אחד\n. עם חזון זה?\n- פריון, הכשרות וכן׳\nהאם יש להתנות מתן היתרים חדשים למעסיק בעמידה בקריטריונים כבטיחות העובדים, השקעות וכו׳?",
      "7 מתוך 14\n-SDDBDS\nישראל\nבית המשפט המחוזי בירושלים בשבתו כבית-משפט לעניינים מנהליים\nעת״מ 51336-09-22 שאהין נ׳ שר התיירות תיק חיצוני:\n1\n2 כך גם בענייננו: נספח התיירות לא נקלט לדין הישראלי הפנימי, והוא נותר בגדר\n3 הסכם בינלאומי בין הצדדים לו - מדינת ישראל והרש״פ. משכך, הסכם זה אינו מקנה\n4 זכות ישירה ליחידים לתבוע סעד מהמדינה מכוחו. ממילא, ככל שעתירתם של העותרים 5 מבקשת לאכוף או להתערב בדרך יישומו של נספח התיירות, הרי אין לעותרים זכות\n6\nאישית לעתור לכך. 7\n8 13. מעבר לנדרש, אציין כי אפילו הייתה לעותרים אפשרות לעתור כנגד המדינה\n9 מכוחו של נספח התיירות - ויודגש כי אין כך הדבר - הרי הסעד המבוקש בעתירה אינו 10 מתחייב מהוראותיו של הנספח הנדון. הוראות נספח התיירות הן כלליות. הנספח אינו\n11 קובע כמה רישיונות כל צד יעניק כדי לאפשר למדריכי תיירות של הצד השני להדריך\n12 בתחומו. הנספח אף אינו מונה את התנאים להענקת רישיונות כאלה. כפי שצוין בסוף",
      "4. אבקש להדגיש: עלייה חדה זו במספר המבקרים והלינות יצר מצב מעוות בו אלפי מדריכי תיירים ישראליים - המלווים מיליוני תיירים וצליינים באוטובוסים, מיניבוסים ואף מכוניות שכורות - נכנסים במרוצת השנה לתחומי בית לחם, יריחו, חברון ואתרי\nארכיאולוגיה רבים בגדה - ומתפרנסים בשפע מליווי ואירוח אלפי קבוצות התיירים והצליינים בבית לחם וסביבותיה - בעוד רק 50 מדריכי תיירים פלשתינים מורשים מאז שנת 2005 ללוות את קבוצותיהם לתוך תחומי ישראל ולהתפרנס מכך - מבלי שנוסף מאז אפילו היתר כניסה אחד למדריך תיירים פלשתיני !!\n5. האם זו הדדיות? האם זה איזון כלכלי\\פרנסתי הוגן כלפי פוטנציאל המדריכים הפלשתינים שהוסמכו - (לאחר שעברו קורס מדריכים בן שנתיים) - אל מול נחשול של מיליוני תיירים ב- 2019 - עם צפי גידול מרשים לשנים הבאות ??",
      "9 הקשורים ביישום נספח התיירות כחלק מניהול יחסי חוץ ועניינים מדיניים של מדינת\n10 ישראל (ראו בעניין זה: פס׳ 57 לתגובה המקדמית מיום 30.11.2022). בעניינים מסוג\n11 זה, לרשות המבצעת מסור מתחם שיקול דעת רחב במיוחד, שבית המשפט לא יחליפו 12 בשיקול דעתו. ניתן להפנות בהקשר זה בשינויים המחויבים לדבריו של כב׳ השופט מינץ 13 בבג״צ 1038/22 חברת אלפלוגה למוצרי מזון נ׳ משרד הכלכלה והתעשייה (2.6.2022), שם נדונה עתירה שעניינה תחום ייבוא הבשר לשטחי הרש״פ לפי פרוטוקול פריז. וכך נפסק 14\n15\nשם:\n16\n17",
      "תעודות הזהות הישראליות בהן החזיקו, אשר אפשרו להם תנועה חופשית בין שטחי הרשות הפלסטינית לישראל. בהתאם לכך, במהלך אירועי האינתיפאדה השנייה התגלתה מעורבות הולכת וגוברת של פלסטינים תושבי האזור אשר ניצלו את מעמדם בישראל - שהתקבל בעקבות הליכי איחוד משפחות עם ישראלים - לשם מעורבות בפעולות טרור, ובכלל זה סיוע לביצוע אותם פיגועי התאבדות קטלניים.",
      "20 המסקנה המתבקשת היא כי הסעד המבוקש בעתירה - להורות למשיב להוסיף\n21 עוד 37 היתרי הדרכה בישראל (כמספרם של העותרים) ולהעניק היתרים אלה לעותרים\n22 דווקא - אינו מתחייב מנספח התיירות. כאמור, הוראות הנספח אינן קובעות כמות\n23 היתרים, ואף אינן קובעות כי מדריך תיירות זה או אחר יקבל היתר להדרכת קבוצות\n24 בישראל. אציין כי בדיון לפניי הציע ב״כ העותרים כי מדינת ישראל תפרסם מכרז ובדרך\n25 זו תבחר מדריכי תיירות פלסטיניים אשר יקבלו היתרי הדרכה בישראל, וזאת בנוסף\n26 לקבוצת 50 המדריכים הפלסטיניים הזוכים לרישיונות כאלה היום (פרוטוקול דיון מיום\n27 11.6.2023, עמ׳ 4, ש׳ 12-13). הצעה זו לפרסום מכרז אף היא אינה מעוגנת בנספח התיירות, ובוודאי שאינה מתחייבת מהוראותיו.\n28\n8 מתוך 14\n-SDDBDS\nישראל\nבית המשפט המחוזי בירושלים בשבתו כבית-משפט לעניינים מנהליים\nעת״מ 51336-09-22 שאהין נ׳ שר התיירות תיק חיצוני:\n1",
      "פעילות יחידת קמ״ט תעסוקה\nרקע\nפלסטינים המתגוררים באיו״ש מועסקים בישראל ובאיו״ש (ביישובים ישראליים, באזורים כפריים ובמפעלי התעשייה באזור), על בסיס היתרי העסקה שמנפיק להם המנהא״ז. עבודת הפועלים הפלסטינים בישראל ובאיו״ש היא מרכיב משמעותי בכלכלה הפלסטינית, ולעבודתם תרומה לענף הבנייה בישראל.\nמספר הפלסטינים המורשים לעבוד בישראל נקבע בהחלטות ממשלה שעניינן קביעת מכסות להעסקת עובדים פלסטינים בישראל. מכסות אלה מפולחות ומוקצות לענפי התעסוקה השונים, כגון בניין, תעשייה ושירותים, חקלאות, בריאות ומלונאות.",
      "29\n30\n31\n32\n33\n34\n9 מתוך 14\n-SDDBDS\nישראל\nבית המשפט המחוזי בירושלים בשבתו כבית-משפט לעניינים מנהליים\nעת״מ 51336-09-22 שאהין נ׳ שר התיירות תיק חיצוני:\n1\n2 15. הנה כי כן, ככל שהעתירה נשענת על נספח התיירות, הרי דינה להידחות בהעדר 3 עילת תביעה אישית לעותרים מכוחו של נספח התיירות, וממילא בהעדר יריבות ביניהם 4 ובין המשיב מכוח אותו נספח. זאת ועוד; ככל שהעתירה נשענת על נספח התיירות הרי\n5 דינה להידחות גם לעיצומם של דברים, שכן הסעד המתבקש בעתירה אינו מתחייב 6 מהוראותיו של הנספח. כמו כן, לא נמצא מקום להתערב בשיקול דעתו הרחב במיוחד\n7 של המשיב בנוגע לניהול יחסי החוץ והיחסים המדיניים מול הרש״פ מכוח נספח 8\nהתיירות. 9 10 16. בחינת העתירה מנקודת מבט של הדין הישראלי הפנימי המעוגן בתקנות, אף היא\n11\nלא תועיל לעותרים:\n12\n13 לתושב אזור אין זכות קנויה לשמש מורה דרך בישראל. יתרה מזאת; כפי שהוסבר"
    ]
  },
  {
    "question": "איפה מעוגן בחוק האסיור על ביצוע חלוקה בהיעדר תכנית חלוקה",
    "reference_answer": "סעיף 28(1) לחוק התכנון והבנייה הירדני",
    "rag_answer": "התשובה לשאלה זו אינה זמינה במקורות שסופקו. אם יש לך מקורות נוספים או פרטים נוספים, אנא ספק אותם ואנסה לעזור בהתאם.",
    "contexts": [
      "11:06 ,5.1.2023\nabout:blank\nבית המשפט המחוזי בירושלים בשבתו כבית-משפט לעניינים מנהליים\nעת״מ 20398-10-22 אלקרם נ׳ הביטחון ואח׳\nבפני כב׳ הסגן נשיא משה סובל\nהעתק החלטת בית משפט מיום י״א טבת תשפ״ג 04 ינואר 2023\nלאור הודעת המשיבים על הסרת המניעה הביטחונית בעניינו של העותר, העתירה נמחקת.\nאין צו להוצאות.\nהדיון הקבוע ליום 10.1.23 מבוטל.\nהאגרה תוחזר לעותר באמצעות ב״כ בהתאם לתקנות.\nהחלטה\n*** בכל מקרה, הנוסח המחייב הוא זה שבהחלטה החתומה על ידי השופט\n-1 -\nabout:blank\n1/1",
      "לשם פיקוח יעיל המאפשר להשיג את מטרתו נדרשים תוכנית עבודה מסודרת ושימוש אפקטיבי בממצאי הביקורת כדי לאכוף את החוק. על קמ״ט תעסוקה לבחון את האפשרות לקבוע תוכנית ביקורת מסודרת ומקיפה ככל האפשר בהתאם לתקני כוח האדם הקיימים ביחידתו בנושא העסקת פלסטינים ביישובים ישראליים באיו״ש. כמו כן עליו לסכם, לנתח ולהפיץ לגורמים הרלוונטיים במנהא״ז את ממצאי הביקורות אשר מבוצעות בקרב מעסיקים באיו״ש, כדי שהגורמים הללו - כל אחד בתחום אחריותו - יוכל לבצע פעולות אכיפה כלפי מעסיקים, וכל זאת על מנת לוודא כי המעסיקים הישראלים ממלאים את החובות החוקיות המוטלות עליהם.",
      "בקליפתה, מבלי להותיר שריד מתוכנה' (מנחם הופנונג ישראל - בטחון המדינה מול שלטון החוק 105 (1991)). הן חורגות מן 'התפישה העקרונית של שיטת המשפט בישראל שיש לקיים את מצוות החוקה גם אל מול איום הטרור׳ (חברי, המשנה לנשיאה, בבש״פ 8823/07 פלוני הנ״ל). המשך קיומו של חוק האזרחות והכניסה לישראל [ ... ] מטיל צל כבד על סיכוייה של הדמוקרטיה בישראל לעמוד באתגרים להם יכלה עד כה. טועה מי שסבור, כי לאורך זמן יוכל אף הרוב, שמכוח הכרעותיו בא חוק זה אל העולם, לעמוד בפני פגיעתו הרעה. חוששני, כי זו תאיים להשיג כל ישראלי באשר הוא, הואיל וטמון בה הכוח לערער את המסד עליו ניצבים כולנו שכם-אל-שכם. בסופו של יום פגיעה זו, רחוקה וזוחלת ככל שתהיה, ממלכתית ככל שהיא נחזית, אין נזקה פחות מזה הטמון במעשי הטרור מפניהם מבקשים אנו להתגונן. בלשון חברתי, השופטת א׳ חיות: 'עלינו לתת את הדעת למחיר שנשלם כחברה בטווח הארוך אם חוק האזרחות על איסוריו הגורפים ימשיך למצוא את מקומו",
      "העתק התכתובת עם משרד הפנים בין הימים 24.10.2001 - 11.3.2002 מצ״ב ומסומן ע/16.\n(3) 31 במרץ 2002: שר הפנים מורה על הקפאת איחוד משפחות עם פלסטינים\n34. ביום 31.3.2002 אירע פיגוע התאבדות במסעדת מצה בחיפה. 16 אזרחים נרצחו, וכ-40 נפצעו. את הפיגוע ביצע שאדי טובסי, שלו ניתן מעמד בישראל, משום שאימו אזרחית ישראלית (אביו מג'נין). הגם שטובסי לא קיבל את מעמדו כבן זוג בהליך איחוד משפחות, עוד באותו היום הורה שר הפנים, אלי ישי, למנהלי לשכות מינהל האוכלוסין ברחבי ישראל להקפיא את הטיפול בבקשות לאיחוד משפחות עם פלסטינים. בכתבה שפורסמה למחרת, 1.4.2002, על ידי מזל מועלם ב\"הארץ\" (\"ישי הקפיא איחוד משפחות של ערבים ישראלים שנישאו לתושבי רשות\"), שוב הובאו הנתונים בדבר מספר הבקשות שהוגשו מאז שנת 1993, הטענה שכל בקשה \"גוררת אחריה\" 6 בקשות נוספות בממוצע, ויוזמות של השר ישי לבלימת התופעה, שכעת באה לידי\nביטוי בהחלטתו.\nהעתק הכתבה מיום 1.4.2002 מצ״ב ומסומן ע/17.",
      "ביטוי בהחלטתו.\nהעתק הכתבה מיום 1.4.2002 מצ״ב ומסומן ע/17.\n(4) 12 במאי 2002: החלטת הממשלה 1813 והטעמים הדמוגרפיים שביסודה\n35. את החלטת השר החליפה ביום 12.5.2002 החלטת הממשלה 1813: הטיפול בשוהים בלתי- חוקיים ומדיניות איחוד משפחות בנוגע לתושבי רש״פ ולזרים ממוצא פלסטיני. בין היתר נקבע\n14\nבסעיף ב׳ להחלטה, תחת הכותרת \"מדיניות איחוד משפחות (אחמ״ש)\", כי \"לנוכח המצב הביטחוני, ובשל ההשלכות של תהליכי ההגירה וההשתקעות של זרים ממוצא פלסטיני לישראל [כך במקור], לרבות בדרך של אחמ״ש\", תגובש מדיניות חדשה לטיפול בבקשות אחמ״ש בנהלים ובחקיקה. עד אז \"לא תתקבלנה בקשות חדשות של תושבי הרשות הפלסטינית לקבל מעמד של תושב או מעמד אחר; בקשה שהוגשה בעבר לא תאושר, ובן הזוג הזר יידרש לשהות מחוץ לישראל עד לקבלת החלטה אחרת\". בקשות אחרות תיבחנה \"בשים לב למוצאו של המוזמן\". מי שנמצאים בהליך המדורג יוקפאו במעמד שניתן להם - ההיתר יוארך ולא יהיה שדרוג של המעמד.",
      "העיסוק. ראו עניין בדראן, פס׳ 37 לפסק דינו של כב׳ השופט (כתוארו אז) פוגלמן: \"בהינתן התשתית שלפנינו לא מצאתי יסוד לקבל את הטענה בדבר פגיעה בזכות החוקתית לחופש העיסוק. סעיף 3 לחוק-יסוד: חופש העיסוק קובע כי \"כל אזרח או תושב של המדינה זכאי לעסוק בכל מקצוע, עיסוק, או משלח יד\". שאלה היא אם חוק היסוד פורש את הגנתו בהקשר זה על מחזיקי היתרי המת״ק מקרב אוכלוסיית האחמ״ש. העותרים לא הציגו טיעון מפורט בנושא זה. מכל מקום, גם אם היינו עונים על שאלה זו בחיוב, לא בוססה טענה כי בעניינו של העותר 1 - הוא העותר המחזיק בהיתר מת״ק - נפגעת הזכות החוקתית לחופש העיסוק, וכפי שיוזכר להלן, העותר עובד בעסק פרטי במרכז הארץ\".",
      "תוקף החוק. 67. בקשתו של העותר להסרת המניעה הביטחונית הוגשה למשיב 2 לאחר פקיעת חוק הוראת השעה. לאור פקיעת תוקף החוק מתעוררות שאלות לגבי זהות בעל הסמכות לקבל את ההחלטה ביחס למתן היתרי כניסה לישראל, מעמדה של חוות הדעת הביטחונית, הסמכות למנוע כניסה, וכיוצא בזאת. 68. בהיעדר הסדר חוקי חלופי, ממשיכים המשיבים כאמור לפעול לאור ההסדר החוקי שפקע והם מוסיפים לקיים את המנגנון שנקבע בנהלי המשיבים לאור הוראות החוק. בנסיבות אלה, ובהיעדר מנגנון אחר שיאפשר ביקורת שיפוטית על החלטות המשיבים, מתבקש בית המשפט הנכבד לבחון את ההחלטה שקיבלו המשיבים ביחס לעותר ואשר הינה לשיטתו בלתי סבירה לגופה, על פי אמות המידה שהשתרשו ונקבעו בפסיקת בתי המשפט לאורך השנים, חרף פקיעת חוק הוראת השעה. 69. עוד יצוין שבניגוד להליכים בנוגע למניעות כניסה לישראל, הטיפול בבקשות אחרות מכוח חוק הוראת השעה, כגון בקשות לאיחוד משפחות- הוקפא למיטב הידיעה עד להודעה חדשה. מן הבחינה הזו מובן מאליו שעדיף",
      "העתק הפרוטוקול מיום 6.9.2020 בבג״ץ 3818/20 מצ״ב ומסומן ע/23.\n(7) הוראת השעה - איסור כללי לצד חריגים\n56. נשוב אל הוראת השעה הקודמת. לשעה על שום מה? על שום שעל פי הוראות סעיף 5 לה, תעמוד זו בתוקף משך שנה מעת חקיקתה, ואולם הממשלה יכולה להאריך את תוקפה בצו שיאושר על ידי מליאת הכנסת בשנה בכל פעם. מאז נחקקה הוראת השעה הקודמת בחודש אוגוסט 2003 הוארכה שוב ושוב על ידי הממשלה באישור מליאת הכנסת עשרים פעמים (18 פעמים בצו, ופעמיים, בשנים 2005 ו-2007, בתיקוני חקיקה).",
      "תוקף החוק. 67. בקשתו של העותר להסרת המניעה הביטחונית הוגשה למשיב 2 לאחר פקיעת חוק הוראת השעה. לאור פקיעת תוקף החוק מתעוררות שאלות לגבי זהות בעל הסמכות לקבל את ההחלטה ביחס למתן היתרי כניסה לישראל, מעמדה של חוות הדעת הביטחונית, הסמכות למנוע כניסה, וכיוצא בזאת. 68. בהיעדר הסדר חוקי חלופי, ממשיכים המשיבים כאמור לפעול לאור ההסדר החוקי שפקע והם מוסיפים לקיים את המנגנון שנקבע בנהלי המשיבים לאור הוראות החוק. בנסיבות אלה, ובהיעדר מנגנון אחר שיאפשר ביקורת שיפוטית על החלטות המשיבים, מתבקש בית המשפט הנכבד לבחון את ההחלטה שקיבלו המשיבים ביחס לעותר ואשר הינה לשיטתו בלתי סבירה לגופה, על פי אמות המידה שהשתרשו ונקבעו בפסיקת בתי המשפט לאורך השנים, חרף פקיעת חוק הוראת השעה. 69. עוד יצוין שבניגוד להליכים בנוגע למניעות כניסה לישראל, הטיפול בבקשות אחרות מכוח חוק הוראת השעה, כגון בקשות לאיחוד משפחות- הוקפא למיטב הידיעה עד להודעה חדשה. מן הבחינה הזו מובן מאליו שעדיף",
      "ד. להתיר שהייה בישראל של פלסטינים למטרות עבודה, קבלת טיפול רפואי או למטרה זמנית אחרת (סעיף 3ב);\nה. לתת מעמד בישראל, ולפחות היתר לשהייה, למי שמזדהה עם המדינה ופעל - הוא או בן משפחתו - לקידום יעדיה, או שיש למדינה ענין מיוחד בהסדרת מעמדו (סעיף 3ג);\nלהתיר את שהייתם הזמנית בישראל - בהיתר שהייה או בתושבות ארעית - של מי שבקשתם הוגשה עוד בטרם נכנסה לתוקפה בשנת 2002 החלטת הממשלה 1813 אשר שימשה בסיס לחוק - ו\"להקפיא\" אותם במעמד שניתן להם (סעיף 4).\nו."
    ]
  },
  {
    "question": "האם מותר להקים פאנל סולארי לפי אמת מידה 175 במקום שאין בו שימוש צרכני?",
    "reference_answer": "לא, לפי אמת מידה 175 תנאי להקמת פנאל סולארי הוא חיבור במקום צרכנות",
    "rag_answer": "התשובה לשאלה האם מותר להקים פאנל סולארי לפי אמת מידה 175 במקום שאין בו שימוש צרכני אינה זמינה במקורות שסופקו. \n\nאם יש לך מקורות נוספים או פרטים נוספים, אנא ספק אותם ואנסה לעזור בהתאם.",
    "contexts": [
      "מאת: Sylvia Piterman [mailtooritp@inter.net.il] נשלח: Thursday, June 9, 2022 12:53 PM אל: מנהא״ז/אג״מ/הסרות מניעה - אבי <מנהא״ז/אג״מ/מפקד מוקד הסרות מניעה - עידו;<JJ.hasarot@mnz.gov.il << m.m.hasarot@mnz.gov.il\nנושא: [WARNING: UNSCANNABLE EXTRACTION FAILED]Re: בקשה להסרת מניעה בטחונית של פראס עווד אחמד פארס, ת״ז 853708329\nבקשה זו לא הועברה לאבחון.\nאנא אישורכם על קבלת הבקשה וטיפולכם.\nסילביה\nOn 31/05/2022 12:23, Sylvia Piterman wrote: 31.5.2022 שלום, רצ״ב הבקשה שבשורת הנושא. אנא אישורכם על קבלת הבקשה וטיפולכם. בתודה, סילביה\nhttps://outlook.office.com/mail/Popu.Ayosh@idf.il/id/AAQkADIkOTBkZmM2LTBhYTktNGJIOS05ZGExLWFmNWJjNzZiOTg2NgAQAOIfTG9YCiJG ... 1/1",
      "ישראל ביחס לבקשות. על הבקשות לעמוד בבדיקות המנהלתיות והפרוצדוראליות הנדרשות על ידי כל רשות מנהלית רלוונטית, וכן נבדקת אמיתות המסמכים המצורפים לתמיכה בבקשות, והצורך האפשרי בהצגת מסמכים נוספים לביסוסן. ו. נזכיר, כי אין לתושב פלסטיני זכות קנויה להיכנס לישראל, ואין לישראל זכות קנויה לצאת לרצועת עזה.",
      "המשיבים\nתצהיר העותר\nאני הח״מ סלים מחמד משהור גבר עמאר ת.ז. 852628759 אחר שהוזהרתי כי עלי לומר את האמת וכי אהיה צפוי לעונשים הקבועים בחוק אם לא אעשה כן, מצהיר בזה בכתב כדלקמן:\n1. הנני העותר בעת״מ נשוא תיק זה. 2. תצהירי זה ניתן לתמיכה בעתירה ולאימות האמור בה 3. האמור בסעיפים 1 עד 12 שבעתירה הוא בידיעתי האישית. 4. האמור בסעיפים 13 עד 27 שבעתירה הוא נכון לפי מיטב ידיעתי ואמונתי, ועל סמך ייעוץ משפטי שקבלתי. 5. אני מצהיר כי השם דלעיל הוא שמי, החתימה דלמטה היא חתימתי, וכי תוכן תצהירי זה אמת.\nחתימת המצהיר\nN/ Le malo\nאישור\nאני החתום מטה, ג׳בארין עלי, עורך דין, מאשר כי ביום 10/2/2023 הופיע בפניי מר סלים מחמד משהור גבר עמאר ת.ז. 852628759 ולאחר שהזהרתיו, כי עליו לומר את האמת כולה ואת האמת בלבד, וכי יהיה צפוי לעונשים הקבועים בחוק אם לא יעשה כן, אישר את נכונות הצהרתו דלעיל וחתם עליה בפני\nעדנאן ג׳ן\nג׳בארין עורך דין 51037.40 050-9810255\nעלי\nעדנאן ג",
      "6\nבהגינות, בתום לב ללא הפליה ושרירות ובסבירות, אלא שעליו לפעול תוך הגשמת מטרות החקיקה, שרק ממנה יונקת סמכותו\"\n37. על המשיבים לשקול במהירות, ביעילות וברצינות המתחייבת אם קיימות נסיבות שמצדיקות את מניעת העותר מלהגיע למקום עבודתו ולפרנס את משפחתו בכבוד. 38. סירוב המשיבים לבקשתו של העותר, בהסתמך על המניעה המוזנת נגדו, מבלי שסיפקו ראיות לביסוסה, אינו מקיים את דרישת הסבירות כפי שעוצבה על ידי בית משפט נכבד זה בשורה ארוכה של פסקי דין.\n39. כפי שנפסק בבג״צ 8520/91 פאנוס ואח׳ נ׳ דני יתום, אלוף פיקוד מרכז, תק-על 92, על המפקד הצבאי החובה לשקול שוב ושוב את עצם הצורך וההצדקה בהפעלת הסמכות ולבחון מעת לעת, האם עדיין קיימות נסיבות, שמצדיקות שימוש באמצעים פוגעניים, כאלו המונעים מהעותר להגיע לבית חולים לצורך קבלת הטיפול הרפואי הנדרש לו.",
      "6\n9 of 17\nבהגינות, בתום לב ללא הפליה ושרירות ובסבירות, אלא שעליו לפעול תוך הגשמת מטרות החקיקה, שרק ממנה יונקת סמכותו\"\n38. על המשיבים לשקול במהירות, ביעילות וברצינות המתחייבת אם קיימות נסיבות שמצדיקות את מניעת העותר מלהגיע למקום עבודתו ולפרנס את משפחתו בכבוד. 39. סירוב המשיבים לבקשתו של העותר, בהסתמך על המניעה המוזנת נגדו, מבלי שסיפקו ראיות לביסוסה, אינו מקיים את דרישת הסבירות כפי שעוצבה על ידי בית משפט נכבד זה בשורה ארוכה\nשל פסקי דין.\n40. כפי שנפסק בבג״צ 8520/91 פאנוס ואח׳ נ׳ דני יתום, אלוף פיקוד מרכז, תק-על 92, על המפקד הצבאי החובה לשקול שוב ושוב את עצם הצורך וההצדקה בהפעלת הסמכות ולבחון מעת לעת, האם עדיין קיימות נסיבות, שמצדיקות שימוש באמצעים פוגעניים, כאלו המונעים מהעותר להגיע לבית חולים לצורך קבלת הטיפול הרפואי הנדרש לו.",
      "עדנאן ג׳ן\nג׳בארין עורך דין 51037.40 050-9810255\nעלי\nעדנאן ג\nג׳בארין\nבקר דין חותמת מור 51037 050-9630255\nall adnan\n04/01/2023\nמאת: ש.נ. חאמד בע״מ כתובת: עראבה 30812 תיק ניכויים: 905508222 ח.פ. 515360774\n11 llc\nלכל המעוניין,\nהנדון: סלים מחמד משהור עמאר ת.ז. 852628759\nלכל המעוניין, אנו מודיעים לכם בזה שחברת ש.נ. חאמד בע״מ העוסקת בעבודות טיח, מעוניינת\nבהעסקת הנ״ל מרגע שהנ״ל מחזיק בכל האישורים הנדרשים לצורך שהייתו והעסקתו בשטחי מדינת ישראל.\nלבירורים נוספים נא להתקשר לטל - 0523977757.\nבכבוד רב\nש.ג חאמד בע״מ ח.פ דרי שתחום\n2016\nדצמבר\nהפקודה מכילה 6 עמודים\nבלמ״ס -5-\nפעולות בשטחים\nתיאום הממשלה קובץ פקודות קבע\nנספח א׳:\nמת״ק XXX DCO בקשה להסרת מניעה ביטחונית/פלילית طلب لازالت المنع الامني\n17/1222\n1. תאריך הגשת הבקשה:\n21\nتاريخ رفع الطلب\n2. פרטי התושב המבקש: (שם מרובע)\nتفاصيل مقدم الطلب\nשם פרטי-סגיס - שם אב - אוה שלון שם שב -2,22 - שם\nמשפחה - דא?\nاسم الجد\nاسم الاب الاسم العاملة",
      "6\nבהגינות, בתום לב ללא הפליה ושרירות ובסבירות, אלא שעליו לפעול תוך הגשמת מטרות החקיקה, שרק ממנה יונקת סמכותו\"\n38. על המשיבים לשקול במהירות, ביעילות וברצינות המתחייבת אם קיימות נסיבות שמצדיקות את מניעת העותר מלהגיע למקום עבודתו ולפרנס את משפחתו בכבוד. 39. סירוב המשיבים לבקשתו של העותר, בהסתמך על המניעה המוזנת נגדו, מבלי שסיפקו ראיות לביסוסה, אינו מקיים את דרישת הסבירות כפי שעוצבה על ידי בית משפט נכבד זה בשורה ארוכה של פסקי דין.\n40. כפי שנפסק בבג״צ 8520/91 פאנוס ואח׳ נ׳ דני יתום, אלוף פיקוד מרכז, תק-על 92, על המפקד הצבאי החובה לשקול שוב ושוב את עצם הצורך וההצדקה בהפעלת הסמכות ולבחון מעת לעת, האם עדיין קיימות נסיבות, שמצדיקות שימוש באמצעים פוגעניים, כאלו המונעים מהעותר להגיע לבית חולים לצורך קבלת הטיפול הרפואי הנדרש לו.",
      "מלאכ\nاسم العائلة שם המשפחה الاسم الشخصي השם הפרטי\nהמען\nji נשוי\nsnaclu cla displael\nملاك\nالحالة الشخصية המצב האישי\nاسم الزوج /الزوجة שם בן/בת הזוג\nرقم هوية الزوج / الزوجة מספר הזהות בן/בת זוג اسم الزوج / الزوجة\nשם בן/בת הזוג\nاسم العائلة السابق שם המשפחה הקודם الاسم الشخصي السابق השם הפרטי הקודם\nاسم الآب\nשם האב\nاسم الجد\nاسم العائلة عمار שם המשפחה\nاسم الام نوال שם האם\nتاريخ الولادة\nمكان الولادة\nמקום הלידה\nذكر\nהמין\nقفين\nזכר\nطولكرم נרשם כי",
      "שאזורים אלה אינם בתוך תחומי ההתיישבות - אין כל הסדרה של היתרים לאותם פועלים פלסטינים, ובהתאם אין דרישות ביטחוניות שמפקד הפיקוד מטיל על אותם המקרים. אני ניסיתי להגיד שיש כאן תיבת פנדורה שלא כדאי לפתוח\n- כי כל החקלאות בבקעה וכל בתי האריזה, ספק מוסדרים בצורה חוקית כלשהי. לא נראה שהתרשמו ממני, אבל כן\nאמרו שיבדקו את הדברים מול המועצה. העניין המשמעותי שלפתחנו הוא, שיש רצון לעדכן את רשימת אזורי התעשייה בצו 1640. עומרי, היערכותך כי פנייה כאמור תגיע. שים לב, שזה תיקון צו, ולכן צריך להיות מלווה ע״י הדר.\nעד כאן, תודה לכולם!\nסא״ל צבי מינץ| ס׳ יועמ״ש ורע״ן ביטחון לשכת היועץ המשפטי לאיו״ש טל׳: 029977711; פקס: 0774701860 מייל: YoAvyosh@idf.il\nhttps://outlook.office.com/mail/inbox/id/AAQKADUwMTZINjYzLWRhN2INGM4Yy05NDA3LWYONzY1ZGM2NGI2ZAAQACn%2FDOrwnE4qhKR3B ... 2/2",
      "באזורנו וכי ישנם גורמים המבקשים לפגוע בביטחון זה. אך בהעדר ראיות מוצקות ומספיקות כנגד העותר הספציפי שמאששות חשש לפגיעה בבטחון המדינה אין לפגוע בזכויותיו ובציפיותיו של העותר לחיים בכבוד ולפגיעה במקורות פרנסתו, ולאורך כל שנות קיומה דגלה מדינת ישראל בעקרון, והדבר שזור כחוט השני בפסקי הדין של בית משפט העליון, כי הסכנה לפגיעה בביטחון לכשעצמה איננה מצדיקה פגיעה בחירות הפרט (למשל הזכות לנוע) או בזכות הפרט (למשל הזכות לחופש העיסוק), מבלי שנערך איזון ראוי בין רמת הסיכון לבין התועלת אשר לכאורה תצמח מהפעולה הנדונה. ראו לעניין זה, למשל, בג״ץ 2056/04 מועצת הכפר בית סוריק נ׳ ממשלת ישראל, פ״ד נח (5); דנ״פ 7048/97 פלונים נ׳ שר הביטחון, פ״ד נד (1) 721; בג״ץ 5100/94 הוועד הציבורי נגד עינויים נ׳ ממשלת ישראל, פ״ד נג(4) 817."
    ]
  },
  {
    "question": "האם לצורך חיבור פאנל סולארי לפי אמת מידה 175 נדרש היתר הפעלה מקמ\"ט חשמל? לפי איזה חוק?",
    "reference_answer": "נדרש לפי סעיף 2 לצו בדבר חשמל (מתקן חשמל ועבודות חשמל) (יהודה והשומרון) (מס 602),תשל\"ה-1975",
    "rag_answer": "המידע המבוקש אינו זמין במקורות שסופקו. אין במקורות התייחסות לצורך בהיתר הפעלה מקמ\"ט חשמל לצורך חיבור פאנל סולארי לפי אמת מידה 175 או לאיזה חוק זה מתייחס. \n\nאם יש לך מקורות נוספים או פרטים נוספים, אנא ספק אותם ואנסה לעזור בהתאם.",
    "contexts": [
      "מיצוי הליכים\n4. העותר אף הגיש בקשה להסרת מניעה ביום 25 ביולי 2022 והועלה לאבחון וטרם התקבלה תשובה לבקשה.\nמצ״ב העתק המלצת מעסיק ובקשה להסרת מניעה. ומסומנים ע/2. .\n5. המשיבים מחזיקים בגדה המערבית בתפיסה מלחמתית מטעם מדינת ישראל. כמו כן, המשיבים שולטים במתן היתרים לצורכי תעסוקה.\n6. לאור האמור, לא נותר לעותר כל ברירה אלא לפנות לבית המשפט נכבד זה.\nהטיעון המשפטי\nחובת המשיב להבטיח את חייהם התקינים של תושבי השטחים הכבושים\n7. הזכות לחופש התנועה היא הביטוי המרכזי לאוטונומיה של האדם ולמימוש הזכויות שלו. הזכות לחופש התנועה נמנית עם הנורמות של המשפט הבינלאומי. וראו:\nבג״צ 6358/05 וענונו נ׳ אלוף פיקוד העורף תק-על 320-12-006. בג״צ 1890/03 עיריית בית לחם נ׳ מדינת ישראל, תק-על 11-14-12005.",
      ".2\nמ15.05.2018.\nלצורך השלמת התמונה, אציין כי הנ״ל לא החזיק באף היתר מהסוג המבוקש אלה ברישיונות תעסוקה באיזור ההתישבויות בלבד באיזור יהודה ושומרון בין השנים .2011-2018\n.3\nהשגת העותר כנגד המניעה הביטחונית המוזנת כנגדו התקבלה במת״ק ביום 17.07.2018 ע״י אגודת סנט איב והועברה לאבחון גורמי הביטחון עוד באותו היום. מגישי הבקשה עודכנו על העברת הבקשה לאבחון עוד באותו יום. ביום 26.07.2018 סורבה הבקשה, נוכח המלצתם השלילית של גורמים אלו. יש לציין כי בניגוד לעתירה אגודת סנט איב עודכנו על הסירוב עוד באותו היום - 26.07.2018.\n.4\nלאור האמור לעיל, ולנוכח סירוב גורמי הביטחון להסיר את מניעת השב״כ, נראה כי העותר מיצה הליכים טרם פנייתו לערכאות משפטיות.\n.5\nהפרקליט המטפל - נודה לניסוח תגובתך ברוח הדברים והעברת הטיוטא דרך משרדנו טרם הגשתה לבית המשפט.\nבברכה,\nברכה אוכלוסין המשפטי\nמדור\nלגדור\nהיועץ\nסרן ייעוץ\nקצין בשם\n00152-01-13990\nבלמ״ס\nScanned with CamScanner",
      "בלמ״ס -1-\nלישראל\nאל\n02-9977071/711\nטל׳:\n077-470-1860\nפקס:\nדוא״ל:\nyoayosh@gmail.com\nסימוכין:\n00152-01-13990\nתשע״ט\nה׳\nבאדר\nבפברואר\n10\n2019\nצבא\nההגנה\nיהודה\nאזור\nוהשומרון\nהמשפטי\nהיועץ\nלשכת\n90631\nבית\n,5\nת״ד\nפרקליטות מחוז ירושלים - אזרחי - לידי הפרקליט המטפל\nהנדון: עת״מ 70889-11-18- מוחמד עלי מוחמד תעאמרה ת.ז. 938618709-\nהתייחסות לעתירה\n1. עניינה של העתירה העוסקת בבקשתו של העותר אשר פרטיו בנדון, המבקש כי\nתותר כניסתו לישראל לצורך תעסוקה.\nמבדיקה במערכת הממוחשבת העומדת לרשותנו, עלה כי העותר הינו תושב הכפר תקוע שבנפת בית לחם, בן 29 לערך ורווק. משכך, העותר עומד בתנאי הסף לכניסה לישראל לצורכי תעסוקה, בכפוף לנהלים הקיימים לעניין זה, ובפרט להיעדר מניעה ביטחונית או פלילית. דא עקא, שבעניינו של העותר מוזנת מניעה ביטחונית החל\n.2\nמ15.05.2018.",
      "מצ״ב העתק המלצת מעסיק ובקשה להסרת מניעה. ומסומנים ע/2. .\n5. המשיבים מחזיקים בגדה המערבית בתפיסה מלחמתית מטעם מדינת ישראל. כמו כן, המשיבים שולטים במתן היתרים לצורכי תעסוקה.\nמיצוי הליכים\n6. העותר הגיש בקשה להסרת מניעה בחודש ינואר 2021 ועד לרגע כתיבת שורות אלה לא נתנה כל תגובה.\n7. לאור האמור, לא נותר לעותר כל ברירה אלא לפנות לבית המשפט נכבד זה.\nהטיעון המשפטי\nחובת המשיב להבטיח את חייהם התקינים של תושבי השטחים הכבושים\nהזכות לחופש התנועה היא הביטוי המרכזי לאוטונומיה של האדם ולמימוש הזכויות שלו. הזכות לחופש התנועה נמנית עם הנורמות של המשפט הבינלאומי. וראו:\n.8\nבג״צ 6358/05 וענונו נ׳ אלוף פיקוד העורף תק-על 320-12-006. בג״צ 1890/03 עיריית בית לחם נ׳ מדינת ישראל, תק-על 11-14-12005.",
      "עת״מ\nבבית המשפט המחוזי בירושלים בשבתו כבית המשפט לעניינים מנהליים\nסלימאן סראיעה ת״ז 401387949 ע״י ב״כ עו״ד מור סוקר מ״ר 65650 מרחוב ז׳בוטינסקי 33, רמת גן, מגדל התאומים 1 קומה 13 טל׳: 035750750, טל׳ נייד: 054-4312005, פקס: 0774701867\nהעותר:\n-נגד-\n1. מפקד כוחות צה״ל בגדה המערבית 2. שרות הביטחון הכללי 3. המנהל האזרחי לאזור יהודה ושומרון ע״י פרקליטות מחוז י-ם (אזרחי) מח״ל 7, מעלות דפנה, ת.ד 49333 ירושלים 91493\n: המשיבים\nמועד חתימת המסמך: 6.9.23\nאגרת בית המשפט: 2117 ש״ח (פרט 20 לתוספת לתקנות בתי המשפט (אגרות), תשס״ז-2007).\nנושא העתירה: החלטת רשות מנהלית לגבי כניסה לישראל מהשטחים. הסמכות העניינית: לבית המשפט הנכבד הסמכות העניינית לדון בעתירה מנהלית כנגד החלטת\nהחלטה\n12 (3) לתוספת הראשונה לחוק.\n20\nכ״ח אלול תשפ״ג, 14/09/2023\nשו׳ נמרוד פלקס תיק 13000-09-23",
      ".175\n\"דיברתי עכשיו על המכסות, וגם בהקשר של הסעיף שצריך לשקול את העניין של מדינת ישראל כמדינת הלאום, זה לא מופיע בהצעה הממשלתית, ולכן הממשלה לא תומכת בזה. זה גם יכול לעורר שאלות וקשיים כאלה ואחרים, האם אתה שם פה בדרך עקיפה את עניין התכלית הדמוגרפית, ואז גם צריך לבסס את זה. ודאי אם תחליטו להוסיף את זה, זה אפשרי, ואני לא אומר שיש מניעה משפטית, אבל תיקחו בחשבון שבסופו של דבר, בכל מקרה, כאשר שר הפנים צריך להפעיל את סמכותו, הוא צריך לשקול את כל השיקולים הרלוונטיים בכל החוקים. השיקולים הרלוונטיים הם גם השיקולים של חוק יסוד: כבוד האדם, גם חוק הלאום וגם חוקים אחרים. מישהו יכול לחשוב שמכלל הן יישמע לאו, וזה לא כולל חוקים אחרים. לכן, שאלת הצורך בזה לא ברורה לי.",
      "ג. מדוע לא יקבע כי אין לבטל רישיון תעסוקה של פועל פלסטיני מבלי לקיים קודם הליך שימוע שבמסגרתו תקוים חובת ההנמקה ותישמר זכות הטיעון.\nד. מדוע לא יקבע כי החלטת המשיבים למנוע את כניסת העותר לישראל לצורך עבודה היא נעדרת עילה, בלתי סבירה, ובלתי מידתית.\nנחתם דיגיטאלית *** ***\nהעותר\n1. העותר יליד שנת 1998, בן 25, נשוי, תושב עזריה.",
      "מצ״ב העתק המלצת מעסיק ובקשה להסרת מניעה. ומסומנים ע/2. .\n5. המשיבים מחזיקים בגדה המערבית בתפיסה מלחמתית מטעם מדינת ישראל. כמו כן, המשיבים שולטים במתן היתרים לצורכי תעסוקה.\nמיצוי הליכים\n6. העותר הגיש בקשה להסרת מניעה בחודש פברואר 2021 ועד לרגע כתיבת שורות אלה לא נתנה כל תגובה.\n7. לאור האמור, לא נותר לעותר כל ברירה אלא לפנות לבית המשפט נכבד זה.\nהטיעון המשפטי\nחובת המשיב להבטיח את חייהם התקינים של תושבי השטחים\nהכבושים\nהזכות לחופש התנועה היא הביטוי המרכזי לאוטונומיה של האדם ולמימוש הזכויות שלו. הזכות לחופש התנועה נמנית עם הנורמות של המשפט הבינלאומי. וראו:\n.8\nבג״צ 6358/05 וענונו נ׳ אלוף פיקוד העורף תק-על 320-12-006. בג״צ 1890/03 עיריית בית לחם נ׳ מדינת ישראל, תק-על 11-14-12005.",
      "36. כידוע, בישראל מועסקים כדין כ-100 אלף פלסטינים בעלי היתרי עבודה, וזאת לצד כ- 40,000 עובדים נוספים המועסקים בהתנחלויות הישראליות בגדה המערבית. עתירה זו עניינה בין היתר בפגיעה הקשה לה גורמים המשיבים בזכויותיהם של עובדים אלה. 37. הטיעון השגור בפי המשיבים, כי לפלסטינים אין זכות קנויה לעבוד בישראל, אינו חזות הכל. לא ניתן לטעון שמי שעובד בהיתר כדין במשך שנים לא קונה זכויות, ולו כעובד. כל ניסיון לעשות כן יהווה אפליה פסולה בין עובדים בישראל ויעלה כדי השתת פגיעה חמורה ללא הצדקה, תוך התעלמות מחוקי העבודה ומההלכות המשפטיות שנקבע שחלות על כלל העובדים בישראל כאחד, ללא יוצא מן הכלל. 38. \"היעדר זכות קנויה לעבוד בישראל\" הוא הטיעון העומד במרכז בקשות המשיבים לדחות את כלל העתירות שעניינן כניסה לישראל מהשטחים על הסף בהיעדר עילה. אולם, טענה זו שנטענת שוב ושוב בכל אחד ממאות או אלפי ההליכים שמתקיימים בפני בית המשפט הנכבד בכל שנה, עשרות אלפי",
      "מצ״ב העתק המלצת מעסיק ובקשה להסרת מניעה. ומסומנים ע/2. .\n5. המשיבים מחזיקים בגדה המערבית בתפיסה מלחמתית מטעם מדינת ישראל. כמו כן, המשיבים שולטים במתן היתרים לצורכי תעסוקה.\nמיצוי הליכים\n6. העותרת הגישה בקשה להסרת מניעה בחודש פברואר 2021 ועד לרגע כתיבת שורות אלה לא נתנה כל תגובה.\n7. לאור האמור, לא נותר לעותרת כל ברירה אלא לפנות לבית המשפט נכבד זה.\nהטיעון המשפטי\nחובת המשיב להבטיח את חייהם התקינים של תושבי השטחים הכבושים .8\nהזכות לחופש התנועה היא הביטוי המרכזי לאוטונומיה של האדם ולמימוש הזכויות שלו. הזכות לחופש התנועה נמנית עם הנורמות של המשפט הבינלאומי. וראו:\nבג״צ 6358/05 וענונו נ׳ אלוף פיקוד העורף תק-על 320-12-006. בג״צ 1890/03 עיריית בית לחם נ׳ מדינת ישראל, תק-על 11-14-12005."
    ]
  },
  {
    "question": "האם לפי נוסחה העדכני של אמת מידה 175 לספר אמות המידה יש חובה להתקין פאנל סולארי על גבי גג, ולא למשל בתור גג?",
    "reference_answer": "לא. לפי הנוסח העדכני ניתן לראות בפאנל הסולארי כגג בפני עצמו. ",
    "rag_answer": "התשובה לשאלה האם לפי נוסחה העדכני של אמת מידה 175 לספר אמות המידה יש חובה להתקין פאנל סולארי על גבי גג, ולא למשל בתור גג, אינה זמינה במקורות שסופקו. \n\nהמקורות שסופקו עוסקים בעיקר בנושאים של כניסה לישראל, מניעות ביטחוניות, והליכים משפטיים הקשורים לכך, ולא כוללים מידע על התקנת פאנלים סולאריים או דרישות טכניות הקשורות לכך.\n\nאם יש לך מקורות נוספים או מסמכים אחרים שיכולים לספק מידע על הנושא, אנא ספק אותם ואשמח לעזור.",
    "contexts": [
      "כפי שיובהר להלן, העותר אינו עומד גם בקריטריונים העדכניים שפורסמו לציבור תושבי האיזור.  \nבמהלך חודש השנה, הוחלט להרחיב את הקריטריונים להגשת בקשה כבעניינו של העותר. כך לדוגמא, בהתאם לקריטריונים העדכניים רשאים רווקים שעברו את גיל 27 להגיש בקשת היתר כניסה לישראל למטרות עבודה בענף הבניין. \nאמנם, הקריטריונים החדשים טרם עודכנו באופן רשמי בנוהל סטטוס הרשאות הידוע, והם יתווספו לנוהל במועד פרסומו של הנוהל המעודכן, אך מכל מקום, הקריטריונים העדכניים הובאו, כנהוג, לידיעת תושבי האזור, באמצעות מערך הקישור הפלסטיני, ואף פורסמו בעמוד הפייסבוק של המינהל האזרחי. \nצילום הפרסום מדף הפייסבוק של המשיבה מצורף כנספח א'.  \nיודגש כי הרחבת הקריטריונים העדכניים אינם משנים את מצבו של העותר שבשל גילו ומצבו המשפחתי אינו זכאי להגשת בקשת היתר כניסה לעבודה בענף הבניין.",
      "עניין נוסף הקשור לאוכלוסיות \"המצטרפות לטרור\" לאחר כניסתן לישראל מקורו בלחץ המופעל על בני משפחות של הנכנסים (שנשארו מחוץ לישראל) לגייס את קרוביהם שנכנסו לארץ - לפעילות עוינת בישראל, ולא - יבולע להם\".\nעל מגבלותיה של הבדיקה הפרטנית, ראו גם את דבריו של כב׳ השופט הנדל (כתוארו אז) בעניין בדראן, פס׳ 6; את פסק דינו של כב׳ השופט (כתוארו אז) גרוניס בבג״ץ 5539/05 עטאללה נ׳ שר\nהביטחון (3.1.2008).\n240. כעולה מהליך החקיקה וכפי שפורט לעיל בחלק העובדתי, לא חל מאז ניתן פסק הדין בעניין גלאון שינוי בעמדת גורמי הביטחון בדבר מגבלות הבדיקה הפרטנית. על כן, תטען הכנסת כי אין בנמצא\nאמצעי חלופי פוגעני פחות אשר משיג באותה מידה את התכלית הביטחונית בבסיס החקיקה.",
      "צילום הפרסום מדף הפייסבוק של המשיבה מצורף כנספח א'.  \nיודגש כי הרחבת הקריטריונים העדכניים אינם משנים את מצבו של העותר שבשל גילו ומצבו המשפחתי אינו זכאי להגשת בקשת היתר כניסה לעבודה בענף הבניין. \n באשר לטענות ב\"כ העותר כי בעניינו של העותר בעת\"ם 21697-10-22 מנצור נ' מפקד כוחות צה\"ל באיו\"ש  בחנה המשיבה את בקשת העותר שם, על אף שלא עמד בקריטריונים, תבקש המשיבה להעמיד דברים על דיוקם. \nאומנם בתגובה המקדמית שהוגשה מטעם המדינה נכתב כי: ''העותיליינו עומד בתנאי הסף לכניסה לישראל לצרכי תעסוקך בקשתו נבחנה באופן פרטני.\" מדובר בניסוח שאינו מדויק, ואינו משקף את  הדברים כהוויתם. \nכאמור לעיל, הקריטריונים לקבלת היתר כניסה לישראל עודכנו והורחבו. לעניינו הנוהל העדכני מחריג רווקים החל מגיל 22 שאביהם מחזיק בהיתר עבודה בענף הבניין, ומאפשר להם להגיש בקשת היתר כניסה לעבודה בענף הבניין.",
      "בהקשר זה יצוין, כי המשיבים פועלים במידתיות כאמור לעיל תוך איזון השיקולים והנסיבות של כל מקרה ומקרה. יובהר, כי בקשתו של העותר סורבה בשל מניעה ביטחונית אשר מצדיקה את סירוב הסרת המניעה, כאמור, וזאת על סמך עמדה מקצועית של הגורמים הרלבנטיים, ועל כן ברי כי מדובר בשיקולים רלבנטיים. \nעוד יצוין, כי בהתאם להלכה ידועה, בית המשפט הנכבד מעביר תחת שבט הביקורת השיפוטית את ההחלטה המנהלית ובוחן את סבירותה. אין המדובר בהחלפת שיקול הדעת של הרשות המנהלית בשיקול דעתו של בית המשפט הנכבד, ראו רע\"ב 1663/98 בנימין בן נחמיה יאיר נ' נציב שירות בתי הסוהר, תק-על 98(2) 322; בג\"ץ 4539/94 ד\"ר נקסה נביל נ' ד\"ר אפרים סנה ואח', פ\"ד מח(4) 778; פ\"ד מח(3) 542.",
      "כאמור לעיל, הקריטריונים לקבלת היתר כניסה לישראל עודכנו והורחבו. לעניינו הנוהל העדכני מחריג רווקים החל מגיל 22 שאביהם מחזיק בהיתר עבודה בענף הבניין, ומאפשר להם להגיש בקשת היתר כניסה לעבודה בענף הבניין. \nכיוון שאביו של העותר בעת\"מ מנצור אכן מחזיק בהיתר עבודה בענף הבניין, נבחנה בקשתו של העותר להסרת מניעה על ידי הגורמים הביטחוניים.מאידך, מצבו של העותר כאן לא השתנה גם לאחר עדכון הקריטריונים, ומשכך אין מקום לבחינת בקשתו להסרת מניעה ביטחונית.\nיודגש כי גם לו תיבחן בקשת העותר להסרת המניעה ותתקבל, כיוון שכאמור העותר לא עומד בקריטריונים העדכניים לא תותר כניסתו לישראל, ואין כל טעם להעברת בקשתו לבחינת הגורמים הביטחוניים. \nלאור האמור, שבה ומבקשת המדינה את בית המשפט הנכבד להורות על סילוק העתירה על הסף, תוך חיוב העותר בהוצאות המשיבה .",
      "6\nבהגינות, בתום לב ללא הפליה ושרירות ובסבירות, אלא שעליו לפעול תוך הגשמת מטרות החקיקה, שרק ממנה יונקת סמכותו\"\n37. על המשיבים לשקול במהירות, ביעילות וברצינות המתחייבת אם קיימות נסיבות שמצדיקות את מניעת העותר מלהגיע למקום עבודתו ולפרנס את משפחתו בכבוד. 38. סירוב המשיבים לבקשתו של העותר, בהסתמך על המניעה המוזנת נגדו, מבלי שסיפקו ראיות לביסוסה, אינו מקיים את דרישת הסבירות כפי שעוצבה על ידי בית משפט נכבד זה בשורה ארוכה של פסקי דין.\n39. כפי שנפסק בבג״צ 8520/91 פאנוס ואח׳ נ׳ דני יתום, אלוף פיקוד מרכז, תק-על 92, על המפקד הצבאי החובה לשקול שוב ושוב את עצם הצורך וההצדקה בהפעלת הסמכות ולבחון מעת לעת, האם עדיין קיימות נסיבות, שמצדיקות שימוש באמצעים פוגעניים, כאלו המונעים מהעותר להגיע לבית חולים לצורך קבלת הטיפול הרפואי הנדרש לו.",
      "הפנים, פ״ד נח (1) 769).\n76. בעניין החובה לשקול שיקולים ענייניים בלבד והאיסור לשקול שיקולים זרים נאמר:\n\"הרשות השלטונית ... רשאית לפעול על פי שיקול דעתה ובלבד ששיקול דעת זה מקיים את כללי המשפט המינהלי הישראלי (החקוק וההלכתי, המהותי והדיוני) בענין הפעלתו של שיקול דעת מינהלי. על כן, חייב שיקול הדעת השלטוני לקחת בחשבון את אותם שיקולים הנופלים לדלת אמותיו של החוק המסמיך אותו להפעיל שיקול דעת. שיקול החורג ממטרותיו של החוק המסמיך הוא שיקול זר, ועל כן פסול, ואין הרשות השלטונית רשאית להתחשב בו.\" (בג״ץ 953/87 פורז נ׳ מועצת עיריית תל אביב יפו, פ״ד מב (2), 309, 324.)",
      "תאריך החתימה על המסמך: ‏27 דצמבר 2022\nבבית משפט המחוזי בירושלים\t\t\t\tעת\"מ 20387-10-22\nבשבתו כבית משפט לעניינים מנהליים\nבפני כבוד השופט  משה סובל, סגן נשיא\t\n\n\nעותר\t\t \n\t\t\t\tחמזה פזע, ת\"ז 405301854\n\tע\"י ב\"כ עו\"ד  יהונתן קמיל ואח' , מ\"ר עו\"ד74464\nמרח' היסמין 6 (מתחם ת.דלק 10) אזור תעשייה אריאל מערב .\nטל:050-6794549 פקס:03-7399356 \n\t\t\t\t-  נ  ג  ד  -\nמשיבה\t\t \tמדינת ישראל - המנהל האזרחי באיו\"ש\n\t\t \tע\"י פרקליטות מחוז ירושלים - אזרחי\n\t\t \tמרח' מח\"ל 7, ירושלים  9149301 ת\"ד 49333\n\t\t \tטל': 073-3920000 פקס: 02-6468053\n\t\t \tכתובת דוא\"ל: ez-jer@justice.gov.il\n\t \n\t \n \n\nהמועד האחרון להגשה:27.12.22\nהודעה מטעם המשיבה\nבהמשך להחלטת בית המשפט הנכבד מיום 14.12.22 , ולדיון שהתקיים באותו מועד, מתכבדת המשיבה למסור עמדתה באשר להצעת בית המשפט, לאפשר לעותר להגיש בקשה להסרת המניעה הביטחונית על אף שאינו עומד בקריטריוני הסף לקבלת היתר כניסה לישראל.",
      "כמפורט בבקשה לסילוק על הסף, בקשת העותר להסרת מניעה בטחונית, נדחתה משני טעמים: ראשית, בעת הגשת הבקשה טרם חלפה שנה ממועד סירוב בקשת העותר הקודמת, ובהתאם לסעיף 3(ב) לנוהל \"הסרת מניעה ביטחונית לישראל\" בקשת העותר נדחתה. שנית, בשל מצבו המשפחתי וגיל העותר בעת הגשת הבקשה, העותר אינו עומד בקריטריונים הנדרשים לתעסוקה בענף הבנייה בישראל, כפי שהם מופיעים בנוהל סטטוס הרשאות (להלן: \"הנוהל\" ) שצורף כנספח לבקשת הסילוק על הסף. \nהצעת בית המשפט הנכבד עלתה בגין טענות שהעלה ב\"כ העותר , לפיהן בעת\"ם 21697-10-22 מנצור נ' מפקד כוחות צה\"ל באיו\"ש  (להלן: \"עת\"מ מנצור\") בחנה המשיבה את בקשת העותר שם, למרות שלא עמד בקריטריונים. המדינה תבקש להעמיד דברים על דיוקם.",
      "6\nבהגינות, בתום לב ללא הפליה ושרירות ובסבירות, אלא שעליו לפעול תוך הגשמת מטרות החקיקה, שרק ממנה יונקת סמכותו\"\n38. על המשיבים לשקול במהירות, ביעילות וברצינות המתחייבת אם קיימות נסיבות שמצדיקות את מניעת העותר מלהגיע למקום עבודתו ולפרנס את משפחתו בכבוד. 39. סירוב המשיבים לבקשתו של העותר, בהסתמך על המניעה המוזנת נגדו, מבלי שסיפקו ראיות לביסוסה, אינו מקיים את דרישת הסבירות כפי שעוצבה על ידי בית משפט נכבד זה בשורה ארוכה של פסקי דין.\n40. כפי שנפסק בבג״צ 8520/91 פאנוס ואח׳ נ׳ דני יתום, אלוף פיקוד מרכז, תק-על 92, על המפקד הצבאי החובה לשקול שוב ושוב את עצם הצורך וההצדקה בהפעלת הסמכות ולבחון מעת לעת, האם עדיין קיימות נסיבות, שמצדיקות שימוש באמצעים פוגעניים, כאלו המונעים מהעותר להגיע לבית חולים לצורך קבלת הטיפול הרפואי הנדרש לו."
    ]
  },
  {
    "question": "אילו אמצעי אכיפה מנהליים קיימים בצו בדבר אמצעי אכיפה מנהליים",
    "reference_answer": "עיצום כספי, התראה מנהלית והתחייבות להימנע מעבירה חוזרת",
    "rag_answer": "הצו בדבר אמצעי אכיפה מנהליים מאפשר למפקד הצבאי להגדיר עבירות מסוימות כעבירות הניתנות לאכיפה בדרך מנהלית, כתחליף להליך הפלילי. הצו מסמיך מפקחים להטיל עיצומים כספיים על עבירות אלו. לדוגמה, במהלך דיון שהתקיים במנהא\"ז בפברואר 2016, נקבע כי ראוי להטיל עיצומים כספיים בתחומים כמו תעסוקה. עם זאת, בפועל, לא נעשה שימוש בצו זה, והחייאתו תדרוש מספר תיקוני חקיקה ועדכון התוספת לצו, הקובעת את העבירות המנהליות ([דוח מבקר המדינה](https://tikshuv.sharepoint.com/sites/syntaxOcrTest/DocLib1/Forms/AllItems.aspx?id=/sites/syntaxOcrTest/DocLib1/%D7%A2%D7%A0%D7%A3%20%D7%91%D7%99%D7%98%D7%97%D7%95%D7%9F/%D7%9E%D7%93%D7%95%D7%A8%20%D7%90%D7%95%D7%9B%D7%9C%D7%95%D7%A1%D7%99%D7%9F/%D7%90.%20%D7%9B%D7%A0%D7%99%D7%A1%D7%94%20%D7%9C%D7%99%D7%A9%D7%A8%D7%90%D7%9C/%D7%92.1.%20%D7%94%D7%9C%D7%99%D7%9B%D7%99%D7%9D%20%D7%9E%D7%A9%D7%A4%D7%98%D7%99%D7%99%D7%9D%20%D7%95%D7%A4%D7%A0%D7%99%D7%95%D7%AA%20-%20%D7%9E%D7%98%D7%A8%D7%95%D7%AA%20%D7%9B%D7%A0%D7%99%D7%A1%D7%94%20%D7%9C%D7%99%D7%A9%D7%A8%D7%90%D7%9C/%D7%AA%D7%A2%D7%A1%D7%95%D7%A7%D7%94%20%D7%91%D7%99%D7%A9%D7%A8%D7%90%D7%9C/%D7%9E%D7%95%D7%93%D7%9C%20%D7%94%D7%AA%D7%A2%D7%A1%D7%95%D7%A7%D7%94%20%D7%94%D7%97%D7%93%D7%A9/%D7%93%D7%95%D7%97%D7%95%D7%AA/%D7%93%D7%95%D7%97%20%D7%9E%D7%91%D7%A7%D7%A8%20%D7%94%D7%9E%D7%93%D7%99%D7%A0%D7%94.pdf&parent=/sites/syntaxOcrTest/DocLib1)).",
    "contexts": [
      "שברשותו.\nמספר ת״ז\n854123734\n941330730\nנדאא גסאן\nחאמד בני\n.1\nשמסה\nשם\nמס״ד\nמחמוד מוחמד\n.1\nבשארה אבו שיח\nנדאל מחמוד\nסאלם סלימאן .2\nעמוד 2 מתוך 2\nבלמ״ס\nסימוכין: EVEN465-01-2224",
      "המוחלט של המקרים\", וכי תיקון הצו לעבירות מנהליות יאפשר \"למפקד הצבאי להגדיר עבירות מסוימות (בתוספת לצו) כעבירות הניתנות לאכיפה בדרך מנהלית, כתחליף להליך הפלילי. הצו מסמיך מפקחים להטיל עיצומים כספיים\". עוד נכתב כי במהלך דיון שהתקיים במנהא״ז בפברואר 2016 מופו הנושאים שלגביהם נקבע כי \"ראוי להטיל עיצומים כספיים\", ובהם תחום התעסוקה. במאי 2018 פנה יועמ״ש איו״ש למנהא״ז על מנת לקדם את הדיון בנושא תיקון הצו בדבר עבירות מינהליות וכתב כי \"כידוע מזה זמן רב מקודמת במחלקתנו עמ״ט [עבודת מטה] ליצירתם של כלי אכיפה מנהליים, במטרה לשפר ולייעל את הליכי האכיפה באיו״ש ... בפועל לא נעשה בו [בצו בדבר עבירות מנהליות] שימוש\", וכי \"החייאתו של הצו תדרוש מספר תיקוני חקיקה, ובפרט, תדרוש את עדכון התוספת לצו, הקובעת את העבירות המנהליות\". יצוין כי יועמ״ש איו״ש כתב כי תיקון הצו בנושא אכיפת עבירות מינהליות, אשר משרד הביטחון הגדירו כנושא לטיפול",
      "4. לידיעתכן.\nבברכה,\nסגן\nיואב\nלשכת ראש המנהל האזרחי\nמוקד פניות הציבור מנהל אזרחי איו״ש - טל: 074-7642929 / 4943* פקס: 02-6599133, דוא\"ל: mnz@mgar.co.il\nEVEN465-01-2224\nבלמ״ס\nבק״כ\nהתייחסות\nת.ז הכלוא\nלאחר בדיקה במערכותינו עולה כי התושבים רשומים כבני זוג במערכת, על כן הם רשאים לפנות לצל״א בבקשה לקבלת היתר ביקור כלוא.\n405585530\nמספר ת״ז\nשם\nמס״ד\n404238891\nתפר\nהתייחסות\nלאחר בדיקה אל מול הגורמים הרלוונטיים, עולה כי מדובר בתושב כפר גמאל, אשר אדמתו נמצאת באדמות התפר של פלאמה. הגישה לאדמות האלו מתקיימת אך ורק דרך שער פלאמה 914, מה שמופיע לתושב על גבי ההיתר. הוספת שער 1037 להיתר לא מאושרת, שכן\nמדובר בשער רחוק מאדמות אלו.\nלאחר בדיקה אל מול הגורמים הרלוונטיים, עולה כי התושב מוזמן לחלון קבלת הקהל במת״ק עם כלל המסמכים הרלוונטיים\nשברשותו.\nמספר ת״ז\n854123734\n941330730\nנדאא גסאן\nחאמד בני\n.1\nשמסה\nשם\nמס״ד\nמחמוד מוחמד\n.1\nבשארה אבו שיח\nנדאל מחמוד\nסאלם סלימאן .2",
      "של הצו תדרוש מספר תיקוני חקיקה, ובפרט, תדרוש את עדכון התוספת לצו, הקובעת את העבירות המנהליות\". יצוין כי יועמ״ש איו״ש כתב כי תיקון הצו בנושא אכיפת עבירות מינהליות, אשר משרד הביטחון הגדירו כנושא לטיפול שנמצא בסדר עדיפות גבוה (א׳), נכלל בתוכנית העבודה של לשכת יועמ״ש איו״ש לשנת 2018, ובמועד סיום הביקורת טרם תוקן. בפברואר 2019 מסר קמ״ט תעסוקה לצוות הביקורת כי אין לו כלים אפקטיביים לאכיפת הדין על מעסיקים שמבצעים שימוש חריג בהיתרי העסקה באיו״ש, שכן באיו״ש - שלא כמו בישראל - אין מנגנון של הטלת קנסות מינהליים על מעסיקים הפועלים שלא כדין. עוד מסר כי אכיפה פלילית היא מסורבלת, ולכן לא נעשה בה שימוש. לדבריו, האכיפה שהוא מבצע מסתכמת בשלילת אישורים נקודתיים ממעסיקים שהפרו את תנאי ההיתר.",
      "לישראל\nהגנה\nאזרחי\nאיו״ש\nבלמ״ס\nצבא\nמנהל\nהציבור\nפניות\nמענה למוקד להגנת הפרט\nתיק:\nסימוכין:\nאדר\nEVEN465-01-2224\nתשפ״א\n2021\nי״א\nפברואר\n23\nלכבוד, אורלי ברמק - \"המוקד\" באמצעות דוא״ל: o.barmak@hamoked.org.il\nעירית עשת - \"המוקד\" באמצעות דוא״ל: i.eshet@hamoked.org.il קרן שביט - \"המוקד\" באמצעות דוא״ל: k.shavit@hamoked.org.il\nהנדון: \"התייחסות מנהא״ז איו״ש לפניות המוקד להגנת הפרט 23.02.2021\"\nאורלי ועירית שלום רב,\n1. פניותיכן נבדקו במערכת הממוחשבת שבידנו ו/או עם הגורמים הרלוונטיים במנהל\nהאזרחי. 2. מצ״ב טבלה אשר מרכזת את התייחסות המנהל האזרחי לכל אחת מהפניות. 3. ככל שישנן פניות פתוחות נוספות אבקשכן לעדכני בהקדם.\n4. לידיעתכן.\nבברכה,\nסגן\nיואב\nלשכת ראש המנהל האזרחי\nמוקד פניות הציבור מנהל אזרחי איו״ש - טל: 074-7642929 / 4943* פקס: 02-6599133, דוא\"ל: mnz@mgar.co.il\nEVEN465-01-2224\nבלמ״ס\nבק״כ\nהתייחסות\nת.ז הכלוא",
      "צה״ל מסר בתגובתו כי מקובלת עליו ההמלצה שדוחות הנוכחות של קמ״טים יאושרו על ידי הגורם שמנהל את עבודתם.\nהערכה ומשוב משמשים כלי ניהולי בידי המנהל המסייע לו בקבלת החלטות באשר לפיתוח המקצועי ולהכוונה של העובדים, בתיאום ציפיות הדדי בין מנהל למוערך ובהנחיית המוערך על הדרך שבה הוא יכול למצות את הפוטנציאל הגלום בו באופן המיטבי ולהשתפר. המלצות הצוות שהקימה נש״ם היו כי את ההערכה של הקמ״ט יבצע המנהל הישיר באמצעות רמ״א או סגנו, ואת הערכת המנהל העקיף יבצע הגורם הרלוונטי במשרד הממשלתי.",
      "הטיפול בבקשה.\n4) תנאים להעסקת עובדים למעסיק פרטי (לא קבלן או חברה): א) עובדי משק בית - עד שני עובדים לצורך ניהול משק ביתו (גינון, ניקיון וכו׳), ללא הגבלת תקופה (חידוש מדי 6 חודשים).\nב) בניית בית פרטי - מכסה של 10 עובדים למשך 36 חודשים (חידוש מדי 3 חודשים). ג) שיפוצים - מכסה של 6 עובדים, למשך 4 חודשים בלבד. ד) חריגה מכללים אלו תאושר ע״י קמ״ט תעסוקה/רע״ן אג״מ/ רע״ן אזרחי. 5) תנאים להעסקת עובדים למעסיק שהוא קבלן או חברה:\nא) מפעל/עסק בפעילות שוטפת (חנות/משתלה/נגריה/מסגריה וכיו״ב) - בהתאם לבקשת המפעל מגובה במסמכים נדרשים (הזמנה גדולה/חוזה חדש/קו ייצור נוסף וכיו״ב) ואישור מנהלת אזור התעשייה, עפ״י שיקול דעת עובד יחידת קמ״ט התעסוקה.",
      "יוצא אפוא כי כל עוד לא תוקן הצו בדבר עבירות מינהליות, והצו בדבר העסקת עובדים באיו״ש אינו מוסף לתוספת לצו בדבר עבירות מינהליות, אין בידי המנהא״ז אמצעי לביצוע אכיפה מינהלית נגד מעסיקים ישראלים שאינם מקיימים את הוראת הצו בדבר העסקת עובדים באיו״ש.\nמשרד מבקר המדינה מעיר למנהא״ז כי אי-תיקון הצו בדבר עבירות מינהליות האמור לאפשר אכיפה מינהלית במשך פרק זמן ארוך, ובפרט לאחר שבשנת 2018 קבע משרד הביטחון כי יש לתת עדיפות גבוהה לטיפול בנושא, יש בו משום פגיעה בהתנהלות התקינה וביכולת האכיפה. על מנהא״ז, בשיתוף יועמ״ש איו״ש, לפעול בהקדם לתיקון צו זה ולקדם את הוספת הוראות הצו בדבר העסקת עובדים באיו״ש לתוספת לצו, באופן שיאפשר להטיל קנסות מינהליים גם על מי שהפרו צו זה. כמו כן, על מנהא״ז לבחון דרכים להפעיל כלי אכיפה פליליים אם תוגש תלונה.\n246\nפרק ראשון | אזור יהודה ושומרון\n| קציני מטה במינהל האזרחי באזור יהודה ושומרון",
      "בלמ״ס הפקודה מכילה 2 דפים\n7\n8\nמתאם פעולות הממשלה בשטחים המנהל האזרחי\nנספח ג׳\nבמקומות\nצו בדבר העסקת עובדים\nמסויימים (יהודה והשומרון) (מס׳ 967), תשמ״ב-1982\nבתוקף סמכותי כמפקד כוחות צה״ל באיזור והואיל והנני סבור כי הדבר דרוש להגנת זכויותיהם של העובדים באזור הנני מצווה לאמור: בצו זה - .1 הגדרות\n\"הממונה\" - מי שימונה על ידי כממונה לצורך צו זה; \"חוק העבודה\" - חוק העבודה הירדני, חוק מס׳ 2 לשנת 1965; \"ישוב\" - כל אחד מן הישובים במפורטים בתוספת לצו בדבר ניהול מועצות אזוריות (יהודה תיקון מס' 1 (צו 1141)\nוהשומרון) (מס׳ 783), תשל״ט-1979 ובתוספת לצו בדבר ניהול מועצות מקומיות (יהודה\nוהשומרון) (מס׳ 892), התשמ״א-1981, כפי תוקפן מעת לעת;\nתשמ״ה-1985\n\"ישראלי\" - תושב ישראל, מי שמקום מגוריו באזור והוא אזרח ישראלי או שהוא זכאי\nתושב האזור ובידו אשרת כניסה בתוקף לישראל.\nתיקון מס׳ 3 (צו",
      "ממכלול הדברים עולה כי לגורמים השונים האמונים על האכיפה של העסקת פלסטינים באיו״ש אין כלי אכיפה מתאימים לבצע אכיפה. לפיכך על המנהא״ז בשיתוף משרד העבודה לפעול למימוש אחריותם בנושא זה ולבחון\n247\nמבקר המדינה | דוח ביקורת שנתי 70ג | התש״ף-2020\nאת הדרכים המיטביות להגברת האכיפה, בין היתר על ידי קיום דיון ייעודי שיעסוק בדרכים להגברת האכיפה.\nבספטמבר 2019 מסר משרד העבודה בתגובתו על ממצאי הביקורת כי הוא מקבל את ממצאי הביקורת בנושא, וכי הוא \"ייזום דיון בנושא האמור מול הגורמים הרלוונטיים במינהל האזרחי\".\n2. בקרה שמבצע קמ״ט תעסוקה על המעסיקים"
    ]
  },
  {
    "question": "אם בישראל סמכות מוקנת לשר, למי צריך להקנות אותה באיו\"ש?",
    "reference_answer": "ככלל יש להסמיך את מנכ\"ל המשרד",
    "rag_answer": "בישראל, סמכויות רבות מוקנות לשרים מכוח חוקים שונים. באיו\"ש, הסמכויות המקבילות מוקנות למפקד האזור מכוח תחיקת הביטחון. לדוגמה, סמכות למתן היתרים לתושבי האזור נתונה למפקד האזור, כפי שנקבע בפסיקת בית המשפט העליון: \"שר הפנים שואב את סמכותו למתן היתרים מכח חוק הכניסה לישראל, ומפקד האיזור מוסמך לתת היתרים לתושבי האזור מכח תחיקת הבטחון\"  \n[תגובה מקדמית (2)](https://tikshuv.sharepoint.com/sites/syntaxOcrTest/DocLib1/Forms/AllItems.aspx?id=/sites/syntaxOcrTest/DocLib1/%D7%A2%D7%A0%D7%A3%20%D7%91%D7%99%D7%98%D7%97%D7%95%D7%9F/%D7%9E%D7%93%D7%95%D7%A8%20%D7%90%D7%95%D7%9B%D7%9C%D7%95%D7%A1%D7%99%D7%9F/%D7%90.%20%D7%9B%D7%A0%D7%99%D7%A1%D7%94%20%D7%9C%D7%99%D7%A9%D7%A8%D7%90%D7%9C/%D7%92.2.%20%D7%94%D7%9C%D7%99%D7%9B%D7%99%D7%9D%20%D7%9E%D7%A9%D7%A4%D7%98%D7%99%D7%99%D7%9D%20%D7%95%D7%A4%D7%A0%D7%99%D7%95%D7%AA%20-%20%D7%9E%D7%A0%D7%99%D7%A2%D7%95%D7%AA%20%D7%9B%D7%A0%D7%99%D7%A1%D7%94%20%D7%9C%D7%99%D7%A9%D7%A8%D7%90%D7%9C/%D7%90.%20%D7%9E%D7%A0%D7%99%D7%A2%D7%95%D7%AA%20%D7%91%D7%98%D7%97%D7%95%D7%A0%D7%99%D7%95%D7%AA/%D7%94%D7%9C%D7%99%D7%9B%D7%99%D7%9D%20%D7%9E%D7%A9%D7%A4%D7%98%D7%99%D7%99%D7%9D/2022/15412-08-22%20%D7%A2%D7%95%D7%9E%D7%A8%20%D7%9E%D7%A8%D7%95%D7%90%D7%9F/%D7%AA%D7%92%D7%95%D7%91%D7%94%20%D7%9E%D7%A7%D7%93%D7%9E%D7%99%D7%AA%20%282%29.pdf&parent=/sites/syntaxOcrTest/DocLib1).",
    "contexts": [
      "מובן, כי אם לבקשה להתאזרחות בן זוג של אזרח ישראלי ניתן לסרב בשל עבר פלילי העלול לסכן את שלום הציבור, קל וחומר שכך הוא בבקשה למתן היתר כניסה לישראל לתושב האזור, שאין לו כל זכות קנויה לקבלו והוא עניין המצוי בשיקול דעת רחב של מפקד האזור. \nכבר נקבע העיקרון לפיו הטלת מניעה פלילית היא בגדר הגנה לגיטימית על שלום הציבור בישראל ובטחונו וכי אין לתושבי האזור זכות קנויה להיכנס לשטחי מדינת ישראל לצורך המסחר (עת\"מ 27598-09-14 נמר זהיר נ' מפקד כוחות צה\"ל – יהודה ושומרון מיום 4.3.15. אושר בבית המשפט העליון עע\"מ 2266/15 נמר זוהיר נ' מפקד כוחות צה\"ל יהודה ושומרון).\nבענייננו, כאמור, קיימת מניעה משטרתית ביחס לעותרים, המבוססים על מידע מודיעני הקושר את העותרים לפלילים.",
      "4. פרטי החומר הביטחוני החסוי יובאו בפני בית המשפט הנכבד, ככל שיימצא לנכון ובהסכמת העותר, בדלתיים סגורות ובמעמד צד אחד, שכן המדובר במידע מודיעיני מסווג, אשר חשיפת פרטיו או מקורותיו עלולה לפגוע בביטחון המדינה ובשלום הציבור. 5. בקשת העותר מיום 3.7.2022 להסרת המניעה הביטחונית המוזנת בענייננו הועברה לאבחון גורמי הביטחון הרלוונטיים. 6. מענה בבקשה נמסר ביום 4.7.2022, לפיו בקשה קודמת של העותר סורבה ביום 26.4.2022 ולכן באפשרותו להגיש בקשה רק בחלוף שנה מיום סירוב הבקשה, היינו ביום 26.4.2023. זאת בהתאם לסעיף ב׳ לנוהל הסרת מניעה ביטחונית לישראל (הנוהל העדכני לחודש יולי 2019) (להלן - \"הנוהל\"), הקובע כי תוקף סירוב לבקשה להסרת מניעה ביטחונית לכניסה לישראל הוא שנה.\nהעתק הודעת הסירוב, מצ״ב ומסומן א׳.\n7. ביום 10.8.2022 התקבלה העתירה דנן.\nדחיית העתירה על הסף מחמת העדר עילה\nהמסגרת המשפטית לכניסת פלסטינים לישראל",
      "32. בהקשר זה יצוין, כי המשיבים פועלים במידתיות כאמור לעיל תוך איזון השיקולים והנסיבות של כל מקרה ומקרה. יובהר, כי בקשתו של העותר סורבה בשל מניעה ביטחונית אשר מצדיקה את סירוב הסרת המניעה, כאמור, וזאת על סמך עמדה מקצועית של הגורמים הרלבנטיים, ועל כן ברי כי מדובר בשיקולים רלבנטיים.\n5",
      "לאור כל האמור לעיל, המשיבים יטענו כי יש לחייב את העותרים בגין הוצאות המשיבים ושכר\nטרחת פרקליטי המדינה.\nDe\nב/\nמינו אליאסיאן - פלא, עו״ד פרקליטות מחוז ירושלים (אזרחי)\nתאריך החתימה על המסמך: 30 נובמבר 2023",
      "עמדת המשיבים\n29. כאמור לעיל, המשיבים יטענו, כי דין העתירה להידחות מחמת העדר עילה להתערבותו של בית המשפט הנכבד בהחלטה למנוע את כניסתו של תושב האזור לישראל לצרכי תעסוקה.\n30. לחלופין, מבלי לגרוע מהאמור, דין העתירה להידחות לגופה, שכן על פי מידע ביטחוני חסוי המצוי בידי גורמי הביטחון, קיימת מניעה ביטחונית לכניסת העותר לישראל. כאמור, עמדתם העדכנית של גורמי הביטחון היא כי הם מתנגדים להסיר את המניעה הבטחונית, בשל קשריו של העותר לאמצעי לחימה. בנוסף, עולה כי העותר היה כלוא בעבר בישראל על רקע פלילי. 31. ויודגש, כי מעבר למידע הגלוי המפורט לעיל, בידי המשיבים מידע חסוי, שיובא בפני בית המשפט הנכבד, ככל שימצא לנכון ובהסכמת העותר, במעמד צד אחד, שכן המדובר במידע מודיעיני מסווג שהינו חומר רגיש ואשר חשיפת פרטיו ו/או מקורותיו עלולה לפגוע בביטחון המדינה ובשלום הציבור.",
      "7. הרי ממה נפשך? האם יכול בית משפט ישראלי, במדינה יהודית, להעלים עין ממצב בו מדריך תיירים נוצרי מבית לחם למשל - אשר ליווה קבוצת צליינים במשך מספר ימים ולילות בכל אזור יהודה ושומרון ובעיקר במקומות הקודשים לנצרות - ונפשו נקשרה בנפשם של התיירים - והם בנפשו - וכאשר מטבע הדברים הם עברו יחדיו חוויות דתיות מטלטלות - נדרש ע״י חיילים ישראלים לרדת מהאוטובוס במחסום צה״לי - ולפנות את מקומו למדריך ישראלי - במרבית המקרים יהודי \" להמשך הסיור המודרך בישראל ??\n~ 3 -",
      "בקליפתה, מבלי להותיר שריד מתוכנה' (מנחם הופנונג ישראל - בטחון המדינה מול שלטון החוק 105 (1991)). הן חורגות מן 'התפישה העקרונית של שיטת המשפט בישראל שיש לקיים את מצוות החוקה גם אל מול איום הטרור׳ (חברי, המשנה לנשיאה, בבש״פ 8823/07 פלוני הנ״ל). המשך קיומו של חוק האזרחות והכניסה לישראל [ ... ] מטיל צל כבד על סיכוייה של הדמוקרטיה בישראל לעמוד באתגרים להם יכלה עד כה. טועה מי שסבור, כי לאורך זמן יוכל אף הרוב, שמכוח הכרעותיו בא חוק זה אל העולם, לעמוד בפני פגיעתו הרעה. חוששני, כי זו תאיים להשיג כל ישראלי באשר הוא, הואיל וטמון בה הכוח לערער את המסד עליו ניצבים כולנו שכם-אל-שכם. בסופו של יום פגיעה זו, רחוקה וזוחלת ככל שתהיה, ממלכתית ככל שהיא נחזית, אין נזקה פחות מזה הטמון במעשי הטרור מפניהם מבקשים אנו להתגונן. בלשון חברתי, השופטת א׳ חיות: 'עלינו לתת את הדעת למחיר שנשלם כחברה בטווח הארוך אם חוק האזרחות על איסוריו הגורפים ימשיך למצוא את מקומו",
      "עת״מ 15412-08-22 קבוע לדיון ביום 21.9.22 בשעה 11:30\nבבית המשפט המחוזי בירושלים בשבתו כבית משפט לעניינים מנהליים בפני כבוד השופט משה סובל, סגן נשיא\nהמועד האחרון להגשה: כ״ג אלול, התשפ״ב; 19 ספטמבר 2022 מועד חתימת המסמך: כ״ג אלול, התשפ״ב; 19 ספטמבר 2022\nעומר מרואן מוחמד חמדאן, מ״ז 905645511\nהעותר:\nבעניין:\nבאמצעות ב״כ עו״ד עלי ג׳בארין, מ.ר. 51037 ת.ד. 6299, אום אל פחם 30010 דוא״ל: Aligabareen16@gmail.com טל׳: 050-9630255; פקס: 04-9998538\n- נגד-\n1. מפקד כוחות צה״ל בגדה המערבית\nהמשיבים:\n2. שירות הביטחון הכללי\n3. מתאם פעולות הממשלה בשטחים\nכולם ע״י ב״כ מפרקליטות מחוז ירושלים (אזרחי) רח׳ מח״ל 7, מעלות דפנה, ת.ד. 49333, ירושלים 91493 טל׳: 073-3928000; פקס׳: 02-6468053 דוא״ל: ez-jer@justice.gov.il\nתגובה מקדמית",
      "הסעיף, המתלה את הרישום בתשלום שווי הקרקע. הפרשנים מסבירים כי ההבדל נעוץ בשוני בין מחזיק שיש בפיו טענת זכות ביחס לקרקע והוא מחזיק בה ביושר (ויש הסוברים כי עליו אף להוכיח את זכותו, כך להלן), לבין מחזיק שהסיג את גבולה של המדינה בקרקע, ולפיכך אין לרשום אותה על שמו מבלי שישלם את שוויה (עניין סאלח, בעמ׳ 388; ע״א 298/61 מדינת ישראל נ׳ נמר עלי חסין פ״ד טו 1923 (1961) (להלן: עניין נמר עלי חסין)). כך או כך אין הסעיף חל כלל, סיפה ורישה כאחד, כאשר מדובר במחזיק שלא ביושר - מחזיק שגזל את הקרקע מאדם אחר (דוכן, בעמ' 316).",
      "כאמור:\n\"שר הפנים שואב את סמכותו למתן היתרים מכח חוק הכניסה לישראל, ומפקד האיזור מוסמך לתת היתרים לתושבי האזור מכח תחיקת הבטחון.\"\n19. וכן, בית המשפט העליון פסק כי:1\n\"ההחלטה אם להתיר כניסתם לישראל, לצורכי עבודה או לצורך אחר כלשהו, נתונה לשיקול דעתו של המשיב. שיקול-דעת זה מפעיל המשיב על-פי קריטריונים קבועים. אך מתן היתר כפוף, לעולם, להיעדר טעם ביטחוני המחייב מניעת הכניסה. קיומו של טעם ביטחוני כזה, ביחס למי שהינו תושב האזור שבתחומי הרשות הפלסטינית, נלמד - מכורח הנסיבות - ממידע מודיעיני. בדיקת וקביעת אמינותם של מקורות מודיעיניים נתונות לגורמי שירות הביטחון. וההסברים שניתנו לנו, בתשובה לשאלותינו במסגרת הדיון בדלתיים סגורות, הניחו את דעתנו כי הגורמים המקצועיים עשו את המוטל עליהם בטרם גיבשו את מסקנתם.\""
    ]
  },
  {
    "question": "מתי נכון להחיל דבר חקיקה בתקנון המועצות המקומיות/אזוריות חלף החלה בחקיקה ראשית",
    "reference_answer": "במתן מענה לשאלה, האם דבר חקיקה ישראלי, שנמצא ראוי להחלה באזור, צריך להיות מאומץ במסגרת התקנון או נספחיו או במסגרת \"צו אלוף\" בעל תחולה בכל האזור, יש להתבסס בראש ובראשונה על המגבלות של התקנון ונספחיו. על כן, ככלל התקנון ונספחיו לא יתאימו להסדרת סוגיה, שנתח משמעותי ממנה נועד\nלהסדיר נושאים כלל-אזוריים, ודאי כאלה הנושאים השלכה נפרדת על התושבים\nהפלסטינים של האזור. כחלים אך ורק בתחום המועצות המקומיות והמועצות האזוריות באזור.",
    "rag_answer": "החלת דבר חקיקה בתקנון המועצות המקומיות או האזוריות במקום בחקיקה ראשית יכולה להיות נכונה במקרים בהם יש צורך בהתאמה ספציפית לאזור או לנושא מסוים, או כאשר יש צורך בהסדרת נושאים מקומיים בצורה מהירה ויעילה יותר. לדוגמה, במהלך שנת 2021, מפקד פיקוד המרכז חתם על מספר תיקונים לתקנוני המועצות המקומיות והאזוריות באיו\"ש, אשר החילו הוראות שונות החלות בישראל גם במועצות הישראליות באזור. בין היתר, תיקונים אלו כללו:\n\n1. **החלת סמכויות משמר בתי המשפט באיו\"ש**: תיקון לתקנון המועצות המקומיות שהחיל את סמכויות משמר בתי המשפט בישראל גם בבתי המשפט לעניינים מקומיים בתחומי ההתיישבות הישראלית באיו\"ש, בנוגע לאבטחת השופטים ועובדי בתי המשפט ([סיכום שנת העבודה 2021 - מדור חקיקה ומוניציפאלי.pdf](https://tikshuv.sharepoint.com/sites/syntaxOcrTest/DocLib1/Forms/AllItems.aspx?id=/sites/syntaxOcrTest/DocLib1/%D7%97%D7%95%D7%9E%D7%A8%D7%99%20%D7%91%D7%93%D7%99%D7%A7%D7%94%20%D7%9CRAG/%D7%A7%D7%9C%D7%A1%D7%A8%20%D7%97%D7%A4%D7%99%D7%A4%D7%94%20%D7%9C%D7%A4%D7%A6%D7%A8%20%D7%94%D7%A0%D7%9B%D7%A0%D7%A1%20%282021%29/%D7%A1%D7%99%D7%9B%D7%95%D7%9E%D7%99%20%D7%A9%D7%A0%D7%94%202021/%D7%A1%D7%99%D7%9B%D7%95%D7%9D%20%D7%A9%D7%A0%D7%AA%20%D7%94%D7%A2%D7%91%D7%95%D7%93%D7%94%202021%20-%20%D7%9E%D7%93%D7%95%D7%A8%20%D7%97%D7%A7%D7%99%D7%A7%D7%94%20%D7%95%D7%9E%D7%95%D7%A0%D7%99%D7%A6%D7%99%D7%A4%D7%90%D7%9C%D7%99.pdf&parent=/sites/syntaxOcrTest/DocLib1)).\n\n2. **החלת הוראות תקנות העיריות (מכרזים לקבלת עובדים)**: תיקון לתקנוני המועצות המקומיות והאזוריות שהחיל את הוראות תקנות העיריות (מכרזים לקבלת עובדים) במועצות הישראליות באזור, הנוגעות לדרכי קליטת עובדים ברשויות המקומיות והבניית הליכי המכרזים להעסקת עובדים ברשויות אלו ([סיכום שנת העבודה 2021 - מדור חקיקה ומוניציפאלי.pdf](https://tikshuv.sharepoint.com/sites/syntaxOcrTest/DocLib1/Forms/AllItems.aspx?id=/sites/syntaxOcrTest/DocLib1/%D7%97%D7%95%D7%9E%D7%A8%D7%99%20%D7%91%D7%93%D7%99%D7%A7%D7%94%20%D7%9CRAG/%D7%A7%D7%9C%D7%A1%D7%A8%20%D7%97%D7%A4%D7%99%D7%A4%D7%94%20%D7%9C%D7%A4%D7%A6%D7%A8%20%D7%94%D7%A0%D7%9B%D7%A0%D7%A1%20%282021%29/%D7%A1%D7%99%D7%9B%D7%95%D7%9E%D7%99%20%D7%A9%D7%A0%D7%94%202021/%D7%A1%D7%99%D7%9B%D7%95%D7%9D%20%D7%A9%D7%A0%D7%AA%20%D7%94%D7%A2%D7%91%D7%95%D7%93%D7%94%202021%20-%20%D7%9E%D7%93%D7%95%D7%A8%20%D7%97%D7%A7%D7%99%D7%A7%D7%94%20%D7%95%D7%9E%D7%95%D7%A0%D7%99%D7%A6%D7%99%D7%A4%D7%90%D7%9C%D7%99.pdf&parent=/sites/syntaxOcrTest/DocLib1)).\n\n3. **הסדרת חלוקת ההכנסות בין רשויות מקומיות ישראליות באיו\"ש**: תיקון לתקנוני המועצות המקומיות והאזוריות שהסדיר את אופן חלוקת ההכנסות בין המועצות הישראליות באזור ([סיכום שנת העבודה 2021 - מדור חקיקה ומוניציפאלי.pdf](https://tikshuv.sharepoint.com/sites/syntaxOcrTest/DocLib1/Forms/AllItems.aspx?id=/sites/syntaxOcrTest/DocLib1/%D7%97%D7%95%D7%9E%D7%A8%D7%99%20%D7%91%D7%93%D7%99%D7%A7%D7%94%20%D7%9CRAG/%D7%A7%D7%9C%D7%A1%D7%A8%20%D7%97%D7%A4%D7%99%D7%A4%D7%94%20%D7%9C%D7%A4%D7%A6%D7%A8%20%D7%94%D7%A0%D7%9B%D7%A0%D7%A1%20%282021%29/%D7%A1%D7%99%D7%9B%D7%95%D7%9E%D7%99%20%D7%A9%D7%A0%D7%94%202021/%D7%A1%D7%99%D7%9B%D7%95%D7%9D%20%D7%A9%D7%A0%D7%AA%20%D7%94%D7%A2%D7%91%D7%95%D7%93%D7%94%202021%20-%20%D7%9E%D7%93%D7%95%D7%A8%20%D7%97%D7%A7%D7%99%D7%A7%D7%94%20%D7%95%D7%9E%D7%95%D7%A0%D7%99%D7%A6%D7%99%D7%A4%D7%90%D7%9C%D7%99.pdf&parent=/sites/syntaxOcrTest/DocLib1)).\n\nהחלת דברי חקיקה אלו בתקנון המועצות המקומיות והאזוריות מאפשרת התאמה טובה יותר לצרכים המקומיים והסדרת נושאים בצורה מהירה ויעילה יותר מאשר בחקיקה ראשית.",
    "contexts": [
      "בלמ״ס\n010661-3-22029\nבלמ״ס -7-\n47. ביום 22 בנובמבר 2021 התקיים דיון קדם-משפט ראשון בתיק, והתביעות עתידות להמשיך להתברר בשנת 2022.\nקידום תיקוני חקיקה\n48. במהלך שנת 2021 קידמו קציני המדור תיקוני חקיקה בנושאים מגוונים בתחום התכנון והבנייה, שנועדו לאפשר לגורמי המקצוע לעשות את עבודתם נאמנה, ואף לפתח את הדין החל באזור ולהתאימו לשינויי הזמן והנסיבות. להלן נסקור בקצרה מקצת מהליכי החקיקה המרכזיים שקודמו בתחום התכנון והבנייה.\nא. פיצול תכניות - תיקון חקיקה אשר מקנה למוסדות התכנון באזור סמכות ליתן תוקף לתכנית אשר פוצלה לאחר הפקדה, ואף לאחר מתן החלטה בהתנגדויות שהוגשו נגדה, וזאת בתנאי שמוסד התכנון מצא כי ניתן להורות על הפקדה של כל חלק מן התכנית כשלעצמו.",
      "קידום חקיקה מוניציפאלית\nבמהלך שנת 2021 קידם המדור, בשיתוף עם משרד הממונה על היישובים הישראליים באיו״ש, מספר דברי חקיקה משמעותיים בתחום המוניציפאלי.\n.14\nלהלן יפורטו עיקרי דברי החקיקה: .15\nחתימה על תיקון לתקנון המועצות שמחיל את סמכויות משמר בתי המשפט באיו״ש א. - ביום 4 בפברואר 2021 חתם מפקד פקמ״ז על תקנון המועצות המקומיות (תיקון מס׳ 249) (יהודה ושומרון), התשפ״א-2021, אשר מקנה לאנשי משמר בתי המשפט בישראל סמכויות גם בבתי המשפט לעניינים מקומיים בתחומי ההתיישבות הישראלית באיו״ש, וזאת, בנוגע לאבטחת השופטים ועובדי בתי המשפט. בפועל, התיקון לתקנון מחיל באיו״ש את עיקרי הוראות פרק ג׳1 לחוק בתי המשפט [נוסח משולב], התשמ״ד-1984, המסדירות את הסמכויות והתפקידים הנתונים לאנשי המשמר בישראל.",
      ".7\nלצד עבודת החקיקה, טופלו עשרות רבות של פניות הכרוכות בענייני חקיקה ובהן, בין היתר, בשאלות הנוגעות לתחולת דברי חקיקה באיו״ש; בבקשות לקבלת עמדה לגבי מעמדו של דין מסוים; בשאלות הנוגעות לפרשנות דברי חקיקה או לסמכויות הנובעות מהם; וכן בשאלות הנוגעות לסמכויותיהם של בתי המשפט לעניינים מקומיים והמועצות הישראליות באזור.\n.8\nהנגשת תחיקת הביטחון לציבור\nבשנה החולפת המשיכה העבודה המקיפה על טיוב מאגר המידע המקיף של כלל תחיקת .9\nהביטחון (האזרחית, הביטחונית והפלילית) ברשת האינטרנט האזרחית.\nבין היתר, השנה המשיך המדור לרכז ולהעלות את קבצי המנשרים והצווים (הקמצ״מים) למרשתת האזרחית, כולל לאתר 'נבו'; המשיך לקדם הנגשת חקיקה בשפה הערבית באתר מתפ״ש; וכן כלל חקיקת הקורונה הועלתה מיד עם חתימתה לדף ייעודי באתר האינטרנט של הפרקליטות הצבאית, לאתר מתפ״ש ולאתר 'נבו'.\n.10",
      "3. בנוסף, טרם דיון ההמשך, העברה לידיעתנו פנייתו של רמ״ט משרד הביטחון לר׳ המל״ל מיום ה-02/08, ולפיה בשל הרקע לדברים (החלטת הקבינט והנחיית המדיניות) ולנוכח עמדת השב״כ והייעוץ המשפטי לממשלה, המל״ל מתבקש לבחון באם יש מקום להביא את הנושא לדיון בקבינט או לעדכן או חברי הקבינט.\nרח׳ צלאח א-דין 29, ת״ד 49029, ירושלים מיקוד 9149001, פקס.\n2\n4. דיון ההמשך נדרש, אם כן, לצורך השלמת הבחינה המשפטית בנוגע למניעת אג״ם-הרתעה כלפי קרובי משפחה של מפגעים במעגל ראשון ושני, ולאור ההכרח להעביר התייחסות מידית לבית המשפט המחוזי בירושלים במספר עתירות בעניין חמולות.\nעיקרי הדיון:",
      "לאמל״ח\", לשיטתם. 4. העותר ביקש לכפור בחשדות ולהביא טענותיו כנגד טענות המשיבים, אך הדיון שאמור היה להתקיים ביום 1.11.23, לא התקיים עקב פרוץ מלחמת \"חרבות ברזל\" ולאור ההודעה על החלת תקנות בתי המשפט ולשכות ההוצאה לפועל (סדרי דין במצב חירום מיוחד) התשנ״א- 1991 (להלן: \"תקנות סדרי דין במצב חירום מיוחד\"). 5. בעת הנוכחית, לאחר ששקל את מכלול הנתונים, העותר מעריך כי לא תצמח לו תועלת מהמשך ניהול ההליך הנוכחי ולכן הוא מבקש למחוק אותו.\n1\nנימוקי הבקשה למחיקת העתירה",
      "ג.\nתיקונים לתקנוני המועצות המקומיות והאזוריות המחילים את הוראות תקנות העיריות (מכרזים לקבלת עובדים) במועצות הישראליות באזור - ביום 13 בספטמבר 2021 חתם מפקד פקמ״ז על תיקונים לתקנוני המועצות המקומיות והאזוריות אשר מחילים בתחומי המועצות המקומיות והאזוריות הישראליות באזור את הוראות תקנות העיריות (מכרזים לקבלת עובדים) (תיקון), התשפ״א-2021 החלות בישראל, והנוגעות לדרכי קליטת עובדים ברשויות המקומיות והבניית הליכי המכרזים להעסקת עובדים ברשויות אלו.\nד.\nחתימה על תיקונים לתקנוני המועצות המסדירים את אופן חלוקת ההכנסות בין רשויות מקומיות ישראליות באיו״ש - ביום 14 באוקטובר 2021 חתם מפקד פקמ״ז על תיקונים לתקנוני המועצות המקומיות והאזוריות באזור, אשר מטרתם להסדיר את אופן חלוקת ההכנסות בין המועצות הישראליות באזור. תיקוני חקיקה אלו הם פרי עבודת מטה שנערכה בשיתוף עם משרד המשפטים ומשרד הפנים, ונועדו\nה.\n010661-3-22183\nבלמ״ס",
      "במהלך הטיפול בהליך, הוברר לרשויות אזור יהודה ושומרון כי החופים השוכנים בצפון ים המלח אינם מוסדרים כדבעי מן הפן הקנייני והפן הרגולטורי, לרבות בהיבטי הפיקוח על החופים וגביית התשלומים בהם.\n.23\nעל רקע זאת, במהלך שנת 2020, הורה ראש המינהל האזרחי על עבודת מטה להסדרת הפעלתם של החופים, ובכלל זה הסדרת הקצאת הזכויות במקרקעין והכנת תקנות שיסדירו את סוגיות גביית התשלומים בחופים והפיקוח על החופים. לאור זאת, במהלך\n.24\nשנה״ע 2021 עסקנו בקידום עבודת המטה האמורה להסדרת חופי ים המלח באיו״ש.\n010661-3-22183\nבלמ״ס\nבלמ״ס 5\n.25",
      ".33\nבהסתכלות קדימה, להערכתנו במהלך שנת העבודה 2022 יגבר באופן משמעותי העיסוק המשפטי בתחומי העיסוק של המדור, ובפרט בתחום החקיקה, בשים לב להתפתחויות השונות בנושאים אזרחיים רבים.\n.34\nבסיום הדברים, נבקש להודות לכלל הגורמים הפועלים עמנו בשיתוף פעולה פורה לצורך קידום שלטון החוק באזור ושיפור רווחת התושבים החיים בו. תחילה, נבקש להודות לרס״ב הייתם סרחאן על עבודתו המצוינת בתחום תרגום החקיקה והנגשתה לציבור. עוד נבקש להודות לעו״ד אבינעם סגל-אלעד ועו״ד אהוד לנדאו ממשרד המשפטים; עו״ד חן בן-אליעזר ממשרד הביטחון ורו״ח תמי נאסה, הממונה על היישובים הישראליים במשרד הפנים, על שיתוף הפעולה הפורה שקיימו בשנה החולפת עם מחלקתנו לשם קידום החקיקה באזור.\n.35\nבברכה,\nיובל שמחיס ומוניציפאלי מדור 'חקיקה\nסרן ראש\n010661-3-22183\nבלמ״ס\nבלמ״ס\n7\nרשימת תפוצה",
      ".29\n30. בנוסף, במהלך השנה ליווה המדור מספר תביעות אזרחיות בהיקף כספי גבוה בתחום התחבורה. ניכר כי ניתן להצביע על מגמה של גידול בהיקף ההליכים האזרחיים, ואנו משערים כי ליווי ההליכים האזרחיים עתיד להעסיק את המדור אף בשנה״ע 2022.\nסיכום\nבמסמך זה הוצגה עיקרי העשייה במדור חקיקה ומוניציפאלי בשנת 2021. כפי שנסקר בהרחבה לעיל, במהלך השנה המשיך המדור לקדם תיקוני חקיקה רבים בנושאים אזרחיים שונים; ללוות הליכים משפטיים בתחומי החקיקה; המוניציפאלי והתחבורה, ולהעניק עשרות רבות של התייחסויות משפטיות בנושאי החקיקה באיו״ש בכלל והחקיקה האזרחית בפרט.\n.31",
      "ו. תיקוני חקיקה לצו בדבר הכרזה על שטח מוגבל, לפיו מפקד פיקוד המרכז רשאי להכריז על שטח כמוגבל לכניסה ויציאה, ולהטיל הגבלות על השהייה במרחב הציבורי ועל הפעלת בתי עסק באותו שטח.\nז. תיקוני חקיקה לצו בדבר הגבלת פעילות בתחום התחבורה, שעניינם קביעת הגבלות והוראות להפעלת שירותי תחבורה ציבוריים באזור, עבור מניעת הדבקה.\nח. תיקוני חקיקה לתקנון המועצות המקומיות, שקבעו הגבלות והוראות להפעלת מוסדות חינוך במועצות הישראליות באזור, כך שיפעלו רק מוסדות חינוך שפעילותם אושרה בתקנות המקבילות בישראל.\nקידום חקיקה אזרחית\nבנוסף על חקיקת הקורונה, השנה קודמו על ידי המדור למעלה מ-70 דברי חקיקה ותיקוני חקיקה בתחומים אזרחיים שונים. אלו קודמו על ידנו, בין השאר, לפי סדר עדיפויות שקבעו ראש המינהל האזרחי ומשרד הביטחון בתחילת שנת העבודה.\n.7"
    ]
  },
  {
    "question": "מתי נכון להפנות בחקיקה באזור לדבר חקיקה ישראלי, במקום להעתיק אותו ידנית לדין באזור?",
    "reference_answer": "עת נבחנת השאלה באיזה אופן יש לבצע את ההחלה, יש להביא בחשבון מספר שיקולים שונים. הראשון, האם הוראות הדין הישראלי שונות באופן מהותי מהוראות הדין אותו מבקשים להחיל באזור. ככל שהוראות הדין הנבחנות להחלה הן שונות יותר, כך נהיה יותר נכונים לעשות העתקה והתאמה של הוראות הדין על פני ביצוע הפניה לדין הישראלי. השיקול השני, הינו האכסניה במסגרתה מבקשים להחיל את הוראות הדין, ככל שהכוונה היא החלה באכסניה ייחודית לאזור – דוגמת צו 418 שהוזכר לעיל, הרי שאין מקום, כי חלק מסוים מהוראות הצו יהיו באמצעות הפניה וחלקו האחר באמצעות התקנת הנורמות במישרין, ובשונה מכך – בנספחי התקנון יוחלו ההוראות באופן של הפניה, שכן באופן זה נערכים נספחים אלו בכללותם. השיקול השלישי הינו זהות הגורם האמון על אכיפת והפעלת הנורמות, ככל שהכוונה היא כי עובדי משרד ממשלתי ישראלי יהיו אלו אשר יפעילו את הוראות החקיקה – הרי שהנטייה תהייה החלה באמצעות הפניה, שכן הדבר יקל עליהם על הפעלת הדין, ככל שהכוונה היא כי רשויות האזור יהיו אלו שיפקחו ויקבלו החלטות על פי הדין, וככל שרשויות אלו פועלות מכוח צווי המפקד הצבאי או דין האזור – הרי שהנטייה תהייה להיפך. שיקול רביעי יכול להיות גם זהות ה'נמענים' להוראות הדין, ככל שהכוונה היא החלה רק בתחומי ההתיישבות הישראלית או לחלופין, שיחול פרסונאלית על המתיישבים הישראלים, הרי שנטיית הלב תהייה דרך חקיקה באמצעות הפניה ולא באמצעות העתקת נורמות. שיקול אחרון שיש לשקול הינו, הרי שההחלה 25 כי אם מקימים מוסד חדש שיפעל באזור ולא מסמיכים מוסד ישראלי, תיעשה דרך התקנת נורמות ולא באמצעות הפניה דווקא",
    "rag_answer": "הפניה לדבר חקיקה ישראלי במקום להעתיק אותו ידנית לדין באזור יהודה ושומרון יכולה להיות נכונה במקרים בהם יש צורך לשמור על אחידות משפטית, להקל על הבנת החוק ולמנוע טעויות או אי-דיוקים בהעתקה. כמו כן, הפניה כזו יכולה להיות יעילה כאשר מדובר בחקיקה מורכבת או מתעדכנת תדיר, כך שהפניה לחוק המקורי מבטיחה שהחוק המיושם יהיה תמיד בגרסתו העדכנית ביותר.\n\nבמקרה של אזור יהודה ושומרון, סמכויות החקיקה נתונות למפקד הצבאי בהתאם לדיני התפיסה הלוחמתית של המשפט הבין-לאומי, ולכן יש חשיבות לשמירה על איזון בין זכויות הפרט לבין צרכי הביטחון. הפניה לחקיקה ישראלית יכולה לסייע בהשגת איזון זה על ידי שימוש בחקיקה מוכרת ומבוססת.\n\nלדוגמה, כפי שנאמר בתגובה של המדינה בבג\"ץ 2189/20:\n\"סמכויות החקיקה באזור יהודה ושומרון נתונות למפקד הצבאי בהתאם למערכת משפטית נורמטיבית ייחודית - דיני התפיסה הלוחמתית של המשפט הבין-לאומי. נזכיר, כי פעילות צה״ל באזור, בפרט בהיבטים הנוגעים ללחימה בטרור, מאופיינת בצרכים ביטחוניים ייחודיים. באמור יש כדי להשליך באופן ישיר על נקודת האיזון בין זכויות הפרט לבין צרכי הביטחון, כפי שמתבטאת בחקיקה המחייבת ובאופן הפעלת הסמכויות בהיבטים מושא עתירה זו.\"  \n[בג\"ץ 2189/20](https://tikshuv.sharepoint.com/sites/syntaxOcrTest/DocLib1/Forms/AllItems.aspx?id=/sites/syntaxOcrTest/DocLib1/%D7%97%D7%95%D7%9E%D7%A8%D7%99%20%D7%91%D7%93%D7%99%D7%A7%D7%94%20%D7%CRAG/%D7%A7%D7%9C%D7%A1%D7%A8%20%D7%97%D7%A4%D7%99%D7%A4%D7%94%20%D7%9C%D7%A4%D7%A6%D7%A8%20%D7%94%D7%A0%D7%9B%D7%A0%D7%A1%20%282021%29/%D7%A4%D7%A2%D7%99%D7%9C%D7%95%D7%AA%20%D7%9E%D7%91%D7%A6%D7%A2%D7%99%D7%AA%20%D7%91%D7%A9%D7%92%D7%A8%D7%94/%D7%91%D7%92%D7%A5%202189-20%20%D7%AA%D7%92%D7%95%D7%91%D7%AA%20%D7%94%D7%9E%D7%93%D7%99%D7%A0%D7%94.pdf&parent=/sites/syntaxOcrTest/DocLib1)",
    "contexts": [
      "עת״מ 11177-05-23\nבבית המשפט המחוזי בירושלים\nבשבתו כבית-משפט לעניינים מנהליים\nבעניין:\nצאלח אלמחסתב ת.ז 859539058, תושב חברון\nע״י ב״כ עוה״ד עתאמנה נביל (מ״ר 39663)\nת.ד 795 באקה אלגרבייה\nטלפון 0747027741 פקס 0747037741 נייד 0544638117 דואר אלקטרוני nabil.adv@gmail.com\nהעותר\nנגד\nשר הביטחון .1 מפקד כוחות צה״ל בגדה המערבית .2 שרות הביטחון הכללי .3 המנהל האזרחי לאזור יהודה ושומרון .4\nהמשיבים כולם באמצעות פרקליטות מחוז ירושלים (אזרחי)\nבקשה למחיקת העתירה\nפסק דין (להלן: מוגשת בזאת אל בית י״ז סיוון תשפ״ג, 06/06/2023 תי בקשה 4 בתיק 11177-05-23 1. העותר חוזר שו׳ נמרוד פלקסש מבית המשפט הנכבד להורות\nעל מחיקתה.\nהעתירה נמחקת ללא צו להוצאות. החזר 2. לאור האמור מגבה בהתאם לתקנות. הדיון מבוטל חיקת העתירה ללא חיוב\nבהוצאות.\n*** נחתם דיגיטאלית ***\nבכבודרב\nעתאמנה נביל, עו״ד",
      "הצריכים לעניין - ואין זה המקום להרחיב בעניין זה. מכל מקום, בהתאם למבחנים הרלוונטיים, אזרחים ישראלים שעברו עבירה באזור עומדים לדין ככלל בבתי המשפט בישראל בהתאם לדין הישראלי, ובמקביל, ככלל, תושבים פלסטינים אשר בעניינם קמה סמכות שיפוט גם לבית המשפט בישראל עומדים לדין בבתי המשפט הצבאיים באיו״ש בהתאם לדין ולתחיקת הביטחון החלים באזור, ראו והשוו מבין רבים: עניין אגבאריה, לעיל.",
      ".2\n.3\nהמשיב יטען כי נוכח הסכמתו להתיר את כניסתו של העותר לישראל, ולו בתנאים, התייתרה העתירה ודינה עתה להימחק על הסף. מכל מקום, סבור המשיב כי עמדתו זו הינה סבירה ועניינית, ואין עילה להתערב בה.\n2\nכללי:\nכידוע, היתר יציאה מן האזורים שבשליטת הרשות הפלסטינית לישראל נדרש מפאת כך שרצועת עזה ואזור יו״ש הוכרזו כ\"שטח סגור\" בצווים בדבר סגירת האזור.\n.4\nלפיכך, תושבי האזורים חייבים בקבלת היתרי יציאה מהאזורים, הניתנים מאת מפקדי כוחות צה״ל באזור.\n.5",
      "בית המשפט המחוזי בירושלים בשבתו כבית-משפט לעניינים מנהליים בפני כב׳ סגן הנשיא משה סובל\n12 ספטמבר 2021\nעת״מ 46659-06-21 עאצי נ׳ מפקד כוחות צה״ל ביהודה ושומרון ואח׳\nהעותר\nנגד סאלם דאר עאצי\nהמשיבים\n1. מפקד כוחות צה״ל ביהודה ושומרון\n2. ראש המינהל האזרחי\n3. ראש שירות הביטחון הכללי 4. היועץ המשפטי ליהודה ושומרון\nנוכחים\nב״כ העותר - עו״ד חיה אבו חצירה ב״כ המשיבים - עו״ד אופיר גבעתי נציגי גורמי שירות הביטחון הכללי - המכונה \"ברק\"; ועו״ד אבי\nפרוטוקול\nהוא זומן פעמיים.\nהחדשה.\n1\n13.9.2021\n1\nבית המשפט המחוזי בירושלים בשבתו כבית-משפט לעניינים מנהליים בפני כב׳ סגן הנשיא משה סובל\n12 ספטמבר 2021\nעת״מ 46659-06-21 עאצי נ׳ מפקד כוחות צה״ל ביהודה ושומרון ואח׳\n1\n2\nב״כ המשיבים: משאיר לשיקול דעת בית המשפט.\n3\n4\n5\n6\nפסק דין\n7\n8\nהעתירה נמחקת כמבוקש.\n9\n10\nאין צו להוצאות.\n11\n12\nהאגרה תוחזר לעותר באמצעות בא כוחו בהתאם לתקנות.\n13",
      "כידוע, וכפי שיוסבר להלן בהרחבה, סמכויות החקיקה באזור יהודה ושומרון נתונות למפקד הצבאי בהתאם למערכת משפטית נורמטיבית ייחודית - דיני התפיסה הלוחמתית של המשפט הבין-לאומי. נזכיר, כי פעילות צה״ל באזור, בפרט בהיבטים הנוגעים ללחימה בטרור, מאופיינת בצרכים ביטחוניים ייחודיים. באמור יש כדי להשליך באופן ישיר על נקודת האיזון בין זכויות הפרט לבין צרכי הביטחון, כפי שמתבטאת בחקיקה המחייבת ובאופן הפעלת הסמכויות בהיבטים מושא עתירה זו. לאור כך, המשיב יטען כי הוראת סעיף 67 לצו בדבר הוראות ביטחון עולה בקנה אחד עם הוראות דיני התפיסה הלוחמתית שבמשפט הבין-לאומי ויישומה מבטא איזון הולם בין הרצון להגן על זכויות הפרט מחד גיסא, לבין הצורך בהפעלה גמישה ויעילה של מנגנון החיפוש באזור יהודה ושומרון, מאידך\nגיסא.\nנפרט כבר עתה את הנימוקים לדחיית העתירה לגופה, בתמצית.\n3",
      "1\n2\nב״כ המשיבים: משאיר לשיקול דעת בית המשפט.\n3\n4\n5\n6\nפסק דין\n7\n8\nהעתירה נמחקת כמבוקש.\n9\n10\nאין צו להוצאות.\n11\n12\nהאגרה תוחזר לעותר באמצעות בא כוחו בהתאם לתקנות.\n13\n14\n15\n16\n17\nניתן והודע היום ו׳ תשרי תשפ״ב, 12/09/2021 במעמד הנוכחים.\nמשה סובל, סגן נשיא\n18\n19\nהוקלד על ידי אביטל דוד זאדה",
      "וביטחון האזור.\nבהמשך לכך, בימים אלה עמלים גורמי צה״ל הרלוונטיים, בשיתוף פעולה עם משטרת ישראל וגורמי הביטחון, על גיבוש נוהל שיסדיר את הנושא באופן קבוע. יצוין, כי עבודת המטה בעניין צפויה להסתיים במהלך החודשים הקרובים.\n.5\nנדגיש כי על רקע עבירות חמורות המבוצעות על-ידי קטינים באיו״ש, הצורך המבצעי והחקירתי מחייב במרבית המקרים את מעצרם היזום ללא הודעה מוקדמת לחשוד. כך למשל, יצוין, בלי למצות את היבטיו השונים של הצורך המבצעי והחקירתי האמור, כי צורך חקירתי עשוי לחייב עריכת חיפוש בביתו של הקטין החשוד לשם איתור ראיות העשויות להיות במקום. דוגמא נוספת היא במקרים שבהם ישנו חשד כי הפעילות נעשתה בשיתוף\nעם אחרים, ויש צורך במעצר יזום בהפתעה, שימנע מאחד השותפים באירוע לתת התראה מקדימה לשותפיו.\n.6",
      "13.9.2021\n;\n1\n3\n4\n5\n6\n-\n9\n10 ב״כ המשיבים: אנו לא עומדים על הטענה של אי עמידה בתנאי סף, אלא אם הוא מבקש לעבוד\n11 במרחב התפר. ככל שהוא לא מבקש במרחב התפר, אלא ביישובים ישראליים באזור, אנו לא עומדים על הטענה כי הוא אינו עומד בתנאי הסף. לגבי תחקור, במידה ותוגש בקשה והוא יגיע לתחקור, אז בהתאם לממצאי התחקור תישקל הבקשה.\n12\n13\n14\n15\n16 עו״ד אבי: לעיתים אנו מבקשים את התחקור אפריורית, וזה במקרים בהם אנו לא מונעים מראש, אלא אומרים שאנו רוצים תחקור. ביקשנו תחקור על מנת להשלים את הליכי הבדיקה לאור הבקשה\n17\n18\n19\n20 ב״כ העותר: שמעתי את דברי בית המשפט כי מדובר במקרה שבו לא ניתן לדעת מה תהיה התוצאה\n21 לאחר התחקור ואת המלצתו למשוך את העתירה ולהדריך את העותר להתייצב לתחקור תוך שמירת 22 טענותיו למקרה שבו המניעה לא תוסר לאחר התחקור. לפיכך, אבקש למחוק את העתירה ולהשיב 23 את האגרה.\nבית המשפט המחוזי בירושלים בשבתו כבית-משפט לעניינים מנהליים בפני כב׳ סגן הנשיא משה סובל",
      "פסק דין ד׳ כסלו תשפ״ג, 28/11/2022 תיק 54727-09-22 שו׳ משה סובל\nעת״מ 54727-09-22 בפני כבוד השופט מ. סובל\nבבית המשפט המחוזי בירושלים בשבתו כבית המשפט לעניינים מנהליים\nכאיד סמור ת״ז 854931102 ע״י ב״כ עו״ד מור סוקר מ.ר 65650 מרחוב ז׳בוטינסקי 33 רמת גן, מגדל הר טל: 03-5750750, 054-4312005, פקס: העתירה נמחקת כמבוקש. - נגד-\nהעותר:\nאין צו להוצאות. האגרה תוחזר לעותר באמצעות ב״כ *** נחתם דיגיטאלית ***\nשר הביטחון ואח׳ כולם ע״י פרקליטות מחוז י-ם (אזרחי) מח״ל 7, מעלות דפנה, ת.ד 49333 ירושל בהתאם לתקנות.\nהמשיבים:\nתאריך חתימת המסמך: 27.11.22 מועד אחרון להגשה: 27.11.22 (על פי פרוטוקול מיום 20.11.22)\nבקשה למחיקת העתירה\nכפי החלטת בית המשפט הנכבד מיום 20.11.22, העותר מבקש להודיע שהוא מבקש להורות על מחיקת העתירה, מן הטעמים הבאים:\nקורות ההליך",
      "3. בנוסף, טרם דיון ההמשך, העברה לידיעתנו פנייתו של רמ״ט משרד הביטחון לר׳ המל״ל מיום ה-02/08, ולפיה בשל הרקע לדברים (החלטת הקבינט והנחיית המדיניות) ולנוכח עמדת השב״כ והייעוץ המשפטי לממשלה, המל״ל מתבקש לבחון באם יש מקום להביא את הנושא לדיון בקבינט או לעדכן או חברי הקבינט.\nרח׳ צלאח א-דין 29, ת״ד 49029, ירושלים מיקוד 9149001, פקס.\n2\n4. דיון ההמשך נדרש, אם כן, לצורך השלמת הבחינה המשפטית בנוגע למניעת אג״ם-הרתעה כלפי קרובי משפחה של מפגעים במעגל ראשון ושני, ולאור ההכרח להעביר התייחסות מידית לבית המשפט המחוזי בירושלים במספר עתירות בעניין חמולות.\nעיקרי הדיון:"
    ]
  },
  {
    "question": "מתי נכון להסמיך גורם ממשל ישראלי באיו\"ש?",
    "reference_answer": "הסמכת גורמי ממשל – כאשר החיקוק המאומץ מבקש להסמיך גורמי ביצוע שונים לפעול באזור, יש לבחון האם אותם גורמי ביצוע מתאימים לביצוע המשימה באזור. יש לבחון בהקשר זה תחילה מה חלוקת \"גבולות הגזרה\" בין נציגי המשרד הרלוונטי בישראל לבין הקמ\"טים הרלוונטיים של המנהל האזרחי, והאם לא יהיה זה נכון \"להמיר\" את סמכותו של הגורם הישראלי בסמכותו של קצין המטה )קמ\"ט( הרלוונטי. אף שכלל האצבע לפי החלטות הממשלה בדבר ארגון פעילות המנהל האזרחי )החלטת הממשלה מס' 737 מיום 8.9.68 והחלטת הממשלה מס' 106 מיום 4.10.81( הוא הפעלת סמכויות ישירה של משרדי הממשלה )שלא באמצעות הקמ\"טים( בתוך ההתיישבות, במציאות הדברים עשויים להיות מורכבים יותר כך, למשל, במקרים 29 ותלויים במדיניות הארגונית של כל משרד ממשלתי רלוונטי. רבים, ייתכן שתהיה הצדקה לבכר להקנות סמכות לקמ\"ט הרלוונטי על פני להסמיך גורם מהמשרד הממשלתי המקביל, בשל היכרותו של הראשון עם דין האזור, צרכי האוכלוסייה באזור, צרכי המינהל האזרחי ועוד.",
    "rag_answer": "הסמכת גורם ממשל ישראלי באיו\"ש נעשית בהתאם לצרכים הביטחוניים והמדיניים של מדינת ישראל. לדוגמה, אזור הגדה המערבית הוכרז כשטח סגור על פי הצו בדבר שטחים סגורים (אזור הגדה המערבית) (מס' 34) תשכ\"ז-1967, מה שמקנה סמכויות מסוימות לגורמים הממשלתיים לפעול באזור זה בהתאם לצווים והחלטות הקבינט הביטחוני-מדיני ([א. כתב העתירה.pdf](https://tikshuv.sharepoint.com/sites/syntaxOcrTest/DocLib1/Forms/AllItems.aspx?id=/sites/syntaxOcrTest/DocLib1/%D7%A2%D7%A0%D7%A3%20%D7%91%D7%99%D7%98%D7%97%D7%95%D7%9F/%D7%9E%D7%93%D7%95%D7%A8%20%D7%90%D7%95%D7%9B%D7%9C%D7%95%D7%A1%D7%99%D7%9F/%D7%90.%20%D7%9B%D7%A0%D7%99%D7%A1%D7%94%20%D7%9C%D7%99%D7%A9%D7%A8%D7%90%D7%9C/%D7%92.2.%20%D7%94%D7%9C%D7%99%D7%9B%D7%99%D7%9D%20%D7%9E%D7%A9%D7%A4%D7%98%D7%99%D7%99%D7%9D%20%D7%95%D7%A4%D7%A0%D7%99%D7%95%D7%AA%20-%20%D7%9E%D7%A0%D7%99%D7%A2%D7%95%D7%AA%20%D7%9B%D7%A0%D7%99%D7%A1%D7%94%20%D7%9C%D7%99%D7%A9%D7%A8%D7%90%D7%9C/%D7%90.%20%D7%9E%D7%A0%D7%99%D7%A2%D7%95%D7%AA%20%D7%91%D7%98%D7%97%D7%95%D7%A0%D7%99%D7%95%D7%AA/%D7%94%D7%9C%D7%99%D7%9B%D7%99%D7%9D%20%D7%9E%D7%A9%D7%A4%D7%98%D7%99%D7%99%D7%9D/2022/14649-12-22%20%D7%A0%D7%92%27%D7%90%D7%A7%20%D7%93%D7%95%D7%A7%D7%9E%D7%90%D7%A7/%D7%90.%20%D7%9B%D7%AA%D7%91%20%D7%94%D7%A2%D7%AA%D7%99%D7%A8%D7%94.pdf&parent=/sites/syntaxOcrTest/DocLib1)).\n\nבנוסף, החלטות הקבינט הביטחוני-מדיני, כמו למשל בנושא עיכוב השבת גופות מחבלים, מתקבלות לצורך תכליות ביטחוניות ומדיניות, והן מנחות את פעולות הגורמים הממשלתיים בשטח ([4462-20 הודעה לאחר דיון בהתנגדות למתן צו על תנאי - עותק חתום להגשה.pdf](https://tikshuv.sharepoint.com/sites/syntaxOcrTest/DocLib1/Forms/AllItems.aspx?id=/sites/syntaxOcrTest/DocLib1/%D7%97%D7%95%D7%9E%D7%A8%D7%99%20%D7%91%D7%93%D7%99%D7%A7%D7%94%20%D7%CRAG/%D7%A7%D7%9C%D7%A1%D7%A8%20%D7%97%D7%A4%D7%99%D7%A4%D7%94%20%D7%9C%D7%A4%D7%A6%D7%A8%20%D7%94%D7%A0%D7%9B%D7%A0%D7%A1%20%282021%29/%D7%94%D7%97%D7%96%D7%A7%D7%AA%20%D7%92%D7%95%D7%A4%D7%95%D7%AA%20%D7%9E%D7%97%D7%91%D7%9C%D7%99%D7%9D/4462-20%20%D7%94%D7%95%D7%93%D7%A2%D7%94%20%D7%9C%D7%90%D7%97%D7%A8%20%D7%93%D7%99%D7%95%D7%9F%20%D7%91%D7%94%D7%AA%D7%A0%D7%92%D7%93%D7%95%D7%AA%20%D7%9C%D7%9E%D7%AA%D7%9F%20%D7%A6%D7%95%20%D7%A2%D7%9C%20%D7%AA%D7%A0%D7%90%D7%99%20-%20%D7%A2%D7%95%D7%AA%D7%A7%20%D7%97%D7%AA%D7%95%D7%9D%20%D7%9C%D7%94%D7%92%D7%A9%D7%94.pdf&parent=/sites/syntaxOcrTest/DocLib1)).",
    "contexts": [
      ".2\nמ15.05.2018.\nלצורך השלמת התמונה, אציין כי הנ״ל לא החזיק באף היתר מהסוג המבוקש אלה ברישיונות תעסוקה באיזור ההתישבויות בלבד באיזור יהודה ושומרון בין השנים .2011-2018\n.3\nהשגת העותר כנגד המניעה הביטחונית המוזנת כנגדו התקבלה במת״ק ביום 17.07.2018 ע״י אגודת סנט איב והועברה לאבחון גורמי הביטחון עוד באותו היום. מגישי הבקשה עודכנו על העברת הבקשה לאבחון עוד באותו יום. ביום 26.07.2018 סורבה הבקשה, נוכח המלצתם השלילית של גורמים אלו. יש לציין כי בניגוד לעתירה אגודת סנט איב עודכנו על הסירוב עוד באותו היום - 26.07.2018.\n.4\nלאור האמור לעיל, ולנוכח סירוב גורמי הביטחון להסיר את מניעת השב״כ, נראה כי העותר מיצה הליכים טרם פנייתו לערכאות משפטיות.\n.5\nהפרקליט המטפל - נודה לניסוח תגובתך ברוח הדברים והעברת הטיוטא דרך משרדנו טרם הגשתה לבית המשפט.\nבברכה,\nברכה אוכלוסין המשפטי\nמדור\nלגדור\nהיועץ\nסרן ייעוץ\nקצין בשם\n00152-01-13990\nבלמ״ס\nScanned with CamScanner",
      "8. בתאריך 16/7/2022 נשלחה תזכורת לבקשה הנ״ל. בתאריך 17/7/2022 נתקבלה תשובה מטעם המשיבים, לפיה \"הבקשה סורבה בתאריך 8/3/2022. מצ״ב העתק מההתכתבות לעיל ומסומן כנספח ע/4 לעתירה זו; 9. מדובר בתשובה לאקונית, בלתי מנומקת וחלקית ביותר. לא ברור מדוע העותרת מנועה, ועל מה מתבססת המניעה הנ״ל.\n2\n3 of 17\nהטיעון המשפטי\n10. אין העותרת מהווה סכנה לציבור בישראל ולשלום מדינת ישראל. העותרת הינה אדם מבוגר ואחראי ובעל משפחה. היא מעולם לא נחשד ו/או הורשע בפגיעה בביטחון מדינת ישראל ו/או אזרחיה אלא שמר על החוק.\n11. לא ברור מה עמד ביסוד החלטת הסירוב אולם ברור כי נפלה טעות ולא היה שום סיבה המצדיקה הזנת מניעה נגד העותרת אשר פגעה פגיעה קשה בפרנסתה ובחופש העיסוק שלה.\nסמכותו של המשיב\n12. אזור הגדה המערבית, הוכרז עוד ב- 1967 כשטח סגור על פי הצו בדבר שטחים סגורים (אזור הגדה המערבית) (מס׳ 34) תשכ״ז - 1967.",
      "אם ברצונך לבדוק את דברי ולאמתם - אתה יותר ממוזמן לעשות כן, שכן כבר מספר חודשים אני מנהל התכתבויות עם גורמים שונים בצה״ל אשר בסופו של דבר החליטו לנווט את הפניה אליך.\nמתוקף השכלתי האקדמית בתחום המשפט והיותי ראש עמותה הפועלת בהתנדבות לטובת ציבור אזרחי וחיילי מדינת ישראל ואחרים. אינני מעוניין לפנות לבית המשפט העליון בבג״ץ ולבזבז כספי ציבור המופקדים בידי, זמן יקר ומשאבי מערכת. אבקשך לפעול כדי לסייע ולתת הוראה חד משמעית לגבי מי הוא זה ואי זה הוא אשר יהיה אמון על מתן החלטה עקרונית לפיה תרומתו הכלכלית של מר גדיר אבוגליה היא משמעותית ולפיכך מן הראוי ליתן לו אישור שהיה בישראל. כמו כן מניסיוני עדיף כי נערוך פגישה מסודרת בנידון דבר שמן הסתם יקצר את ההליכים ויביא אותנו לתוצאה מעשית.\nבברכה,\nעמרי הלוי וייל מוסמך בלימודי משפט יו״ר עמותת תנו לאדם לחיות",
      "בלמ״ס -1-\nלישראל\nאל\n02-9977071/711\nטל׳:\n077-470-1860\nפקס:\nדוא״ל:\nyoayosh@gmail.com\nסימוכין:\n00152-01-13990\nתשע״ט\nה׳\nבאדר\nבפברואר\n10\n2019\nצבא\nההגנה\nיהודה\nאזור\nוהשומרון\nהמשפטי\nהיועץ\nלשכת\n90631\nבית\n,5\nת״ד\nפרקליטות מחוז ירושלים - אזרחי - לידי הפרקליט המטפל\nהנדון: עת״מ 70889-11-18- מוחמד עלי מוחמד תעאמרה ת.ז. 938618709-\nהתייחסות לעתירה\n1. עניינה של העתירה העוסקת בבקשתו של העותר אשר פרטיו בנדון, המבקש כי\nתותר כניסתו לישראל לצורך תעסוקה.\nמבדיקה במערכת הממוחשבת העומדת לרשותנו, עלה כי העותר הינו תושב הכפר תקוע שבנפת בית לחם, בן 29 לערך ורווק. משכך, העותר עומד בתנאי הסף לכניסה לישראל לצורכי תעסוקה, בכפוף לנהלים הקיימים לעניין זה, ובפרט להיעדר מניעה ביטחונית או פלילית. דא עקא, שבעניינו של העותר מוזנת מניעה ביטחונית החל\n.2\nמ15.05.2018.",
      ".11\nאם אחריהן.\nנזכיר, כי לעמדת המדינה, המתחייבת מלשון החלטות הקבינט ומתכליתן, לשאלה אם המחבל מצא את מותו, או ביצע את פעילות הטרור לפני או אחרי מועד החלטות הקבינט, אין רלוונטיות לעניין תכלית החלטות הקבינט, העוסקת בסוגיית עיכוב השבת גופותיהם של מחבלים, המצויות בידי המדינה בעת הזו; ובערך הטמון בעצם החזקה זו לצורך משא ומתן עתידי. אם כן, נקודת הכובד הרלוונטית לדיון זה טמונה בעצם תכליתה של החלטת הקבינט, הצופה פני עתיד, ולא שאלת מועד אירוע מותו של המחבל מושא ענייננו או של בני משפחתו. מעבר לכך, ברי כי לא ניתן לטעון ל\"זכות קנויה\" או \"הסתמכות\" של משפחת המחבל או בני משפחתו לכך שההחלטה על השבת גופתו תתקבל בהתאם למדיניות הנוהגת בעת ביצוע הפיגוע, ולא בהתאם למדיניות השו״ן התקפה לעת הזו (לאור זאת, ספק אם המונח \"רטרואקטיביות\" שבו משתמש העותר בטענותיו, הוא הרלוונטי לענייננו; אולם אין\n.12",
      "(נספח 4 לעתירה). 26. ביום 15.7.2020, השיב סמנכ״ל בכיר מינהל חווית התייר לפניית העותר כדלקמן: \"1. הסכמי פריס הינם בגדר עניין מדיני ומשכך מדובר בהחלטה פנימית של מדינת ישראל, ובהתאם גם השיקולים המנחים לגיבוש המלצת משרד התיירות. 2. בהמשך לפנייתך שבסימוכין ולאחר בחינת בקשתך שבנדון, אין בכוונת משרד התיירות להעביר המלצתו להגדלת כמות מדריכי התיירות הפלשתינים המופיעים כיום ברשימה מכוח הסכמי פריס. 3. יובהר, כי נכון לעת הזו, עקב מגפת הקורונה, כמעט ולא קיימת כל פעילות תיירותית ואין צפי מתי תתחדש, כך שלצערנו בנסיבות המתוארות אין ממש בטיעונים המועלים על ידך במסגרת פנייתך שבסימוכין. 4. כאשר ישתנו הנסיבות הנך מוזמן לפנות בשנית בבקשה לבחינת בקשתך שבנדון\". - תשובה מיום 15.7.2020, שלא צורפה לעתירה, מצ״ב כנספח 2. 27. כאמור בתשובה לפניה, בשנת 2020 (ובהמשך גם בשנת 2021) שמי ישראל היו סגורים או מותנים בהגבלות לכניסת קבוצות תיירים על רקע",
      ".20\nאשר לשיקול המשני הנזכר בחוות דעת הרמטכ״ל, נציין למען הזהירות כי החלטת הקבינט מושא ענייננו התקבלה לצורך תכלית שו״ן, ובהתאם הגופה הקונקרטית מושא העתירה שבכותרת מוחזקת לתכלית שו״ן בלבד. לפיכך, המדינה אינה רואה צורך בהכרעה שיפוטית בכל הנוגע לתכליות אחרות הנוגעות לסמכות השימוש בתקנה 133(3). נשוב בהקשר זה על דברים שכתבה המדינה בהשלמת טיעון במסגרת הדיון הנוסף:\n\"נזכיר כי התכלית שהוצגה על ידי המדינה לשימוש בתקנה 133(3) בעתירות מושא ענייננו, היתה אחת ויחידה - סיוע בקידום הסדר להשבת אזרחים ישראלים וגופות חללי צה״ל המוחזקים על ידי החמאס ברצועת עזה, ובהתוויית פרטי ההסדר שייקבע. כאמור, דעת הרוב בפסק הדין, כלל לא נדרשה לשאלת יישום התכלית, וממילא אין בנמצא קביעות שלה בסוגיה זו.",
      "י]\nירושלים, י\"ט תמוז, תשע״ה יום שני 06 יולי 2015 בתשובתך ציין נא: 64/15\n***- \"\nלכבוד, עו״ד מעין נייזנה עמותת גישה בדוא״ל: maayan.n@gisha.org\n..... )\n*** -*\nהנדון: תלונתך נגד יחידת מתאם פעולות הממשלה בשטחים שלום רב,\n......\nה-\n1. ביום 4/5/2015 התקבלה ביחידה הממשלתית לחופש המידע תלונתך נגד יחידת מתאם פעולות הממשלה בשטחים (להלן: \"הנילונה\"). בתלונה הועלו טענות בעניין אי מתן מענה במועד למספר בקשות שהוגשו לפי חוק חופש המידע, תשנ״ח-1998 (להלן - החוק). בתלונה נטען, כי חרף פניות חוזרות ונשנות, טרם התקבל מענה לגופו של עניין לארבע בקשות לקבלת מידע, כדלקמן:\nא. בקשה מיום 9/12/2014 בנושא \"נוהל עבודת מת״ק עזה לטיפול בבקשות מהוועדה האזרחית הפלסטינית\".\nב. בקשה מיום 19/2/2015 בנושא \"נתונים על אודות פעילות המעברים ואספקת מים וחשמל לרצועת עזה\". ג. בקשה מיום 24/3/2015 בנושא \"אישור/סירוב לבקשות מתן היתרי כניסה לישראל בנימוק של מניעה בטחונית\".",
      "שמוחזקות בידי ישראל וטרם התקבלה החלטה סופית בעניינן - הרי ששאלת החזקתן נבחנת בראי התכלית האמורה של קידום הסדר להשבת אזרחי ישראל וגופות חללי צה״ל, בלבד. לפיכך, כאמור, אין צורך בגדרי דיון נוסף זה להכריע בעניינן של תכליות אחרות שמכוחן עשויות להיות מוחזקות גופות מחבלים בידי ישראל, לעתיד לבוא, מכוח תקנה 133(3).",
      "מוחזקת במכון הלאומי לרפואה משפטית. בנוסף, נמסר כי בני משפחתו של עלאא יכולים לפנות בבקשה לקבלת היתר כניסה לישראל לצורך זיהוי גופתו. העתק מהמענה של פרקליטות המדינה מיום 06.03.2023 מצורף ומסומן ע/2. 13. בהסתמך על האמור בהודעת פרקליטות המדינה, העותרים פנו למנהלת תיאום וקישור (להלן: מת״ק) ושם הגישו בקשה לקבלת היתר כניסה לישראל לצורך זיהוי גופה תוך הצגת המענה שהתקבל מטעמם המדינה ביום 06.03.2023. 14. בהיעדר מענה לבקשתם הדחופה, העותרים שבו והגישו בקשה נוספת באמצעות הקישור הפלסטיני ביום 13.03.2023. כעבור יומיים נמסר לעותרים כי בקשתם לכניסה לישראל סורבה בשל אי עמידתם בקריטריונים."
    ]
  },
  {
    "question": "מהם התנאים להפקעת קרקע לצורך הקמת פרוייקט בתחום המים באיו\"ש?",
    "reference_answer": "לקמ\"ט מים הסמכות להפקיע קרקע לטובת הקמת מפעל מים. על הפקעות 16 שנעשות ע\"י קמ\"ט מים חלים כל דיני ההפקעה הכלליים, ובכללם הדרישה הכפולה לקיום  צורך ציבורי של האוכלוסייה המקומית, ומידתיות הפגיעה בקניין פרטי. לעניין הצורך  הציבורי, נקבע כי \"אין המפקד הצבאי רשאי לשקול את האינטרסים הלאומיים,  הכלכליים, הסוציאליים של מדינתו שלו, עד כמה שאין בהם השלכה על האינטרס  הביטחוני שלו באזור או על האינטרס של האוכלוסייה המקומית\"17. ככלל, כלל הליכי  ההפקעה באזור טעונים עמ\"ט בהובלת תחום תשתית במנהא\"ז וחו\"ד משפטית מטעם  מחלקת יועמ\"ש איו\"ש, זאת, למעט הפקעות זמניות )דוגמת קווי מים וביוב תחתיים(,  אשר אינם דורשים עמ\"ט בהובלת תחום תשתית, אלא התייחסות משפטית בלבד",
    "rag_answer": "התנאים להפקעת קרקע לצורך הקמת פרויקט בתחום המים באיו\"ש אינם מופיעים במקורות שסופקו. \n\nאם יש לך מקורות נוספים או פרטים נוספים, אנא ספק אותם ואשמח לעזור.",
    "contexts": [
      "כפי שיובהר להלן, העותר אינו עומד גם בקריטריונים העדכניים שפורסמו לציבור תושבי האיזור.  \nבמהלך חודש השנה, הוחלט להרחיב את הקריטריונים להגשת בקשה כבעניינו של העותר. כך לדוגמא, בהתאם לקריטריונים העדכניים רשאים רווקים שעברו את גיל 27 להגיש בקשת היתר כניסה לישראל למטרות עבודה בענף הבניין. \nאמנם, הקריטריונים החדשים טרם עודכנו באופן רשמי בנוהל סטטוס הרשאות הידוע, והם יתווספו לנוהל במועד פרסומו של הנוהל המעודכן, אך מכל מקום, הקריטריונים העדכניים הובאו, כנהוג, לידיעת תושבי האזור, באמצעות מערך הקישור הפלסטיני, ואף פורסמו בעמוד הפייסבוק של המינהל האזרחי. \nצילום הפרסום מדף הפייסבוק של המשיבה מצורף כנספח א'.  \nיודגש כי הרחבת הקריטריונים העדכניים אינם משנים את מצבו של העותר שבשל גילו ומצבו המשפחתי אינו זכאי להגשת בקשת היתר כניסה לעבודה בענף הבניין.",
      "שעניינן טרם הוכרע בתקופת הביניים או לפניה. בהקשר זה, יצוין כי חלק מן העותרים ביקשו להעניק לפגיעה הנטענת על ידיהם באינטרס הסתמכות מעמד של פגיעה בזכות חוקתית, אולם טיעון זה נטען באופן כוללני וללא כל תשתית משפטית מספקת.",
      "נובעת מחובת ההגינות החלה על כל רשות ציבורית, שהמשיב נמנה עליהן (ראו, למשל, בג״צ 2159/97 מועצה אזורית חוף אשקלון נ׳ שר הפנים ואח׳, פ״ד נב (1) 75). בענייננו, נמסר לעותר רק, כי קיימת מניעה בטחונית. זהו סרוב עמו קשה לעותר להתמודד. 24.5. פגיעה בכללי הצדק הטבעי. בהעדר החלטה מנומקת של המשיב נשללת מהעותר הזכות לענות באופן אפקטיבי לטענות שמועלות נגדו. בכך נפגעת זכותו להליך הוגן ובכלל זה זכות הטיעון. חמור מכך, אף נשללת האפשרות להעמיד את עמדת המשיבים באופן אפקטיבי תחת ביקורתו השיפוטית. ודוק, העותר מודע לכך שההחלטות מבוססות לעיתים גם על חומר ראייתי שלא ניתן לחושפו מטעמי ביטחון - צורך בהגנה על מקורות מידע חסויים או על שיטות חקירה או פעולה של השב״כ. ואולם ברי, כי אין בכך כדי לשמש הצדקה אוטומטית להסתרתו של מכלול החומר הקיים בידי הרשות.",
      "צילום הפרסום מדף הפייסבוק של המשיבה מצורף כנספח א'.  \nיודגש כי הרחבת הקריטריונים העדכניים אינם משנים את מצבו של העותר שבשל גילו ומצבו המשפחתי אינו זכאי להגשת בקשת היתר כניסה לעבודה בענף הבניין. \n באשר לטענות ב\"כ העותר כי בעניינו של העותר בעת\"ם 21697-10-22 מנצור נ' מפקד כוחות צה\"ל באיו\"ש  בחנה המשיבה את בקשת העותר שם, על אף שלא עמד בקריטריונים, תבקש המשיבה להעמיד דברים על דיוקם. \nאומנם בתגובה המקדמית שהוגשה מטעם המדינה נכתב כי: ''העותיליינו עומד בתנאי הסף לכניסה לישראל לצרכי תעסוקך בקשתו נבחנה באופן פרטני.\" מדובר בניסוח שאינו מדויק, ואינו משקף את  הדברים כהוויתם. \nכאמור לעיל, הקריטריונים לקבלת היתר כניסה לישראל עודכנו והורחבו. לעניינו הנוהל העדכני מחריג רווקים החל מגיל 22 שאביהם מחזיק בהיתר עבודה בענף הבניין, ומאפשר להם להגיש בקשת היתר כניסה לעבודה בענף הבניין.",
      "42. אם למדים כי האמנות והכללים הנהוגים באוור התקבלו כמחייבים בפסיקה הישראלית מחייבים את המפקד הצבאי לדאוג לא רק לביטחונם של תושבי האזור אלא גם לרווחתם ולהבטיח את פרנסתם בצורה סבירה.\nז. הסירוב למתן היתר כניסה ועבודה פוגע בזכויות היסוד של העותר\n..",
      "כאמור לעיל, הקריטריונים לקבלת היתר כניסה לישראל עודכנו והורחבו. לעניינו הנוהל העדכני מחריג רווקים החל מגיל 22 שאביהם מחזיק בהיתר עבודה בענף הבניין, ומאפשר להם להגיש בקשת היתר כניסה לעבודה בענף הבניין. \nכיוון שאביו של העותר בעת\"מ מנצור אכן מחזיק בהיתר עבודה בענף הבניין, נבחנה בקשתו של העותר להסרת מניעה על ידי הגורמים הביטחוניים.מאידך, מצבו של העותר כאן לא השתנה גם לאחר עדכון הקריטריונים, ומשכך אין מקום לבחינת בקשתו להסרת מניעה ביטחונית.\nיודגש כי גם לו תיבחן בקשת העותר להסרת המניעה ותתקבל, כיוון שכאמור העותר לא עומד בקריטריונים העדכניים לא תותר כניסתו לישראל, ואין כל טעם להעברת בקשתו לבחינת הגורמים הביטחוניים. \nלאור האמור, שבה ומבקשת המדינה את בית המשפט הנכבד להורות על סילוק העתירה על הסף, תוך חיוב העותר בהוצאות המשיבה .",
      "תאריך החתימה על המסמך: ‏27 דצמבר 2022\nבבית משפט המחוזי בירושלים\t\t\t\tעת\"מ 20387-10-22\nבשבתו כבית משפט לעניינים מנהליים\nבפני כבוד השופט  משה סובל, סגן נשיא\t\n\n\nעותר\t\t \n\t\t\t\tחמזה פזע, ת\"ז 405301854\n\tע\"י ב\"כ עו\"ד  יהונתן קמיל ואח' , מ\"ר עו\"ד74464\nמרח' היסמין 6 (מתחם ת.דלק 10) אזור תעשייה אריאל מערב .\nטל:050-6794549 פקס:03-7399356 \n\t\t\t\t-  נ  ג  ד  -\nמשיבה\t\t \tמדינת ישראל - המנהל האזרחי באיו\"ש\n\t\t \tע\"י פרקליטות מחוז ירושלים - אזרחי\n\t\t \tמרח' מח\"ל 7, ירושלים  9149301 ת\"ד 49333\n\t\t \tטל': 073-3920000 פקס: 02-6468053\n\t\t \tכתובת דוא\"ל: ez-jer@justice.gov.il\n\t \n\t \n \n\nהמועד האחרון להגשה:27.12.22\nהודעה מטעם המשיבה\nבהמשך להחלטת בית המשפט הנכבד מיום 14.12.22 , ולדיון שהתקיים באותו מועד, מתכבדת המשיבה למסור עמדתה באשר להצעת בית המשפט, לאפשר לעותר להגיש בקשה להסרת המניעה הביטחונית על אף שאינו עומד בקריטריוני הסף לקבלת היתר כניסה לישראל.",
      "כעולה מפרוטוקול הדיון, סעיף זה נוסף אף הוא כחלק ממערך האיזונים והבלמים שמצאה הכנסת לקבוע בחוק, על רקע הרחבת אפשרות שדרוג המעמד בחוק. במסגרת זו, ביקשה הכנסת למנוע שימוש לרעה במעמד המשודרג לצורך מעורבות בפעולות טרור, זאת באמצעות הקניית סמכות לשר הפנים לשלול רישיון ישיבה שניתן מכוח חוק זה (ראו בעניין זה את דבריו של יו״ר הוועדה, חבר הכנסת רם בן ברק, בעמ' 9-8).",
      "כמפורט בבקשה לסילוק על הסף, בקשת העותר להסרת מניעה בטחונית, נדחתה משני טעמים: ראשית, בעת הגשת הבקשה טרם חלפה שנה ממועד סירוב בקשת העותר הקודמת, ובהתאם לסעיף 3(ב) לנוהל \"הסרת מניעה ביטחונית לישראל\" בקשת העותר נדחתה. שנית, בשל מצבו המשפחתי וגיל העותר בעת הגשת הבקשה, העותר אינו עומד בקריטריונים הנדרשים לתעסוקה בענף הבנייה בישראל, כפי שהם מופיעים בנוהל סטטוס הרשאות (להלן: \"הנוהל\" ) שצורף כנספח לבקשת הסילוק על הסף. \nהצעת בית המשפט הנכבד עלתה בגין טענות שהעלה ב\"כ העותר , לפיהן בעת\"ם 21697-10-22 מנצור נ' מפקד כוחות צה\"ל באיו\"ש  (להלן: \"עת\"מ מנצור\") בחנה המשיבה את בקשת העותר שם, למרות שלא עמד בקריטריונים. המדינה תבקש להעמיד דברים על דיוקם.",
      "פיקוח ובקרה על הקמ״טים\nהפק״א קובעת כי ראש ענף תיאום אזרחי וראש תחום תשתית במנהא״ז, שהם קצינים בצה\"ל בדרגת סגן אלוף, יתאמו את פעילות הקמ״טים שהוגדרו בפק״א ככפופים לאחריותם. לקמ״טים, כאמור, כפיפות דואלית - הן למינהל האזרחי והן למשרדי האם, ולפיכך שניהם אמורים לפקח על פעילותם של הקמ״טים מהבחינה הניהולית והמקצועית, כל אחד בתחום אחריותו, בהתאמה. מנגנוני הפיקוח והבקרה יכולים לפעול הן באמצעות הגשת תוכניות עבודה ובקרות מקצועיות של הגורמים הממונים והן באמצעות ביקורות פנים."
    ]
  },
  {
    "question": "הצג פעולה משפטית מהעבר שבוצעו בידי אנשים הקשורים לכפר טובא",
    "reference_answer": "·       ביום 22 בנובמבר 2022 הוגשה עתירה בשם תושבי הכפרים \"צפאי\", \"טובא\" ו-\"מע'אייר אל עביד\" הממוקמים בצפון-מערב שטח אש 918, בדרישה לקבוע \"מדיניות הומניטרית\" ביחס אליהם, הכוללת קביעת \"מדיניות אכיפה\" כלפי מבנים בלתי-חוקיים המשמשים אותם. זאת, לטענתם, לאור החלטת שר הביטחון מיום 19 ביולי 2012, לפיה לא יפנו את העותרים להליך מחלקו הצפון-מערבי של שטח אש 918.",
    "rag_answer": "המידע על פעולה משפטית שבוצעה על ידי אנשים הקשורים לכפר טובא נמצא בעתירה שהוגשה על ידי אבראהים בדארין, תושב סמוע שבנפת חברון, נגד המנהל האזרחי באיו\"ש. העתירה עסקה בבקשה להסרת מניעה ביטחונית וקבלת היתר כניסה לישראל לצורך תעסוקה. לאחר בחינת המידע, גורמי הביטחון התנגדו להסרת המניעה אך היו נכונים לשקול את הבקשה בחיוב לאחר שישה חודשים, בתנאי שלא יתווסף מידע חדש לחובתו של העותר. בעקבות זאת, העותר ביקש למחוק את העתירה.\n\nהעתירה נמחקה על ידי בית המשפט לעניינים מנהליים בירושלים ב-19 במרץ 2023, והוחלט על החזר אגרה לפי התקנות.\n\nלפרטים נוספים ניתן לעיין במסמך המקורי:\n[פסק דין](https://tikshuv.sharepoint.com/sites/syntaxOcrTest/DocLib1/Forms/AllItems.aspx?id=/sites/syntaxOcrTest/DocLib1/%D7%A2%D7%A0%D7%A3%20%D7%91%D7%99%D7%98%D7%97%D7%95%D7%9F/%D7%9E%D7%93%D7%95%D7%A8%20%D7%90%D7%95%D7%9B%D7%9C%D7%95%D7%A1%D7%99%D7%9F/%D7%90.%20%D7%9B%D7%A0%D7%99%D7%A1%D7%94%20%D7%9C%D7%99%D7%A9%D7%A8%D7%90%D7%9C/%D7%92.2.%20%D7%94%D7%9C%D7%99%D7%9B%D7%99%D7%9D%20%D7%9E%D7%A9%D7%A4%D7%98%D7%99%D7%99%D7%9D%20%D7%95%D7%A4%D7%A0%D7%99%D7%95%D7%AA%20-%20%D7%9E%D7%A0%D7%99%D7%A2%D7%95%D7%AA%20%D7%9B%D7%A0%D7%99%D7%A1%D7%94%20%D7%9C%D7%99%D7%A9%D7%A8%D7%90%D7%9C/%D7%90.%20%D7%9E%D7%A0%D7%99%D7%A2%D7%95%D7%AA%20%D7%91%D7%98%D7%97%D7%95%D7%A0%D7%99%D7%95%D7%AA/%D7%94%D7%9C%D7%99%D7%9B%D7%99%D7%9D%20%D7%9E%D7%A9%D7%A4%D7%98%D7%99%D7%99%D7%9D/2023/1990-02-23%20%D7%90%D7%91%D7%A8%D7%90%D7%94%D7%99%D7%9D%20%D7%91%D7%93%D7%90%D7%A8%D7%99%D7%9F/%D7%A4%D7%A1%D7%A7%20%D7%93%D7%99%D7%9F.pdf&parent=/sites/syntaxOcrTest/DocLib1)",
    "contexts": [
      "על הדיווח והעסקה נשארת שלהם. בנוסף, ציין מר ליפוביצקי כי באמצעות התאגידים ניתן יהיה לדעת טוב יותר מהי תמונת ההיצע למול הביקוש בענף הבניה למגורים. מר שי סומך הדגיש כי החלופה של \"לשכות שירות\" שהעלה במפגש הקודם היא אחרת מהחלופה שנותחה על ידי מר ליפבוצקי. ד״ר חגי אטקס הציג התייחסויות והצעות לפתרון במספר נושאים, הנוגעים בפערי השכר של העובדים הפלסטינים העובדים בשטחים ואלו העובדים בארץ, ובאפשרות לקדם בניה מתועשת באמצעות מתן תעדוף בהקצאה לקבלנים העובדים בבניה מתועשת, ו/או בחיוב קבלנים או תאגידים לקיים הדרכות לעובדים. מר נתנאל לפידות ציין בהקשר זה כי קיימת החלטת ממשלה המדברת על הצורך בהכשרת עובדים פלסטינים.",
      "ע״י פרקליטות מחוז ירושלים\nאזרחי טלפון: 073-3920000\nבקשה מטעם העותר למחיקת עתירה\nעניינה של העתירה הוא בבקשת העותר להיכנס לישראל לצרכי תעסוקה ומניעה בטחונית .1 שהוטלה עליו ומונעת ממנו קבלת היתר תעסוקה.\nהמשיבים הודיעו ביום 27.2.23, לאחר הגשת העתירה, כי הוחלט על שיקול בחיוב של הסרת המניעה בחלוף שישה חודשים, בתנאים הרשומים במכתב המשיבים המצ״ב. לאור האמור, מבקש העותר למחוק את העתירה ולהורות על השבת האגרה בניכוי פריט 33 לתוספת לתקנות בתי המשפט (אגרות), תשס״ז - 2007.\n.2\n.3\nתמיר בלנק, עו״ד מ.ר. 30016 ב״כ העותר\nפסק דין\nכ״ו אדר תשפ״ג, 19/03/2023\nבקשה 3 בתיק 1990-02-23\nשו׳ נמרוד פלקס\nהעתירה נמחקת בזה. החזר אגרה לפי התקנות. הדיון מבוטל.\ndot כארם ׀\\כדאריך אבראהים 100:117% לבקשה ה -2\n*** נחתם דיגיטאלית ***\n19/03 2023 SUN 11:36 FAX\nמדינת ישראל",
      "בהמשך הדיון התייחסו מספר נציגי מעסיקים לקשיים שהתופעה מטילה עליהם ועל הצורך לקדם פתרונות בנושא. \nבסיכום, הודה יו״ר ועדת עובדים זרים למשתתפים ועל דעת יו״ר הועדה סיכם כי:\nהוועדה תבחן את האפשרות לקדם תיקון חקיקה שיסמיך את פקחי משרד העבודה לעיין בהיתרי שהייה של פועלים פלסטינים לצורך;\nהוועדה תבקש התייחסות בכתב ממשרדי הממשלה לענייני ממשקי העברת המידע ביניהן בכל הנוגע להפרות של תנאי ההיתר;\nהוועדה תבקש התייחסות לסיבה בגינה מחזיקי היתר גיל מבוגר, רשאים להיכנס לישראל ללא מעסיק רשום.\nרל״ש הפצ״ר: אודה על העברת הדיווח למפ״ע, כמקובל.",
      "19/03 2023 SUN 11:36 FAX\nמען: רח׳ קרן היסוד 29ב, ירושלים 9418818 דוא״ל: mail@lb-law.net\n001/002\nעת״מ 1990-02-23 בית משפט לעניינים מנהליים - ירושלים\nת.ז .: 855043568 שם: אבראהים בדארין\nפקס: טלפון: 056-9795027\nדוא״ל: מען: סמוע - נפת חברון\nתאריך: 19.3.23\nהעותר\nמ.ר .: 30016\nשם: עו״ד תמיר בלנק\nפקס: 03-5214947\nטלפון: 02-6222808\nב״כ העותר\n-נגד-\nמדינת ישראל\nהמשיב\n1. המפקד הצבאי לאזור הגדה המערבית 2. המנהל האזרחי לאזור יהודה ושומרון 3. שירות הביטחון הכללי\nמען: רח׳ מח״ל 7, ירושלים 9149301\nת.ד. 49333\nדוא״ל: Min-jer@justice.gov.il\nמ.ר .: לא ידוע\nפקס: 02-6468053\nע״י פרקליטות מחוז ירושלים\nאזרחי טלפון: 073-3920000\nבקשה מטעם העותר למחיקת עתירה\nעניינה של העתירה הוא בבקשת העותר להיכנס לישראל לצרכי תעסוקה ומניעה בטחונית .1 שהוטלה עליו ומונעת ממנו קבלת היתר תעסוקה.",
      "מעבר לאמור, יצוין כי בהנחיית ועדת המנכ\"לים הקבועה למאבק בסחר בבני אדם, בשנתיים האחרונות פעלו צוותים בין-משרדיים במטרה לגבש תכנית ליישום התכנית הלאומית החדשה, בהתאם להחלטת ממשלה מספר 4463 מיום 13.1.19. במסגרת עבודת צוות המניעה השתתפו נציגים מטעם משרדי הממשלה הרלוונטיים, מטעם ארגונים לא ממשלתיים, מטעם האקדמיה, מטעם ארגוני מעסיקים ועובדים ועוד. הצוות עסק בנושא מניעת תופעות של סחר ועבדות, ביחס לאוכלוסיות פגיעות שונות, ובהן קבוצת העובדים הפלסטיניים שעובדים בישראל. הצוות נמצא בשלבי גיבוש סופיים של המלצותיו, כאשר בעקבות דיון ייעודי שעסק בנושא העובדים הפלסטינים, אחת ההמלצות שהייתה מוסכמת על כלל חברי הצוות, היא להקים צוות לטיוב האכיפה של תופעות ניצול שונות בהקשר לעובדים פלסטיניים בישראל, לרבות תופעת הסחר בהיתרי העסקה.",
      "002/002\nלכבוד:\nעו״ד תמיך בלנק\nבאמצעות דוא״ל: mail@lb-law.net\nהנדון: עת״מ 1990-02-23 אברהים בדארין נ׳ המנהל האזרחי באיו״ש\n1. עניינה של העתירה שבנדון הוא בקשה להסרת מניעה ביטחונית וקבלת היתר כניסה לישראל\nלצורך תעסוקה.\n2. הריני להודיעך כי לאחר בחינה של כלל המידע בעניינו של העותר הנדון ולאור מכלול הנסיבות הכרוכות בעניין, הודיעו גורמי הביטחון המקצועיים הרלוונטיים כי הם מתנגדים לעת הזאת להסרת המניעה, אך נכונים לשקול את בקשת מרשך לחיתר תעסוקה בחיוב, בתום שישה חודשים - ככל שבחלוף תקופה זו לא יתווסף מידע חדש לחובתו. מובהר כי יהיה על העותר להגיש בקשה חדשה לצורך העניין.\n3. בנסיבות אלה, נודה על מחיקת העתירה ללא צו להוצאות.\nאלישבע מגורי (צדוק) נציגת היועצת המשפטית לממשלה פרקליטות מחוז ירושלים - אזרחי",
      "מעבר לאמור, יצוין כי בהנחיית ועדת המנכ\"לים הקבועה למאבק בסחר בבני אדם, בשנתיים האחרונות פעלו צוותים בין-משרדיים במטרה לגבש תכנית ליישום התכנית הלאומית החדשה, בהתאם להחלטת ממשלה מספר 4463 מיום 13.1.19. במסגרת עבודת צוות המניעה השתתפו נציגים מטעם משרדי הממשלה הרלוונטיים, מטעם ארגונים לא ממשלתיים, מטעם האקדמיה, מטעם ארגוני מעסיקים ועובדים ועוד. הצוות עסק בנושא מניעת תופעות של סחר ועבדות, ביחס לאוכלוסיות פגיעות שונות, ובהן קבוצת העובדים הפלסטיניים שעובדים בישראל. הצוות נמצא בשלבי גיבוש סופיים של המלצותיו, כאשר בעקבות דיון ייעודי שעסק בנושא העובדים הפלסטינים, אחת ההמלצות שהייתה מוסכמת על כלל חברי הצוות, היא להקים צוות לטיוב האכיפה של תופעות ניצול שונות בהקשר לעובדים פלסטיניים בישראל, לרבות תופעת הסחר בהיתרי העסקה.",
      "כ״ו אדר תשפ״ג, 19/03/2023\nבקשה 3 בתיק 1990-02-23\nשו׳ נמרוד פלקס\nהעתירה נמחקת בזה. החזר אגרה לפי התקנות. הדיון מבוטל.\ndot כארם ׀\\כדאריך אבראהים 100:117% לבקשה ה -2\n*** נחתם דיגיטאלית ***\n19/03 2023 SUN 11:36 FAX\nמדינת ישראל\nמשרד המשפטים פרקליטות המדינה פרקליטות מחוז ירושלים (אזרחי) רח׳ מח״ל 7, ירושלים ת.ד. 49333 טלפון: 073-3928000 פקס: 02-6468056 תאריך: 27 פברואר 2023 יום שני ו' אדר תשפ״ג\n002/002\nלכבוד:\nעו״ד תמיך בלנק\nבאמצעות דוא״ל: mail@lb-law.net\nהנדון: עת״מ 1990-02-23 אברהים בדארין נ׳ המנהל האזרחי באיו״ש\n1. עניינה של העתירה שבנדון הוא בקשה להסרת מניעה ביטחונית וקבלת היתר כניסה לישראל\nלצורך תעסוקה.",
      "מעבר לאמור, יצוין כי בהנחיית ועדת המנכ\"לים הקבועה למאבק בסחר בבני אדם, בשנתיים האחרונות פעלו צוותים בין-משרדיים במטרה לגבש תכנית ליישום התכנית הלאומית החדשה, בהתאם להחלטת ממשלה מספר 4463 מיום 13.1.19. במסגרת עבודת צוות המניעה השתתפו נציגים מטעם משרדי הממשלה הרלוונטיים, מטעם ארגונים לא ממשלתיים, מטעם האקדמיה, מטעם ארגוני מעסיקים ועובדים ועוד. הצוות עסק בנושא מניעת תופעות של סחר ועבדות, ביחס לאוכלוסיות פגיעות שונות, ובהן קבוצת העובדים הפלסטיניים שעובדים בישראל. הצוות נמצא בשלבי גיבוש סופיים של המלצותיו, כאשר בעקבות דיון ייעודי שעסק בנושא העובדים הפלסטינים, אחת ההמלצות שהייתה מוסכמת על כלל חברי הצוות, היא להקים צוות לטיוב האכיפה של תופעות ניצול שונות בהקשר לעובדים פלסטיניים בישראל, לרבות תופעת הסחר בהיתרי העסקה.",
      "4 אבקש מכב' בית המשפט לדלות ולחקור את חבריי מהמערכת הביטחונית לגבי איזה סיכון, איזה\n5 פוטנציאל, איזה אינדיקציות ביטחוניות יש להם שמאיינות את כניסתו לישראל. אני מסכים שבית המשפט ישמע במעמד צד אחד את נציגי גורמי הביטחון ויעיין בחומר החסוי. לפני שנצא מאולם בית המשפט, ברצוני רק לציין שכלפני שבועיים פנו אליו גורמי הביטחון והציעו לו לשתף איתם פעולה וככל שישתף ידאגו להסיר לו המניעה. אני מבין שיש מתח באיזון בין שני הצדדים, תקבל אבל רק אם תיתן לנו איזושהי תמורה. העסק עובד. אפשר לפתח אותו יותר.\n6\n7\n8\n9\n10\n11\nבאי-כוח העותר יוצאים מאולם בית המשפט. בית המשפט שומע במעמד צד אחד את נציגי השב״כ ומעיין בחוות דעת סודית המסומנת \"א\". לאחר חזרת באי-כוח העותר לאולם.\n12\n13\n14\n15 בית המשפט: לאחר שעיינתי בחוות הדעת הסודית ונספחיה ושמעתי תשובות והסברים משלימים מנציגי השב״כ, ראיתי לתקן ולהרחיב את האמור בסעיפים 4 ו-33 לכתב התגובה, באשר לעילת 18\n17"
    ]
  },
  {
    "question": "נועץ שאל אותי אם יש בעיה לקיים אימונים בשטח אש 918. הוא יכול?",
    "reference_answer": "·       פסק הדין בעתירות העקרוניות, מאפשר הלכה למעשה לשוב ולהתאמן בדרום-מזרח שטח אש 918. זאת, כמובן, תוך נקיטת מקסימום האמצעים הנדרשים לשמירה על חיייהם ורכושם של השוהים בשטח. ",
    "rag_answer": "המידע הנוגע לשאלה האם ניתן לקיים אימונים בשטח אש 918 אינו מופיע במקורות שסופקו. על מנת לספק תשובה מדויקת, יש צורך במידע נוסף או במקורות נוספים.",
    "contexts": [
      "68. האמור לעיל, מקובל בתיקים מסוג זה. לעניין זה ראו את פסק הדין של בית משפט נכבד זה אשר ניתן בעת האחרונה, בנסיבות דומות, בעת״ם (מחוזי י-ם) 26355-09-20 סלאמה אחמה כעאבנה נ׳ ראש המנהל האזרחי (פורסם בנבו, 11.9.20), כדלקמן:\n\"המשיבים מבקשים כי יינתן צו המקפיא את המצב הקיים, בגדרו ייאסר על העותרים להוסיף ולבצע שינויים או תוספות כלשהן בבינוי עד לאחר הכרעה בעתירה. ציווי הדדי כאמור מקובל בתיקים מסוג זה, ומשכך ניתן בזה צו כאמור, האוסר על העותרים לבצע שינויים או תוספות כלשהן בבינוי. הואיל ובשלב זה תוקף הצו הארעי שניתן לבקשת העותרים הוא עד להחלטה אחרת, אף תוקפו של הציווי המקפיא את הבנייה במקום יהיה עד להחלטה אחרת. מובהר, כי ככל\n9-0026-6845\nבלמ״ס\nבלמ״ס\n-12-\nשתנאי זה לא יקוים, יתבטל הצו הארעי שניתן לבקשת העותרים\" [ההדגשות הוספו].",
      "מאת: Sylvia Piterman [mailtooritp@inter.net.il] נשלח: Thursday, June 9, 2022 12:53 PM אל: מנהא״ז/אג״מ/הסרות מניעה - אבי <מנהא״ז/אג״מ/מפקד מוקד הסרות מניעה - עידו;<JJ.hasarot@mnz.gov.il << m.m.hasarot@mnz.gov.il\nנושא: [WARNING: UNSCANNABLE EXTRACTION FAILED]Re: בקשה להסרת מניעה בטחונית של פראס עווד אחמד פארס, ת״ז 853708329\nבקשה זו לא הועברה לאבחון.\nאנא אישורכם על קבלת הבקשה וטיפולכם.\nסילביה\nOn 31/05/2022 12:23, Sylvia Piterman wrote: 31.5.2022 שלום, רצ״ב הבקשה שבשורת הנושא. אנא אישורכם על קבלת הבקשה וטיפולכם. בתודה, סילביה\nhttps://outlook.office.com/mail/Popu.Ayosh@idf.il/id/AAQkADIkOTBkZmM2LTBhYTktNGJIOS05ZGExLWFmNWJjNzZiOTg2NgAQAOIfTG9YCiJG ... 1/1",
      "*** לשאלות נוספות ניתן להתקשר לנייד 050-5388173 ***\nבכבוד רב,\n.. אפן הנדסה בע״מ ח.פ. 514111954\nאורן עמר\n2\nn\n1\nיפוי כח\nאני הח״מ אסחאק דגאמין ת.ז. 939258364 ממנה בזה את שאדי פראג׳, עו״ד ו/או אבראהים קאסם, עו״ד (כולם ביחד וכל אחד מהם לחוד) להיות באי כחי במשפט שלי בעניין מניעה / הגבלה",
      "2. המנהל האזרחי לאזור יהודה ושומרון\n3. שירות הביטחון הכללי\nמען\nמספר זיהוי:\nרח׳ מח״ל 7, ירושלים 9149301 ת.ד. 49333 דוא״ל:\nלא ידוע\nשם:\nע״י פרקליטות מחוז ירושלים אזרחי\nפקס:\nMin-jer@justice.gov.il\n02-6468053\nטלפון:\n073-3920000\nכ״ד טבת תשפ״ב, 28/12/2021חלטה תיק 986-12-21 שו׳ משה סובל\nבית המשפט הנכבד מתבקש להורות למשיבים: להסיר את המניעה הבטחונית של העותר. (1 להנפיק לעותר אישורי כניסה לישראל לצורכי עבודה לפי הנהלים הקיימים, (2 בקשה ממעסיק.\n1. דיון מוקדם בעתירה, לפי תקנה 8 לתקנות בתי משפט לעניינים מינהליים, יתקיים ביום 17.1.22 בשעה 10:15.\nהדיון יתקיים בשלוחה החדשה של בית המשפט המחוזי בירושלים, בכתובת: רח׳ יפו 97, מרכז כלל, קומה 6, ירושלים. 2. לדיון יתייצבו נציגי השב״כ, ובמהלכו יוצג לבית המשפט החומר החסוי העומד ביסוד המניעה הביטחונית, ככל שתינתן לכך הסכמת ב״כ העותר במהלך הדיון.\nעניינה של העתירה",
      "טלפון:\n073-3920000\nבית המשפט הנכבד מתבקש להורות למשיבים: להסיר את המניעה הבטחונית של העותר. (1 להנפיק לעותר אישורי כניסה לישראל לצורכי עבודה לפי הנהלים הקיימים, בכפוף להגשת (2 בקשה ממעסיק.\nעניינה של העתירה א.\nזכותו של אדם לעבוד - להחל לעבוד ולהמשיך ולעבוד - זכות- של-תשתית היא. שקולה היא לזכות טבעית. אכן, הכתוב לימדנו שעונש הוא שהשית אלוהים על האדם באומרו לו כי \"בְּנֵעַת אַפֶּיךָ תּאכַל לֶחֶם\" (בראשית, ג, יט [ג]), ואולם, כולנו ידענו כי בימינו - כך היה גם בימים שקדמו לימינו - העבודה סם-חיים היא לאדם. אדם שעבודתו ניטלה ממנו - זכות ניטלה ממנו, מקצת כבודו ניטל ממנו (כבוד השופט חשין בדעת מיעוט, דנג״ץ 4191/97 רקנט נ׳ בית הדין הארצי לעבודה (10.12.00)).\nעניינה של עתירה זו בקשתו של העותר, כי יתאפשר לו קיום בכבוד ויותר לו למצוא את פרנסתו בישראל לשם הוא נזקק להגיע לצורך עבודתו.\nשי מניעים 'משאראת אימן 1290 1713.4עתנ -בשאראל -ביטוח . על מין קים |",
      "מדינות שהן צד באמנה זו מכירות בזכות לעבודה, הכוללת את זכותו של כל אדם להשיג אפשרות להשתכר למחייתו בעבודה שיבחר בה, או יקבלנה, באורח חופשי, והן ינקטו צעדים מתאימים כדי להבטיח זכות זו.\nוראו גם סעיף 11 לאמנה המחייב לדאוג לרמת חיים נאותה לכל אדם. 23.4. סעיף 39 לאמנת ג׳נבה הרביעית (1949) קובע:\nמוגנים, שאיבדו, עקב המלחמה, את פרנסתם, תינתן להם ההזדמנות למצוא עבודה בשכר ... 23.5. תקנה 43 לתקנות האג, כפי שפורשה בבג״צ 393/82 ג׳מעית אסכאן אלמעלמון נ׳ מפקד כוחות צה״ל, פ״ד לז (4) 785, 797 מחייבת את המפקד בכיבוד וטיפוח החיים האזרחיים והכלכלה של האזור. בעניין זה נאמר:",
      "25.2. בהמשך דבריו נותן השופט חשין דוגמא מבג״ץ 188/53 אבו גוש נ׳ המפקד הצבאי בפרוזדור ירושלים, פ״ד ז (2) 941, 943, שם נקבע כי:\nאין כל קסם במילים 'טעמי ביטחון' ו 'מצב ביטחוני' וכל כיוצא בביטויים אלה, כדי הצדיק את פעלה של הרשות המוסמכת ולמנוע בית משפט זה מלעמוד על צדקתם של דברים ומעשים. אם יתחוור לו, לבית המשפט, כי מילים אלה משמשות רק מסך-הסוואה לשרירות לב, למעשי זדון ולכוונות בלתי חוקיות, לא יהסס לקבוע זאת ברורות וגלויות, לשם האמת, כדי שייעשה צדק לאזרח שנפגע ללא חוק. 25.3. בענייננו יטען העותר, כי לא נעשה איזון ראוי שכזה, או לא נעשה איזון כלל.\nסוף דבר ז. לאור כל האמור, מתבקש בית המשפט הנכבד להורות כמבוקש בכותרת העתירה. .26\nכמו כן, מתבקש בית המשפט הנכבד להורות על קיום הדיון בעניינו של העותר בהקדם\n.27\nהאפשרי.",
      "02-6468053\nטלפון:\n073-3920000\nבית המשפט הנכבד מתבקש להורות למשיבים: להסיר את המניעה הבטחונית של העותר. (1 להנפיק לעותר אישורי כניסה לישראל לצורכי עבודה לפי הנהלים הקיימים, בכפוף להגשת (2 בקשה ממעסיק.\nעניינה של העתירה א.\nזכותו של אדם לעבוד - להחל לעבוד ולהמשיך ולעבוד - זכות- של-תשתית היא. שקולה היא לזכות טבעית. אכן, הכתוב לימדנו שעונש הוא שהשית אלוהים על האדם באומרו לו כי \"בְּזֵעַת אַפֶּיךָ תּאכַל לֶחֶם\" (בראשית, ג, יט [ג]), ואולם, כולנו ידענו כי בימינו - כך היה גם בימים שקדמו לימינו - העבודה סם-חיים היא לאדם. אדם שעבודתו ניטלה ממנו - זכות ניטלה ממנו, מקצת כבודו ניטל ממנו (כבוד השופט חשין בדעת מיעוט, דנג״ץ 4191/97 רקנט נ׳ בית הדין הארצי לעבודה (10.12.00)).\nעניינה של עתירה זו בקשתו של העותר, כי יתאפשר לו קיום בכבוד ויותר לו למצוא את פרנסתו בישראל לשם הוא נזקק להגיע לצורך עבודתו.",
      "מבלי לפגוע בכלליות חמינוי הנ״ל יהיה בא כחי רשאֵי 'לעשות וֹלפעול בשמי ובמקומי בכל הפעולות הבאות, כולן או מקצתן כדלקמן:\n2. تنفيذ أي فعالية ينص عليها القانون أو أي إجراءات ) تتغلق بللموضوع المذكور\n3. الطلب والحصول على أي تقرير طبي نقص وضعي الصحي واز آلنامیلی من اى طبيب مؤسسه: فحصتني أو أني تقرير أخر يتعلق باللوجرغ المذكور أعلاه :\n1: לחתום על ולהגיש בשמי כֹל חליך הנוגע או הנובע מחנושא הנ״ל: ללא יוצא מן הכלל. 2: לבצע כִלֶ פעוֹלֵות בתוקף כל חוק אוּ פרוֹצְדוֹרֹה אחרת שחלהַ או שתחול על ההליך הנ״ל. .3 לבקש ולקבל חוות דעת רפואית על מצב בריאותי ו/או שִׁיקומֵי מכל רופא אוֹ מוסד שבדק אותי אוֹ כּלִ חוות דעת אחרת הנוגעת לעִנִייוֹ תִנִייל. .4 להופיע בשמי. וּליֵיצגני בקשר לכל אחת מהפעולות הנ״ל בפני כל בית דין למיניהם או רשויות ומוסדות אחרים הן ממשלתיים: והן אחרים, עד לדרגתם האחרונה. למסור כל ענין הנוגע או הנובע מהענין־ .5",
      "02-6468053\nטלפון:\n073-3920000\nבית המשפט הנכבד מתבקש להורות למשיבים: להסיר את המניעה הבטחונית של העותר. (1 להנפיק לעותר אישורי כניסה לישראל לצורכי עבודה לפי הנהלים הקיימים, בכפוף להגשת (2 בקשה ממעסיק.\nעניינה של העתירה א.\nזכותו של אדם לעבוד - להחל לעבוד ולהמשיך ולעבוד - זכות- של-תשתית היא. שקולה היא לזכות טבעית. אכן, הכתוב לימדנו שעונש הוא שהשית אלוהים על האדם באומרו לו כי \"בְּזֵעַת אַפֶּיךָ תּאכַל לֶחֶם\" (בראשית, ג, יט [ג]), ואולם, כולנו ידענו כי בימינו - כך היה גם בימים שקדמו לימינו - העבודה סם-חיים היא לאדם. אדם שעבודתו ניטלה ממנו - זכות ניטלה ממנו, מקצת כבודו ניטל ממנו (כבוד השופט חשין בדעת מיעוט, דנג״ץ 4191/97 רקנט נ׳ בית הדין הארצי לעבודה (10.12.00)).\nעניינה של עתירה זו בקשתו של העותר, כי יתאפשר לו קיום בכבוד ויותר לו למצוא את פרנסתו בישראל לשם הוא נזקק להגיע לצורך עבודתו."
    ]
  },
  {
    "question": "אני רואה מלא מסמכים שמדברים על ״העתירות העקרוניות״ של שטח אש 918. מה הם?",
    "reference_answer": "·       מיד לאחר-מכן, בשנת 2013 הוגשו העתירות העקרוניות העוסקות בשטח אש 918. העתירות העקרוניות, התמקדו גם הן בחוקיות צו הסגירה ובשאלת תושבות הקבע של התושבים המתגוררים בחלקו הדרום-מזרחי של שטח האש (שכן כאמור, ביחס לעותרים שהתגוררו בחלקו הצפון-מערבי של שטח האש, החליט שר הביטחון שלא לפנותם מן השטח). ביום 4 במאי 2022 נדחו העתירות העקרוניות, תוך שקבע בית המשפט בפסק דינו כי התושבים הפלסטיניים המתגוררים בשטח אש 918 אינם תושבי קבע בשטח, וכי ההכרזה על שטח אש 918 כשטח סגור על ידי המפקד הצבאי, נעשתה כדין. ",
    "rag_answer": "העתירות העקרוניות של שטח אש 918 מתייחסות למאבק המשפטי המתמשך בנוגע לשטח אש 918, אזור בדרום הר חברון שהוכרז כשטח אש על ידי הצבא. העתירות עוסקות בזכויות התושבים הפלסטינים המתגוררים באזור זה ובמאבקם נגד פינוי והריסת בתיהם.\n\nלצערי, המידע המפורט על העתירות העקרוניות של שטח אש 918 אינו מופיע במקורות שסופקו. אם יש לך מסמכים נוספים או פרטים נוספים, אשמח לעזור יותר.",
    "contexts": [
      "עוד על השלכות השיהוי במישור הנזק הראייתי ניתן ללמוד מדבריו של השופט עמית בע\"א 2919/07 מדינת ישראל - הוועדה לאנרגיה אטומית נ' עדנה גיא-ליפל (פורסם בנבו, 19.9.2010) (ההדגשה נוספה – הח\"מ):",
      "תצהיר\nאני הח״מ, 6 לק' אש 43420903, לאחר שהוזהרתי כי עליי לומר את האמת וכי אם לא אעשה כן אהיה צפוי לעונשים הקבועים בחוק, מצהיר בזאת כלהלן: .1 אני משמש בתפקיד כל מחקר כלאי בעה האוצרת׳.\nתצהירי זה ניתן לתמיכה הסיכומים מטעם המשיבים בעע״מ 3892/20 (להלן: סיכומי\nהמשיבים). .2\nהעובדות המפורטות בסיכומי המשיבים והנוגעות למינהל האזרחי, הן אמת למיטב ידיעתי ואמונתי, וידועות לי מתוקף תפקידי.\n.3\nזה שמי, זו חתימתי ותוכן תצהירי אמת. .4\nאישור\nכנגו/ 02 הופיע בפני מר עו״ד, מאשר בזה כי ביום\nאני הח״מ, 3בק3/2+ 3, ולאחר שהזהרתיו כי שזיהה עצמו בפני באמצעות ת״ז INN 923\nעליו לומר את האמת, שאם לא יעשה כן יהיה צפוי לעונשים הקבועים בחוק, חתם בפני על\nתצהירו.\nדביר פרץ עו״ד מספר רישיון: 85707",
      ".20\nשבט הביקורת השיפוטית.\nראה בהקשר זה הדברים הבאים, שנאמרו בבג״צ 758/88,431/89 - קנדל ריצ׳רד ו-10 אח׳ נ׳ שר הפנים, פ״ד מו (4), 505, עמ׳ 526-527, והמובאות והאסמכתאות שם, ואשר יפים הם עד מאוד לענייננו; \" ... ואולם יש שיעלה בידו של עותר לשכנע את בית המשפט בפסלות שיקוליה של הרשות, גם אם פטורה היא מהנמקה או שמסתייעת היא בחסיון מטעמיי ביטחון. ואמנם כך היה בשכבר הימים, בבג״צ 188/53 אבו גוש נ׳ המפקד הצבאי בפרוזדור ירושלים, פ״ד ז (2) 941. באותו עניין הוצאו צווי הגלייה ואלו הוצדקו בטעמיי ביטחון (נזכור כי נושא החסיון לא נתמסד עדיין באותה עת, לא בהלכה ולא בדין החרות). לעניין אותם טעמיי ביטחון הוסיף שר הביטחון ונתן תעודה ולפיה \"הנימוקים אשר גרמו להוצאות הצווים ... מהווים חומר אשר מטעמי בטחון וטובת המדינה אין לגלותו לבית המשפט\" (ניתן דעתנו: \"אין",
      "כפי שיובהר להלן, העותר אינו עומד גם בקריטריונים העדכניים שפורסמו לציבור תושבי האיזור.  \nבמהלך חודש השנה, הוחלט להרחיב את הקריטריונים להגשת בקשה כבעניינו של העותר. כך לדוגמא, בהתאם לקריטריונים העדכניים רשאים רווקים שעברו את גיל 27 להגיש בקשת היתר כניסה לישראל למטרות עבודה בענף הבניין. \nאמנם, הקריטריונים החדשים טרם עודכנו באופן רשמי בנוהל סטטוס הרשאות הידוע, והם יתווספו לנוהל במועד פרסומו של הנוהל המעודכן, אך מכל מקום, הקריטריונים העדכניים הובאו, כנהוג, לידיעת תושבי האזור, באמצעות מערך הקישור הפלסטיני, ואף פורסמו בעמוד הפייסבוק של המינהל האזרחי. \nצילום הפרסום מדף הפייסבוק של המשיבה מצורף כנספח א'.  \nיודגש כי הרחבת הקריטריונים העדכניים אינם משנים את מצבו של העותר שבשל גילו ומצבו המשפחתי אינו זכאי להגשת בקשת היתר כניסה לעבודה בענף הבניין.",
      "צילום הפרסום מדף הפייסבוק של המשיבה מצורף כנספח א'.  \nיודגש כי הרחבת הקריטריונים העדכניים אינם משנים את מצבו של העותר שבשל גילו ומצבו המשפחתי אינו זכאי להגשת בקשת היתר כניסה לעבודה בענף הבניין. \n באשר לטענות ב\"כ העותר כי בעניינו של העותר בעת\"ם 21697-10-22 מנצור נ' מפקד כוחות צה\"ל באיו\"ש  בחנה המשיבה את בקשת העותר שם, על אף שלא עמד בקריטריונים, תבקש המשיבה להעמיד דברים על דיוקם. \nאומנם בתגובה המקדמית שהוגשה מטעם המדינה נכתב כי: ''העותיליינו עומד בתנאי הסף לכניסה לישראל לצרכי תעסוקך בקשתו נבחנה באופן פרטני.\" מדובר בניסוח שאינו מדויק, ואינו משקף את  הדברים כהוויתם. \nכאמור לעיל, הקריטריונים לקבלת היתר כניסה לישראל עודכנו והורחבו. לעניינו הנוהל העדכני מחריג רווקים החל מגיל 22 שאביהם מחזיק בהיתר עבודה בענף הבניין, ומאפשר להם להגיש בקשת היתר כניסה לעבודה בענף הבניין.",
      "אציין כי איני רואה בסתירה זו כל חשיבות לבירור הטענות.\nלבד מן האמור, אני מתרשמת שמלוא הנתונים נמצאים בפניכם ואני מפנה אותך לסעיפים 2-6 לעתירה ולאחר מכן לפרק העוסק במיצוי ההליכים (סעיפים 24-27 לעתירה).\nהתרשמתי שהשתלשלות האירועים מפורטת שם באופן בהיר. למען הנוחות, אחזור על עיקרי הדברים:\nביום 27.10.22 הגשנו בקשה להסרת המניעה (נשלחה שוב ב 30.10.22 כי לא קיבלנו כל מענה או אישור",
      "כאמור לעיל, הקריטריונים לקבלת היתר כניסה לישראל עודכנו והורחבו. לעניינו הנוהל העדכני מחריג רווקים החל מגיל 22 שאביהם מחזיק בהיתר עבודה בענף הבניין, ומאפשר להם להגיש בקשת היתר כניסה לעבודה בענף הבניין. \nכיוון שאביו של העותר בעת\"מ מנצור אכן מחזיק בהיתר עבודה בענף הבניין, נבחנה בקשתו של העותר להסרת מניעה על ידי הגורמים הביטחוניים.מאידך, מצבו של העותר כאן לא השתנה גם לאחר עדכון הקריטריונים, ומשכך אין מקום לבחינת בקשתו להסרת מניעה ביטחונית.\nיודגש כי גם לו תיבחן בקשת העותר להסרת המניעה ותתקבל, כיוון שכאמור העותר לא עומד בקריטריונים העדכניים לא תותר כניסתו לישראל, ואין כל טעם להעברת בקשתו לבחינת הגורמים הביטחוניים. \nלאור האמור, שבה ומבקשת המדינה את בית המשפט הנכבד להורות על סילוק העתירה על הסף, תוך חיוב העותר בהוצאות המשיבה .",
      "אפשר לקחת גם את האירועים שפירטתי קודם - גל הפיגועים ב -- 2016 2015, ב-2014, כלל הנתונים מאז 2003 עם מעורבות של אחמ״שים בפח״ע כזה או אחר, ולפרק אותם. חלקם נמצאים בטבלה שלפניכם. הדלתא שעושים בין אחמ״שים דור ב׳ לאחמ״שים דור א׳, לא רלוונטית בעיניי. להפך, היא רק מראה את הסיכון. אנחנו רואים עד כמה אותה אוכלוסייה מדור ב׳ מעורבת בפיגועים, ולמה פוטנציאל הפיגועים ופוטנציאל הטרור יותר גבוה.\nבסיכומן של הדקות הקצרות האלה, אנחנו חושבים שמבחינה ביטחונית, הוראת השעה הזאת חשובה לשנה הקרובה, וחשוב להתקדם איתה\". (בעמ׳ 51-50).\n80. בהמשך לכך נערך שיח ער בין סגן ראש השב״כ לחברי הכנסת, כאשר חלק מחברי הכנסת ביקשו פילוח נוסף של נתוני השירות (ראו למשל, דברי חה״כ מראענה בעמ' 58, דברי חה״כ רוטמן בעמ׳ .(68",
      "תאריך החתימה על המסמך: ‏27 דצמבר 2022\nבבית משפט המחוזי בירושלים\t\t\t\tעת\"מ 20387-10-22\nבשבתו כבית משפט לעניינים מנהליים\nבפני כבוד השופט  משה סובל, סגן נשיא\t\n\n\nעותר\t\t \n\t\t\t\tחמזה פזע, ת\"ז 405301854\n\tע\"י ב\"כ עו\"ד  יהונתן קמיל ואח' , מ\"ר עו\"ד74464\nמרח' היסמין 6 (מתחם ת.דלק 10) אזור תעשייה אריאל מערב .\nטל:050-6794549 פקס:03-7399356 \n\t\t\t\t-  נ  ג  ד  -\nמשיבה\t\t \tמדינת ישראל - המנהל האזרחי באיו\"ש\n\t\t \tע\"י פרקליטות מחוז ירושלים - אזרחי\n\t\t \tמרח' מח\"ל 7, ירושלים  9149301 ת\"ד 49333\n\t\t \tטל': 073-3920000 פקס: 02-6468053\n\t\t \tכתובת דוא\"ל: ez-jer@justice.gov.il\n\t \n\t \n \n\nהמועד האחרון להגשה:27.12.22\nהודעה מטעם המשיבה\nבהמשך להחלטת בית המשפט הנכבד מיום 14.12.22 , ולדיון שהתקיים באותו מועד, מתכבדת המשיבה למסור עמדתה באשר להצעת בית המשפט, לאפשר לעותר להגיש בקשה להסרת המניעה הביטחונית על אף שאינו עומד בקריטריוני הסף לקבלת היתר כניסה לישראל.",
      "5. האם זו הדדיות? האם זה איזון כלכלי\\פרנסתי הוגן כלפי פוטנציאל המדריכים הפלשתינים שהוסמכו - (לאחר שעברו קורס מדריכים בן שנתיים) - אל מול נחשול של מיליוני תיירים ב- 2019 - עם צפי גידול מרשים לשנים הבאות ??\n6. הרי פער אבסורדי זה בין אלפי מדריכי התיירים הישראלי הנהנה מגישה חופשית זו לתחומי הרשות - ובעיקר לאזור בית לחם ואתרי הקדושה לנצרות - מול המספר הזעום של מקביליהם הפלשתיני המורשה להדריך בתחומי ישראל - מקבל משנה תוקף כאשר אנו\nבוחנים את מספר המדריכים הישראלים הפעילים כיום במרחב המשותף - ומתפרנסים מגישה חופשית לאתרי התיירות בגדה, וזאת עפ״י פרסומי משרד התיירות: 7000 מדריכים ישראלים פעילים מתוך 8400 רשומים!"
    ]
  }
]